product_id,product_name,product_url
60,"Trà thảo dược Kamigan không đường 290ml thanh nhiệt, lợi tiểu, mát gan",https://nhathuoclongchau.com.vn/cham-soc-ca-nhan/tra-thao-duoc-kamigan-290-ml-khong-duong.html
61,"Trà thảo dược Kamigan 290ml thanh nhiệt, lợi tiểu, mát gan ",https://nhathuoclongchau.com.vn/cham-soc-ca-nhan/tra-thao-duoc-kamigan-290-ml.html
62,"Bột điện giải vị chanh dây Kamizol Sports Drink Powder 25g cung cấp năng lượng, chất điện giải cho cơ thể (5 gói)",https://nhathuoclongchau.com.vn/cham-soc-ca-nhan/bot-dien-giai-vi-chanh-day-kamizol-sport-drink-powder-5-goi-x-25-g.html
63,"Miếng dán mụn ban ngày DermaAngel Plus hỗ trợ hút dịch mủ, làm lành vết thương nhanh chóng (12 miếng)",https://nhathuoclongchau.com.vn/cham-soc-ca-nhan/mieng-dan-mun-ban-ngay-derma-angel-plus-hop-12-mieng-1.html
64,"Nước Yến Sào Cao Cấp Đông Trùng Hạ Thảo 15% bổ thận, chắc xương, bổ dưỡng sức khỏe (6 Lọ x 70ml)",https://nhathuoclongchau.com.vn/cham-soc-ca-nhan/nuoc-yen-sao-cao-cap-nunest-dong-trung-ha-thao-15-yen-6-hu-x-70-ml.html
65,"Nước Yến Sào Cao Cấp Nunest Relax Đông Trùng Hạ Thảo bổ thận, tăng miễn dịch, giảm căng thẳng mệt mỏi (6 Chai x 185ml)",https://nhathuoclongchau.com.vn/cham-soc-ca-nhan/nuoc-yen-sao-cao-cap-nunest-relax-dong-trung-ha-thao-5-yen-6-chai-x-185-ml.html
66,"Bọt vệ sinh phụ nữ Trầu Không Natural Feminine làm sạch, dưỡng ẩm, ngăn ngừa ngứa (160ml)",https://nhathuoclongchau.com.vn/cham-soc-ca-nhan/dung-dich-ve-sinh-phu-nu-dang-bot-natural-feminine-la-trau-khong-160-ml.html
67,"Trà Cà Gai Leo Kami tea hỗ trợ các bệnh về gan, giải độc gan, giảm men gan (20 túi)",https://nhathuoclongchau.com.vn/cham-soc-ca-nhan/tra-thao-duoc-ca-gai-leo-kami-tea-20-tui-loc-x-2-g.html
68,"Dầu Húng Chanh Lábebé hỗ trợ lợi phế trừ đờm, giảm ho (30ml)",https://nhathuoclongchau.com.vn/cham-soc-ca-nhan/dau-hung-chanh-ho-tro-loi-phe-tru-dom-giam-ho-labebe-30-ml.html
69,"Cao đuổi muỗi Ola Papi hỗ trợ phòng cảm lạnh và tránh gió, giảm sưng tấy khi bị côn trùng đốt (20g)",https://nhathuoclongchau.com.vn/cham-soc-ca-nhan/cao-duoi-muoi-cho-be-giam-sung-tay-do-con-trung-dot-ola-papi-20-g.html
70,Nước Hồng Sâm Đông Trùng Hạ Thảo BIOK bồi bổ sức khỏe và tăng sức đề kháng (10 chai x 100ml),https://nhathuoclongchau.com.vn/cham-soc-ca-nhan/nuoc-hong-sam-dong-trung-ha-thao-biok-10-chai-x-100-ml.html
71,"Nước yến sào cao cấp Nunest Kids vị chuối tăng cường sức khoẻ, ăn ngon (6 hũ x 70ml)",https://nhathuoclongchau.com.vn/cham-soc-ca-nhan/nuoc-yen-sao-cao-cap-cho-tre-em-nunest-kid-vi-chuoi-6-hu-x-70-ml.html
72,"Nước yến sào cao cấp Nunest Kid Grow vị cam hỗ trợ phát triển hệ xương, tăng cường sức khỏe (6 lọ x 70ml)",https://nhathuoclongchau.com.vn/cham-soc-ca-nhan/nuoc-yen-sao-cao-cap-cho-tre-em-nunest-kid-grow-vi-cam-6-hu-x-70-ml.html
73,"Nước Yến Sào Cao Cấp Nunest Kids bồi bổ cơ thể, tăng cường sức khỏe (4 hũ x 70ml) ",https://nhathuoclongchau.com.vn/cham-soc-ca-nhan/nuoc-yen-sao-cao-cap-cho-tre-em-nunest-kid-tang-cuong-suc-khoe-an-ngon-loc-3-1-70-ml.html
74,"Bột Thanh Nhiệt Datino mát gan, lợi tiểu, tăng cường sức đề kháng, giảm nhiệt miệng (10 gói)",https://nhathuoclongchau.com.vn/cham-soc-ca-nhan/bot-thanh-nhiet-datino-heat-relieving-drink-powder-10-goi-x-8-g.html
75,"Bao cao su Sagami Classic siêu mỏng, nhiều chất bôi trơn, không mùi (12 cái)",https://nhathuoclongchau.com.vn/cham-soc-ca-nhan/bcs-sagami-classic-sieu-mong-nhieu-gel-boi-tron-mau-da-khong-mui-12-cai-37460.html
76,"Bao cao su Sagami Love Me Gold siêu mỏng, trơn, không màu không mùi (10 cái)",https://nhathuoclongchau.com.vn/cham-soc-ca-nhan/bcs-sagami-love-me-gold-sieu-mong-tron-khong-mau-khong-mui-10-cai-37423.html
77,"Bông tẩy trang tròn KamiCare Cotton Pads thấm hút tốt giúp sạch bụi bẩn, tẩy tế bào chết trên da (120 miếng)",https://nhathuoclongchau.com.vn/cham-soc-ca-nhan/bong-tay-trang-tron-kamicare-120-mieng-37419.html
78,Tăm bông kháng khuẩn KamiCare hộp tròn dành cho trẻ em từ sơ sinh (200 que) ,https://nhathuoclongchau.com.vn/cham-soc-ca-nhan/tam-bong-so-sinh-kamicare-hop-tron-200-que---dau-bong-sieu-nho-37420.html
79,"Tăm bông kháng khuẩn KamiCare dành cho trẻ em 1 đầu xoắn 1 đầu thường vệ sinh tai, mũi (160 chiếc)",https://nhathuoclongchau.com.vn/cham-soc-ca-nhan/tam-bong-tre-em-kamicare-hop-tron-160-que---1-dau-xoan-1-dau-thuong-37421.html
80,"Tăm bông kháng khuẩn KamiCare vệ sinh tai, mũi (200 que)",https://nhathuoclongchau.com.vn/cham-soc-ca-nhan/tam-bong-nguoi-lon-kamicare-hop-tron-200-que---1-dau-xoan-1-dau-thuong-37422.html
81,Nước uống ion kiềm Kami-Ion PH9 Plus bổ sung các ion và khoáng chất (350ml),https://nhathuoclongchau.com.vn/cham-soc-ca-nhan/nuoc-uong-ion-kiem-kami-ion-ph9-350ml-37285.html
82,Nước Đông Trùng Hạ Thảo DongChungHaCho Plus Biok hỗ trợ tăng sức đề kháng (10 chai x 100ml),https://nhathuoclongchau.com.vn/cham-soc-ca-nhan/nuoc-dong-trung-ha-thao-dongchunghacho-plus-biok-10-chai-x-100ml-37171.html
83,"Trà Actisô Premium Ladophar hỗ trợ bảo vệ gan, tăng cường chức năng gan (20 túi x 2g)",https://nhathuoclongchau.com.vn/cham-soc-ca-nhan/tra-actiso-premium-ladophar-20-tui-loc-x-2g-37131.html
84,"Viên nghệ mật ong Royal Honey bổ sung dinh dưỡng, tăng cường đề kháng (250g)",https://nhathuoclongchau.com.vn/cham-soc-ca-nhan/vien-nghe-mat-ong-royal-honey-250g-36795.html
85,"Mật ong thiên nhiên Hoa Rừng Tây Bắc Royal Honey hỗ trợ bổ sung dinh dưỡng, tăng cường đề kháng (730g)",https://nhathuoclongchau.com.vn/cham-soc-ca-nhan/mat-ong-hoa-rung-tay-bac-royal-honey-730g-36798.html
86,"Nước bù điện giải Kamizol vị dâu hỗ trợ giải nhiệt, tăng cường đề kháng (250ml)",https://nhathuoclongchau.com.vn/cham-soc-ca-nhan/nuoc-bu-dien-giai-kamizol-vi-dau-250ml-36747.html
87,"Nước bù điện giải Kamizol vị chanh hỗ trợ giải nhiệt, tăng cường đề kháng (250ml)",https://nhathuoclongchau.com.vn/cham-soc-ca-nhan/nuoc-bu-dien-giai-kamizol-vi-chanh-250ml-36748.html
88,"Nước bù điện giải Kamizol vị cam hỗ trợ giải nhiệt, tăng cường đề kháng (250ml)",https://nhathuoclongchau.com.vn/cham-soc-ca-nhan/nuoc-bu-dien-giai-kamizol-vi-cam-250ml-36749.html
89,"Dung dịch vệ sinh phụ nữ Femfresh Intimate Skin Care Active Wash làm sạch, khử mùi hôi, thơm vùng kín (250ml)",https://nhathuoclongchau.com.vn/cham-soc-ca-nhan/dung-dich-ve-sinh-phu-nu-femfresh-intima-skin-care-active-wash-250ml-35758.html
90,Cao ống Actisô Ladophar hỗ trợ bảo vệ gan và giải độc gan (10 ống x 10ml),https://nhathuoclongchau.com.vn/cham-soc-ca-nhan/cao-ong-actiso-ladophar-10-ong-x-10ml-35715.html
91,"Gel bôi Aloclair Plus Gel giảm đau, kháng viêm và lành viêm loét khoang miệng (8ml)",https://nhathuoclongchau.com.vn/cham-soc-ca-nhan/aloclair-plus-gel-alliance-8ml-gel-boi-nhiet-mieng-tay-chan-mieng-cho-moi-lua-tuoi-35280.html
92,"Dung dịch vệ sinh phụ nữ Femfresh Soothing Wash làm sạch, khử mùi hôi, làm thơm vùng kín (250ml)",https://nhathuoclongchau.com.vn/cham-soc-ca-nhan/dung-dich-ve-sinh-phu-nu-femfresh-intima-skin-care-soothing-wash-250ml-35225.html
93,"Dung dịch vệ sinh phụ nữ Femfresh Daily Wash làm sạch, khử mùi hôi, làm thơm vùng kín (250ml)",https://nhathuoclongchau.com.vn/cham-soc-ca-nhan/dung-dich-ve-sinh-phu-nu-femfresh-intima-skin-care-daily-wash-250ml-35226.html
94,Nước Yến Sào Green Bird Babi hương vani giúp tăng cường đề kháng và hệ miễn dịch (4 hũ x 72g),https://nhathuoclongchau.com.vn/thuc-pham-chuc-nang/yen-sao-cho-tre-em-greenbabi-huong-vani-4-hu-x-72g-34821.html
95,"Nước Yến Sào chưng đường phèn Greenbird bồi bổ cơ thể, ngăn ngừa lão hóa (72g) ",https://nhathuoclongchau.com.vn/cham-soc-ca-nhan/yen-sao-chung-duong-phen-greenbird-72g-34823.html
96,"Tinh dầu vỏ bưởi dưỡng tóc Thảo Nguyên kích thích mọc tóc, ngừa rụng tóc (100ml)",https://nhathuoclongchau.com.vn/cham-soc-ca-nhan/tinh-dau-vo-buoi-duong-toc-thao-nguyen-100ml-34411.html
97,"Bao cao su Safefit Freezer Max S52 chứa nhiều gel làm mát, kéo dài thời gian (10 cái)",https://nhathuoclongchau.com.vn/cham-soc-ca-nhan/bcs-safefit-freezer-max-s52-10-cai-gel-mat-lanh-sang-khoai-34295.html
98,"Bao cao su Safefit 003 S52 siêu mỏng, không gây kích ứng, có chất bôi trơn (12 cái) ",https://nhathuoclongchau.com.vn/cham-soc-ca-nhan/bcs-safefit-003-s52-12-cai-sieu-mong-nhieu-silicon-34301.html
99,"Bao cao su Safefit 003 S52 siêu mỏng, không gây dị ứng, nhiều chất bôi trơn (3 cái)",https://nhathuoclongchau.com.vn/cham-soc-ca-nhan/bcs-safefit-003-s52-3-cai-sieu-mong-nhieu-silicon-34286.html
100,"Bao cao su Safefit Comfortable S52 không mùi khó chịu, độ bền cao, khả năng co giãn tốt, chất bôi trơn (12 cái)",https://nhathuoclongchau.com.vn/cham-soc-ca-nhan/bcs-safefit-comfortable-s52-12-cai-nhieu-chat-boi-tron-34284.html
101,"Viên ngậm Hotexcol Dân Khang hỗ trợ thanh họng, giảm ho (10 vỉ x 4 viên)",https://nhathuoclongchau.com.vn/cham-soc-ca-nhan/hotexcol-vien-ngam-giam-ho-thanh-hong-giam-tang-tiet-dom-10x4-34147.html
102,"Tinh Nghệ Vàng Honimore hỗ trợ điều trị các bệnh về gan, mật, ứ huyết, phục hồi sức khỏe sau sinh (130g)",https://nhathuoclongchau.com.vn/cham-soc-ca-nhan/tinh-nghe-vang-honimore-130g-33719.html
103,Tinh dầu khử khuẩn chống virus Thảo Nguyên hương sả chanh ngăn ngừa dịch bệnh (30ml),https://nhathuoclongchau.com.vn/cham-soc-ca-nhan/tinh-dau-khu-khuan-chong-virus-thao-nguyen-30ml-33681.html
104,Nước Hồng Sâm Hongsamjin Plus hỗ trợ tăng cường sức khỏe và sức đề kháng (15 gói x 70ml),https://nhathuoclongchau.com.vn/cham-soc-ca-nhan/nuoc-hong-sam-hongsamjin-plus-15-goi-x-70ml-33540.html
105,Nước yến sào và hạt chia Greenbird giúp khỏe dáng đẹp da và bổ sung năng lượng (6 chai x 185ml) ,https://nhathuoclongchau.com.vn/cham-soc-ca-nhan/yen-sao-va-hat-chia-greenbird-6-chai-x-185ml-33047.html
106,Nước Yến Sào và Đông Trùng Hạ Thảo Greenbird bổ sung dưỡng chất tốt cho sức khỏe (6 chai x 185ml),https://nhathuoclongchau.com.vn/cham-soc-ca-nhan/yen-sao-va-dong-trung-ha-thao-greenbird-6-chai-x-185ml-33046.html
107,"Dung dịch vệ sinh phụ nữ Crevil Intim Waschlotion diệt khuẩn, kháng viêm (100ml)",https://nhathuoclongchau.com.vn/cham-soc-ca-nhan/crevil-100ml-14163.html
108,Đường ăn kiêng Equal Classic Zero Calorie Sweetener (100 gói x 1g),https://nhathuoclongchau.com.vn/cham-soc-ca-nhan/duong-equal-100-goi-17356.html
109,"Viên ngậm ho Bách Bộ Mom And Baby Tất Thành hỗ trợ giảm rát họng, ngứa cổ, khản tiếng (5 vỉ x 4 viên)",https://nhathuoclongchau.com.vn/cham-soc-ca-nhan/ngam-ho-bach-bo-mom-and-baby-tat-thanh-5x4-19763.html
110,"Viên ngậm ho Bách Bộ Mom And Baby Tất Thành hỗ trợ giảm rát họng, ngứa cổ, khản tiếng (26 vỉ x 4 viên)",https://nhathuoclongchau.com.vn/cham-soc-ca-nhan/ngam-ho-bach-bo-mom-and-baby-tat-thanh-26x4-19764.html
111,"Dung dịch vệ sinh phụ nữ Natural Feminine Curcumin Wash 100ml làm sạch, dưỡng ẩm da nhạy cảm",https://nhathuoclongchau.com.vn/cham-soc-ca-nhan/dung-dich-ve-sinh-phu-nu-natural-feminine-curcumin-wash-100ml-22384.html
112,"Gel rửa tay khô Natural Hand Sanitizer trà xanh và sả chanh làm sạch tay, khử mùi, dưỡng ẩm (120ml)",https://nhathuoclongchau.com.vn/cham-soc-ca-nhan/gel-rua-tay-kho-natural-hand-sanitizer-la-beaute-120ml-28511.html
113,"Bông viên Niva YB1 làm sạch vết thương, thấm máu và dịch tiết (50 viên)",https://nhathuoclongchau.com.vn/cham-soc-ca-nhan/bong-vien-niva-50-vien-29840.html
114,Tinh dầu Khuynh Diệp Mệ Đoan hỗ trợ phòng và giảm các triệu chứng cảm cúm (30ml),https://nhathuoclongchau.com.vn/cham-soc-ca-nhan/tinh-dau-khuynh-diep-me-doan-30ml-32025.html
115,Tinh dầu khử khuẩn chống virus Thảo Nguyên hương sả chanh ngăn ngừa dịch bệnh (200ml),https://nhathuoclongchau.com.vn/cham-soc-ca-nhan/tinh-dau-khu-khuan-chong-virus-sa-chanh-thao-nguyen-200ml-32243.html
116,Tinh dầu khử khuẩn chống virus Thảo Nguyên hương sả chanh ngăn ngừa dịch bệnh (500ml),https://nhathuoclongchau.com.vn/cham-soc-ca-nhan/tinh-dau-khu-khuan-chong-virus-duoi-muoi-va-con-trung-thao-nguyen-500ml-32253.html
117,"Nước Yến Sào cao cấp Nunest 15% không đường, giúp bồi bổ cơ thể, tăng cường sức khỏe (6 hũ x 70ml)",https://nhathuoclongchau.com.vn/cham-soc-ca-nhan/nuoc-yen-cao-cap-nunest-khong-duong-6-hu-x-70ml-32323.html
118,"Nước muối súc miệng công nghệ Nhật Bản Ion Muối Fujiwa ngăn chặn vi khuẩn, giảm viêm họng (680ml)",https://nhathuoclongchau.com.vn/cham-soc-ca-nhan/nuoc-suc-mieng-i-on-muoi-huong-bac-ha-680ml-32344.html
119,"Bao cao su Okamoto Crown kích cỡ nhỏ, siêu mỏng, mềm mại dùng để phòng tránh thai và ngăn ngừa HIV (10 cái)",https://nhathuoclongchau.com.vn/cham-soc-ca-nhan/bao-cao-su-okamoto-crown-kich-co-nho-sieu-mong-va-mem-mai-hop-10-cai.html
120,"Bao cao su Okamoto Crown kích cỡ nhỏ, siêu mỏng, mềm mại dùng để phòng tránh thai và ngăn ngừa HIV (3 cái)",https://nhathuoclongchau.com.vn/cham-soc-ca-nhan/bao-cao-su-okamoto-crown-kich-co-nho-sieu-mong-va-mem-mai-hop-3-cai.html
121,"Bao cao su Okamoto Skinless Skin Purity không mùi, tinh khiết, dùng để phòng tránh thai và ngăn ngừa HIV (10 cái)",https://nhathuoclongchau.com.vn/cham-soc-ca-nhan/bao-cao-su-okamoto-skinless-skin-purity-khong-mui-tinh-khiet-hop-10-cai.html
122,"Nước Yến Sào Cao Cấp Nunest 15% Relax an giấc ngủ ngon, giảm căng thẳng, mệt mỏi (6 hũ x 70ml)",https://nhathuoclongchau.com.vn/cham-soc-ca-nhan/nuoc-yen-sao-cao-cap-nunest-relax-ngu-ngon-giam-cang-thang-met-moi-6-hu-x-70-ml.html
123,Chè dưỡng nhan tổ yến và trùng thảo Greenbird bổ sung collagen thuần khiết từ thực vật (6 chai x 175ml),https://nhathuoclongchau.com.vn/cham-soc-ca-nhan/che-duong-nhan-to-yen-va-trung-thao-greenbird-6-chai-x-175-ml.html
124,Trà gừng sả Lado Tea Premium Ladophar hỗ trợ giảm các triệu chứng đau đầu (20 túi x 2g),https://nhathuoclongchau.com.vn/cham-soc-ca-nhan/tra-gung-sa-premium-ladophar-20-tui-loc-x-2g-37130.html
125,"Nước Hồng Sâm Extra Gold Kwangdong bổ sung dinh dưỡng và năng lượng, tăng cường sức đề kháng (10 chai x 100ml)",https://nhathuoclongchau.com.vn/cham-soc-ca-nhan/nuoc-hong-sam-extra-gold-kwangdong-10-chai-x-100ml-36583.html
126,"Bao cao su Safefit Dots Long Lasting S52 có vòng gân, hạt nổi, thắt chống tuột (12 cái)",https://nhathuoclongchau.com.vn/cham-soc-ca-nhan/bcs-safefit-4in1-s52-12-cai-gan-gai-co-that-keo-dai-thoi-gian-cuc-manh-34300.html
127,"Viên Tinh Nghệ Mật Ong Sữa Chúa Honeyland tăng cường đề kháng, sức khỏe (120g)",https://nhathuoclongchau.com.vn/cham-soc-ca-nhan/vien-tinh-nghe-mat-ong-sua-chua-honeyland-120g-33709.html
128,"Nước Hồng Sâm Cô Đặc Hongsamjin Everystick EX hỗ trợ bồi bổ cơ thể, tăng cường sức khỏe (30 gói x 10g)",https://nhathuoclongchau.com.vn/cham-soc-ca-nhan/hong-sam-co-dac-hongsamjin-everystick-ex-30-goi-x-10g-33541.html
129,Gel bôi dưỡng ẩm Bix For Gentleman hỗ trợ sinh lý cho nam giới (30ml),https://nhathuoclongchau.com.vn/cham-soc-ca-nhan/gel-boi-tang-cuong-sinh-ly-cho-nam-gioi-bix-gentlement-30ml-33045.html
130,Bột Cần Tây nguyên chất Datino hỗ trợ giảm cholesterol xấu trong máu (3g x 15 gói),https://nhathuoclongchau.com.vn/cham-soc-ca-nhan/bot-can-tay-nguyen-chat-datino-3gx15-goi-31397.html
131,"Nước Yến Sào cao cấp Nunest Gold 15% có đường, bồi bổ sức khỏe và đẩy lùi lão hóa (6 hũ x 70ml)",https://nhathuoclongchau.com.vn/cham-soc-ca-nhan/nuoc-yen-cao-cap-nunest-gold-6-hu-x-70ml-32306.html
132,"Thực phẩm bổ sung Collagen Condition Beyou Ampoule 10,000mg hỗ trợ làm trắng da, chống lão hóa (10 chai)",https://nhathuoclongchau.com.vn/cham-soc-ca-nhan/collagen-condition-beyou-ampoule-10-000-mg-10-chai.html
133,"Bao cao su Okamoto Skinless skin super lubricative siêu mỏng, dẻo dai và mềm mại (10 cái)",https://nhathuoclongchau.com.vn/cham-soc-ca-nhan/bao-cao-su-okamoto-skinless-skin-sieu-boi-tron-khong-mui-hop-10-cai.html
134,"Bao cao su Okamoto Skinless skin Orange mềm mại, dẻo dai (10 cái)",https://nhathuoclongchau.com.vn/cham-soc-ca-nhan/bao-cao-su-okamoto-skinless-skin-orange-sieu-boi-tron-huong-cam-hop-10-cai.html
135,"Bao cao su Okamoto Skinless skin Vanilla mềm mại, dẻo dai (10 cái)",https://nhathuoclongchau.com.vn/cham-soc-ca-nhan/bao-cao-su-okamoto-skinless-skin-vanilla-huong-vani-hop-10-cai.html
136,Bao cao su Okamoto Dot De Cool mang đến cảm giác mát lạnh sảng khoái (3 cái),https://nhathuoclongchau.com.vn/cham-soc-ca-nhan/bao-cao-su-okamoto-dot-de-cool-gai-tuoi-mat-hop-3-cai.html
137,"Bao cao su Okamoto 0.01 PU phòng tránh thai, ngăn ngừa HIV và các bệnh lây qua đường tình dục (2 cái)",https://nhathuoclongchau.com.vn/cham-soc-ca-nhan/bao-cao-su-okamoto-hydro-polyurethane-sieu-mong-001-pu-hop-2-cai.html
138,Thực phẩm bổ sung GU Gel Liquid Energy Strawberry Banana 60g bổ sung năng lượng trong các hoạt động thể thao,https://nhathuoclongchau.com.vn/cham-soc-ca-nhan/thuc-pham-bo-sung-gu-gel-liquidenergy-strawberry-banana-60-g.html
139,Thực phẩm bổ sung GU Gel Liquid Energy Orange 60g bổ sung năng lượng trong các hoạt động thể thao,https://nhathuoclongchau.com.vn/cham-soc-ca-nhan/thuc-pham-bo-sung-gu-gel-liquidenergy-orange-60-g.html
140,Thực phẩm bổ sung GU Gel Liquid Energy Lemonade 60g bổ sung năng lượng trong các hoạt động thể thao ,https://nhathuoclongchau.com.vn/cham-soc-ca-nhan/thuc-pham-bo-sung-gu-gel-liquidenergy-lemonade-60-g.html
141,Thực phẩm bổ sung GU Gel Liquid Energy Coffee 60g bổ sung năng lượng trong các hoạt động thể thao,https://nhathuoclongchau.com.vn/cham-soc-ca-nhan/thuc-pham-bo-sung-gu-gel-liquidenergy-coffee-60-g.html
142,Bàn chải đánh răng trẻ em sạc điện Oral-B Vitality D12 Disney Frozen giúp làm&nbsp;sạch mảng bám trên răng một cách toàn diện,https://nhathuoclongchau.com.vn/cham-soc-ca-nhan/ban-chai-danh-rang-tre-em-oral-b-vitality-d12-disney-frozen-sac-dien.html
143,Bàn chải đánh răng trẻ em sạc điện Oral-B Vitality D12 Disney Cars giúp làm&nbsp;sạch mảng bám trên răng một cách toàn diện,https://nhathuoclongchau.com.vn/cham-soc-ca-nhan/ban-chai-danh-rang-tre-em-oral-b-vitality-d12-disney-cars-sac-dien.html
144,"Đầu chải răng người lớn Oral-B Ultrathin EB60 hỗ trợ làm sạch các mảng bám cứng đầu trên răng, chăm sóc nướu răng",https://nhathuoclongchau.com.vn/cham-soc-ca-nhan/dau-chai-rang-nguoi-lon-oral-b-ultrathin-eb-60.html
145,"Bàn chải điện Oral-B Vitality Ultrathin D12.513 giúp làm&nbsp;sạch mảng bám trên răng, loại bỏ các vết ố răng",https://nhathuoclongchau.com.vn/cham-soc-ca-nhan/ban-chai-danh-rang-dien-oral-b-vitality-ultrathin-d12-513.html
146,"Nước Yến Sào Cao Cấp Nunest Detox hạt chia bổ dưỡng, sáng da (6 Chai x 185ml)",https://nhathuoclongchau.com.vn/cham-soc-ca-nhan/nuoc-yen-sao-cao-cap-nunest-detox-hat-chia-5-yen-6-chai-x-185-ml-1.html
147,Thực phẩm bổ sung GU Gel Blueberry Pomegranate bổ sung năng lượng trong hoạt động thể thao (32g) ,https://nhathuoclongchau.com.vn/cham-soc-ca-nhan/thuc-pham-bo-sung-gu-roctane-energy-gel-blueberry-pomegranate-32-g-2.html
148,Thực phẩm bổ sung GU Gel Strawberry Kiwi bổ sung năng lượng trong hoạt động thể thao (32g),https://nhathuoclongchau.com.vn/cham-soc-ca-nhan/thuc-pham-bo-sung-gu-roctane-energy-gel-strawberry-kiwi-32-g-1.html
149,"Bọt vệ sinh phụ nữ Curcumin Natural Feminine làm sạch, dưỡng ẩm, ngăn ngừa ngứa (160ml)",https://nhathuoclongchau.com.vn/cham-soc-ca-nhan/dung-dich-ve-sinh-phu-nu-dang-bot-natural-feminine-curcumin-160-ml.html
150,"Nước Yến Sào và Sâm Lát Green Bird bổ sung dưỡng chất, tăng cường sức khỏe (4 hũ x 72g)",https://nhathuoclongchau.com.vn/cham-soc-ca-nhan/nuoc-yen-sao-va-sam-lat-greenbird-4-hu-x-72-g.html
151,"Trà Giảo Cổ Lam Kami tea giúp thanh nhiệt giải độc, hỗ trợ điều trị chứng tăng mỡ máu (20 túi)",https://nhathuoclongchau.com.vn/cham-soc-ca-nhan/tra-thao-duoc-giao-co-lam-kami-tea-20-tui-loc-x-2-g.html
152,"Trà Tía Tô – Gừng Kami Tea hỗ trợ tiêu hoá, chữa cảm mạo, nhức đầu, bụng dầy trướng (20 túi)",https://nhathuoclongchau.com.vn/cham-soc-ca-nhan/tra-thao-duoc-tia-to-gung-kami-tea-20-tui-loc-x-2-g.html
153,"Trà Nấm Đông Trùng Hạ Thảo Kami tea hỗ trợ cải thiện chức năng miễn dịch, cải thiện tình trạng mất ngủ (20 túi)",https://nhathuoclongchau.com.vn/cham-soc-ca-nhan/tra-thao-duoc-nam-dong-trung-ha-thao-kami-tea-20-tui-x-2-g.html
154,"Bao cao su Okamoto 0.03 Platinum trong suốt, mềm mại, dùng để phòng tránh thai và ngăn ngừa HIV (3 cái)",https://nhathuoclongchau.com.vn/cham-soc-ca-nhan/bao-cao-su-okamoto-0-03-platinum-trong-suot-mem-mai-hop-3-cai.html
155,"Bao cao su Okamoto Skinless Skin Purity không mùi, tinh khiết, dùng để phòng tránh thai và ngăn ngừa HIV (3 cái)",https://nhathuoclongchau.com.vn/cham-soc-ca-nhan/bao-cao-su-okamoto-skinless-skin-purity-khong-mui-tinh-khiet-hop-3-cai.html
156,"Tổ yến tinh chế sợi dài Kami Nest bổ dưỡng cho hệ tim mạch, tăng cường hệ thống miễn dịch (50g)",https://nhathuoclongchau.com.vn/cham-soc-ca-nhan/to-yen-tinh-che-soi-dai-kami-nest-50-g.html
157,"Nước Yến Sào Cao Cấp Nunest 15% Gastro bồi bổ cơ thể, tăng cường sức khỏe (6 hũ x 70ml)",https://nhathuoclongchau.com.vn/cham-soc-ca-nhan/nuoc-yen-sao-cao-cap-nunest-gastro-danh-cho-nguoi-viem-da-day-ta-trang-6-hu-x-70-ml.html
158,"Nước Yến Sào Cao Cấp Nunest 15% Cerna bồi bổ cơ thể, tăng cường sức khỏe (6 hũ x 70ml)",https://nhathuoclongchau.com.vn/cham-soc-ca-nhan/nuoc-yen-sao-cao-cap-nunest-cerna-danh-cho-nguoi-tieu-duong-6-hu-x-70-ml.html
159,"Nước Yến Sào Cao Cấp Nunest Detox thanh lọc, thải độc cho cơ thể, chống lão hóa (6 hũ x 70ml) ",https://nhathuoclongchau.com.vn/cham-soc-ca-nhan/nuoc-yen-sao-cao-cap-nunest-detox-thai-doc-dep-da-6-hu-x-70-ml.html
160,Bột Diếp Cá nguyên chất Datino bổ sung chất dinh dưỡng có lợi cho sức khỏe (3g x 15 gói),https://nhathuoclongchau.com.vn/cham-soc-ca-nhan/bot-diep-ca-nguyen-chat-datino-15-goi-x-3-g.html
161,"Dung dịch vệ sinh phụ nữ dạng bọt Daily Lady Care &amp; Calm giúp kháng viêm, giảm đau rát, vi nấm (60ml)",https://nhathuoclongchau.com.vn/cham-soc-ca-nhan/dung-dich-ve-sinh-phu-nu-dang-bot-daily-lady-care-and-calm-60-ml-khang-viem-giam-dau-rat-vi-nam.html
162,"Dung dịch vệ sinh phụ nữ dạng bọt Daily Moist &amp; Fresh giúp khử khuẩn, khử mùi, ngừa khô rát (60ml)",https://nhathuoclongchau.com.vn/cham-soc-ca-nhan/dung-dich-ve-sinh-phu-nu-dang-bot-daily-lady-moist-and-fresh-60-ml-khu-khuan-khu-mui-ngua-kho-rat.html
163,"Dung dịch vệ sinh phụ nữ dạng bọt Daily Lady Love &amp; Hope giúp sáng hồng da, se khít, kháng viêm và mờ thâm (60ml)",https://nhathuoclongchau.com.vn/cham-soc-ca-nhan/dung-dich-ve-sinh-phu-nu-dang-bot-daily-lady-love-and-hope-60-ml-sang-hong-se-khit-khang-viem-mo-tham.html
164,Viên muối điện giải GU Roctane Electrolyte Capsules bổ sung năng lượng và chất điện giải (50 viên),https://nhathuoclongchau.com.vn/cham-soc-ca-nhan/vien-muoi-dien-giai-gu-roctane-electrolyte-capsule-50-v.html
165,"Nước Yến Sào Cao Cấp Nunest Kids vị dâu tăng cường sức khoẻ, ăn ngon (4 hũ x 70ml)",https://nhathuoclongchau.com.vn/cham-soc-ca-nhan/nuoc-yen-sao-cao-cap-cho-tre-em-nunest-kid-vi-dau-loc-3-1-70-ml.html
166,"Nước Collagen5000 Đông Trùng Hạ Thảo Biok hỗ trợ ngăn ngừa quá trình lão hóa, tăng cường đề kháng (10 chai x 75ml)",https://nhathuoclongchau.com.vn/cham-soc-ca-nhan/nuoc-collagen-5000-dong-trung-ha-thao-biok-10-chai-x-75-ml.html
167,"Dung dịch vệ sinh phụ nữ dạng bọt Daily Lady Care And Calm vệ sinh cơ quan sinh dục, khử mùi hôi (100ml)",https://nhathuoclongchau.com.vn/cham-soc-ca-nhan/dung-dich-ve-sinh-phu-nu-dang-bot-daily-lady-care-and-calm-100-ml-khang-viem-giam-dau-rat-vi-nam.html
168,"Dung dịch vệ sinh phụ nữ dạng bọt Daily Lady Moist And Fresh vệ sinh cơ quan sinh dục, khử mùi hôi (100ml)",https://nhathuoclongchau.com.vn/cham-soc-ca-nhan/dung-dich-ve-sinh-phu-nu-dang-bot-daily-lady-moist-and-fresh-100-ml-khu-khuan-khu-mui-ngua-kho-rat.html
169,"Dung dịch vệ sinh phụ nữ Daly Lady Love &amp; Hope vệ sinh cơ quan sinh dục, khử mùi hôi (100ml)",https://nhathuoclongchau.com.vn/cham-soc-ca-nhan/dung-dich-ve-sinh-phu-nu-dang-bot-daily-lady-love-and-hope-100-ml-sang-hong-se-khit-khang-viem-mo-tham.html
