product_id,product_name,product_url
418,"Tã dán người lớn Caryn siêu thấm size L20, vòng hông 68 x 122cm (20 miếng)",https://nhathuoclongchau.com.vn/cham-soc-ca-nhan/ta-dan-sieu-tham-cho-nguoi-lon-caryn-size-l-goi-20-mieng-31182.html
419,Tấm đệm lót người lớn Caryn siêu thấm size L10 - 42 x 72cm (10 miếng),https://nhathuoclongchau.com.vn/cham-soc-ca-nhan/tam-diem-lot-cho-nguoi-lon-caryn-loai-sieu-tham-size-l10-goi-10-mieng-42x72cm-31183.html
420,Tấm đệm lót người lớn Caryn siêu thấm size L10 - 42 x 72cm (20 miếng),https://nhathuoclongchau.com.vn/cham-soc-ca-nhan/tam-diem-lot-cho-nguoi-lon-caryn-loai-sieu-tham-size-l20-goi-20-mieng-42x72cm-31188.html
421,Tã quần người lớn Caryn mỏng nhẹ size L14 vòng bụng 75 x 100cm (14 miếng),https://nhathuoclongchau.com.vn/cham-soc-ca-nhan/ta-quan-cho-nguoi-lon-caryn-mong-nhe-size-l14-goi-14-mieng-vong-bung-75-100cm-31190.html
422,"Tã dán người lớn Caryn siêu thấm size L10, vòng hông 68 x 122cm (10 miếng)",https://nhathuoclongchau.com.vn/cham-soc-ca-nhan/ta-dan-cho-nguoi-lon-caryn-sieu-tham-size-m-l10-goi-10-mieng-vong-hong-68-122cm-31197.html
423,"Bông tẩy trang Niva Cotton rounds mềm mại, không xổ lông , thấm hút (100 miếng)",https://nhathuoclongchau.com.vn/cham-soc-ca-nhan/bong-tay-trang-niva-dang-tron-tui-100-mieng-31741.html
424,"Nước muối Natri Clorid 0.9% Ngân Hà phòng ngừa nhiễm khuẩn da, răng miệng (500ml)",https://nhathuoclongchau.com.vn/cham-soc-ca-nhan/natri-clorid-09-ngan-ha-500ml-nuoc-muoi-31978.html
425,"Chỉ nha khoa Jomi Dental Floss loại trừ các mảng bám, thức ăn dư thừa trong kẽ răng (50m)",https://nhathuoclongchau.com.vn/cham-soc-ca-nhan/chi-nha-khoa-jomi-dental-floss-50mhop-32754.html
426,Mật Ong Sữa Chúa Honey Land vị chanh dây bổ sung năng lượng và nguồn vitamin cho cơ thể (20 gói x 10g),https://nhathuoclongchau.com.vn/cham-soc-ca-nhan/mat-ong-sua-chua-vi-chanh-day-honey-land-20-goi-x-10-g.html
427,Kem dưỡng ẩm Secalia Ds IsisPharma giúp làm mềm và giữ ẩm cho da (40ml),https://nhathuoclongchau.com.vn/cham-soc-ca-nhan/kem-duong-am-secalia-ds-isispharma-40-ml-1.html
428,Bột năng lượng Endurance Fuel Tailwind Berry vị quả mọng cung cấp năng lượng và chất điện giải cho cơ thể (54g) ,https://nhathuoclongchau.com.vn/cham-soc-ca-nhan/bot-nang-luong-endurance-fuel-tailwind-berry-54g---vi-qua-mong-38179.html
429,"Đông Trùng Hạ Thảo Thái Minh hỗ trợ tăng cường sức khỏe, giảm mệt mỏi (30 viên)",https://nhathuoclongchau.com.vn/thuc-pham-chuc-nang/dong-trung-ha-thao-thai-minh-30v-37646.html
430,"Bột năng lượng Recovery Mix Tailwind Vanilla bổ sung chất điện giải, năng lượng và bù nước (14 gói x 59g)",https://nhathuoclongchau.com.vn/cham-soc-ca-nhan/bot-nang-luong-recovery-mix-tailwind-vanilla-59g-37550.html
431,Dầu xả ngăn rụng tóc Pantene dạng dây (10 gói x 6ml),https://nhathuoclongchau.com.vn/cham-soc-ca-nhan/dau-xa-suon-muot-dang-day-pantene-10-goi-x-6-ml.html
432,Dầu gội ngăn rụng tóc Pantene dạng dây (10 gói x 6g),https://nhathuoclongchau.com.vn/cham-soc-ca-nhan/dau-goi-ngan-rung-toc-dang-day-pantene-10-goi-x-6-g.html
433,Đầu chải răng Oral-B Sensi Ultrathin EB 60-2,https://nhathuoclongchau.com.vn/cham-soc-ca-nhan/dau-chai-rang-nguoi-lon-oral-b-sensi-ultrathin-eb-60-2-35514.html
434,Đầu chải răng trẻ em Oral-B EB 10-2 K,https://nhathuoclongchau.com.vn/cham-soc-ca-nhan/dau-chai-rang-tre-em-oral-b-eb-10-2-k-35515.html
435,Bàn chải đánh răng pin Oral-B Pro Health DB4510 loại bỏ được mảng bám và vết ố trên răng,https://nhathuoclongchau.com.vn/cham-soc-ca-nhan/ban-chai-danh-rang-nguoi-lon-oral-b-pro-health-db4510-dung-pin-35519.html
436,Bàn chải đánh răng trẻ em Oral-B Stages Power DB4510K làm sạch mảng bám trên răng (1 cây),https://nhathuoclongchau.com.vn/cham-soc-ca-nhan/ban-chai-danh-rang-tre-em-oral-b-stages-power-db4510k-dung-pin-35520.html
437,Kẹo My Little Pony Surprise Fan Relkon cho bé (1 cái),https://nhathuoclongchau.com.vn/cham-soc-ca-nhan/keo-bup-be-lat-dat-do-choi-my-little-pony-relkon-34149.html
438,"Quạt cầm tay, con dấu kèm theo kẹp Peppa Pig Surprise Fan cho bé (1 cái)",https://nhathuoclongchau.com.vn/cham-soc-ca-nhan/keo-cay-quat-do-choi-peppa-pig-relkon-34145.html
439,Đồ chơi trẻ em đèn chiếu hình Laze Hello Kitty Relkon giúp bé thích thú tìm tòi và chia sẻ cùng nhau (1 cái),https://nhathuoclongchau.com.vn/cham-soc-ca-nhan/keo-den-chieu-laze-do-choi-hello-kitty-relkon-34143.html
440,Đồ chơi trẻ em đèn chiếu hình Justice League Viewer Relkon (1 cái),https://nhathuoclongchau.com.vn/cham-soc-ca-nhan/keo-trai-tim-do-choi-hello-kitty-relkon-34141.html
441,Dung dịch Touchhand Opodis Pharma sát khuẩn tay nhanh (10 chai x 30ml),https://nhathuoclongchau.com.vn/cham-soc-ca-nhan/dung-dich-sat-khuan-tay-nhanh-touchhand-30ml-33505.html
442,"Trà tăng huyết áp Acotea 4g Meracine hỗ trợ điều trị huyết áp thấp, tăng cường sinh lực (20 gói)",https://nhathuoclongchau.com.vn/cham-soc-ca-nhan/tra-tang-huyet-ap-acotea-me-linh-710.html
443,"Kẹo con tàu Fisherman's Friend vị cam chanh thông cổ, mát họng, thông mũi (25g)",https://nhathuoclongchau.com.vn/cham-soc-ca-nhan/keo-con-tau-citrus-25g-vi-cam-chanh-va-menthol-15549.html
444,"Kẹo con tàu Fisherman's Friend vị khuynh diệp thông cổ, mát họng, thông mũi (25g)",https://nhathuoclongchau.com.vn/cham-soc-ca-nhan/keo-con-tau-original-25g-vi-menthol-khuynh-diep-16142.html
445,"Kẹo con tàu Fisherman's Friend vị spearmint thông cổ, mát họng, thông mũi (25g)",https://nhathuoclongchau.com.vn/cham-soc-ca-nhan/keo-con-tau-spearmint-25g-16380.html
446,Xịt chống muỗi Remos hương Lavender xua muỗi suốt 10 giờ (60ml),https://nhathuoclongchau.com.vn/cham-soc-ca-nhan/remos-lavender-60ml-16918.html
447,"Kẹo con tàu Fisherman's Friend vị cherry thông cổ, mát họng, thông mũi (25g)",https://nhathuoclongchau.com.vn/cham-soc-ca-nhan/keo-con-tau-cherry-25g-vi-cherrymenthol-17188.html
448,"Kẹo con tàu Fisherman's Friend vị quýt thông cổ, mát họng, thông mũi (25g)",https://nhathuoclongchau.com.vn/cham-soc-ca-nhan/keo-con-tau-mandarrin-25-vi-quyt-menthol-17189.html
449,Nước tắm trẻ em Amibebe Herbe phòng và hỗ trợ điều trị rôm sảy (250ml),https://nhathuoclongchau.com.vn/cham-soc-ca-nhan/ami-bebe-250ml-17550.html
450,"Bông tẩy trang Jomi siêu thấm, siêu mịn hỗ trợ tẩy trang hiệu quả (80 miếng)",https://nhathuoclongchau.com.vn/cham-soc-ca-nhan/bong-tay-trang-jomi-80-mieng-28668.html
451,"Dụng cụ cạo lưỡi Okamura làm sạch mảng bám ở lưỡi, phòng bệnh nha chu, hôi miệng (12 vỉ x 5 cây)",https://nhathuoclongchau.com.vn/cham-soc-ca-nhan/dung-cu-cao-luoi-okamura-vi-5-cay-28683.html
452,"Kẹo Con Tàu Không Đường Fisherman's Friend 25G Vị Táo, Quế Và Menthol",https://nhathuoclongchau.com.vn/cham-soc-ca-nhan/keo-con-tau-vi-tao-que-fisherman-s-friend-25-g.html
453,Xịt xua muỗi Remos hương Khuynh Diệp xua muỗi suốt 6 giờ cho bé từ 6 tháng tuổi (60ml),https://nhathuoclongchau.com.vn/cham-soc-ca-nhan/xit-chong-muoi-cho-be-tu-6-thang-tuoi-remos-khuynh-diep-rohto-60ml-29234.html
454,"Tăm bông trẻ em Niva Baby Cotton Buds BH1 vệ sinh tai, mũi (150 que)",https://nhathuoclongchau.com.vn/cham-soc-ca-nhan/tam-bong-niva-hu-xoay-150-que-nhua-bh1-29830.html
455,"Bông tẩy trang đa dụng Niva mềm mại, không xổ lông, an toàn cho da (50 miếng)",https://nhathuoclongchau.com.vn/cham-soc-ca-nhan/bong-tay-trang-da-dung-niva-hop-50-mieng-29837.html
456,"Bông tẩy trang đa dụng Niva mềm mại, không xổ lông, an toàn cho da (80 miếng)",https://nhathuoclongchau.com.vn/cham-soc-ca-nhan/bong-tay-trang-da-dung-niva-hop-80-mieng-29838.html
457,"Bông tẩy trang đa dụng Niva túi zipper mềm mại, an toàn cho da (100 miếng)",https://nhathuoclongchau.com.vn/cham-soc-ca-nhan/bong-tay-trang-da-dung-niva-tui-zipper-100-mieng-29839.html
458,"Khăn ướt cồn Let-Green làm sạch, kháng khuẩn và giữ vệ sinh (50 miếng)",https://nhathuoclongchau.com.vn/cham-soc-ca-nhan/khan-uot-con-let-green-50-mieng-30954.html
459,Nước súc miệng Listerine Gum Care vị gừng thảo mộc ngăn ngừa vi khuẩn gây mảng bám và viêm nướu (250ml),https://nhathuoclongchau.com.vn/cham-soc-ca-nhan/nuoc-suc-mieng-vi-gung-thao-moc-listerine-gum-care-250ml-32873.html
460,"Trà Râu Ngô Rau Má Đại Y giúp lợi tiểu, mát gan, thanh nhiệt giải độc (150g)",https://nhathuoclongchau.com.vn/cham-soc-ca-nhan/tra-rau-ngo-rau-ma-dai-y-150g-22427.html
461,"Nước uống Toslong Hàn Quốc phòng ngừa buồn nôn, giảm triệu chứng khó chịu (30 chai x 30ml)",https://nhathuoclongchau.com.vn/cham-soc-ca-nhan/nuoc-uong-toslong-han-quoc-hop-30-chai-x-30-ml.html
462,"Bột năng lượng Recovery Mix Tailwind Chocolate bổ sung chất điện giải, năng lượng và bù nước (14 gói x 61g)",https://nhathuoclongchau.com.vn/cham-soc-ca-nhan/bot-nang-luong-recovery-mix-tailwind-chocolate-61g-37551.html
463,Bột đạm Now-Whey Isolate vị sô-cô-la hỗ trợ bổ sung whey protein cho người tập thể thao (907g),https://nhathuoclongchau.com.vn/cham-soc-ca-nhan/bot-dam-now-whey-protein-vi-so-co-la-907-g.html
464,Bột đạm Now-Whey Isolate vị Vani hỗ trợ bổ sung whey protein cho người tập thể thao (816g),https://nhathuoclongchau.com.vn/cham-soc-ca-nhan/bot-dam-now-whey-isolate-vi-vani-816-g.html
465,Đầu chải răng Oral-B CrossAction EB 50-2,https://nhathuoclongchau.com.vn/cham-soc-ca-nhan/dau-chai-rang-nguoi-lon-oral-b-crossaction-eb-50-2-35516.html
466,"Dung dịch vệ sinh phụ nữ Lactacyd Extra Nouris hỗ trợ làm sạch nhẹ nhàng vùng kín, ngăn nhiễm khuẩn (150ml)",https://nhathuoclongchau.com.vn/cham-soc-ca-nhan/lactacyd-extra-nourish-150ml-dung-dich-ve-sinh-phu-nu-giup-cang-min-34508.html
467,"Khăn ướt Dettol làm sạch, kháng khuẩn (50 miếng)",https://nhathuoclongchau.com.vn/cham-soc-ca-nhan/khan-uot-dettol-khang-khuan-lam-sach-da-50-to-32947.html
468,"Kem dưỡng da Johnson's Milk And Rice Baby Cream dưỡng ẩm và chống nứt nẻ cho mặt, cơ thể và tay của bé (50g)",https://nhathuoclongchau.com.vn/cham-soc-ca-nhan/kem-duong-da-sua-gao-gohnsons-baby-559.html
469,Bọt vệ sinh phụ nữ Ladysoft Feminine Hygiene laCle Hồng hỗ trợ sạch vùng kín và duy trì độ pH tự nhiên (250ml),https://nhathuoclongchau.com.vn/cham-soc-ca-nhan/bot-ve-sinh-phu-nu-ladysoft-feminine-hygiene-617.html
470,"Cao Chè Vằng Lava giúp tiêu mỡ, giảm cholesterol, tốt cho gan nhiễm mỡ, ổn định huyết áp (5 gói)",https://nhathuoclongchau.com.vn/cham-soc-ca-nhan/cao-che-vang-lava-loi-sua-giam-can-733.html
471,"Tăm bông Cotton Buds Meriday Bạch Tuyết hỗ trợ vệ sinh tai, mũi (80 que)",https://nhathuoclongchau.com.vn/cham-soc-ca-nhan/tam-bong-nguoi-lon-meriday-bach-tuyet-80-que-14846.html
472,Nước súc miệng Listerine Healthy Bright diệt sạch vi khuẩn gây hôi miệng (250ml),https://nhathuoclongchau.com.vn/cham-soc-ca-nhan/listerine-healthy-bright-250ml-15483.html
473,"Phấn Johnson’s Baby Powder hút ẩm, giảm nguy cơ bị viêm da, mẩn đỏ (100g)",https://nhathuoclongchau.com.vn/cham-soc-ca-nhan/phan-johnsons-bb-powder-100g-15696.html
474,"Tăm bông người lớn Cotton Buds Meriday Bạch Tuyết hỗ trợ vệ sinh tai, mũi, vết thương (200 que)",https://nhathuoclongchau.com.vn/cham-soc-ca-nhan/tam-bong-meriday-200quelo-15782.html
475,"Phấn Johnson's Baby hương hoa, thấm hút chất ẩm dư thừa, giảm mẩn ngứa cho bé (100g)",https://nhathuoclongchau.com.vn/cham-soc-ca-nhan/johnsons-bb-powder-blossoms-100g-16072.html
476,"Nước súc miệng Nha Diệu Ngọc Rosabela giảm nhanh đau nhức, phòng chống viêm do sâu răng (200ml) ",https://nhathuoclongchau.com.vn/cham-soc-ca-nhan/nsm-nha-dieu-ngoc-16428.html
477,"Mật ong rừng Ban Mê Thuột hỗ trợ bồi bổ cơ thể, tăng cường năng lượng (189ml)",https://nhathuoclongchau.com.vn/cham-soc-ca-nhan/mat-ong-ban-me-thuot-189ml-16496.html
478,"Phấn Johnson's Baby Blossoms hương hoa, thấm hút chất ẩm dư thừa, giảm mẩn ngứa cho bé (500g)",https://nhathuoclongchau.com.vn/cham-soc-ca-nhan/johnsons-baby-powder-blossoms-500gr-16521.html
479,"Tinh dầu tràm BabyMum phòng và trị nghẹt mũi, ngứa mũi, ho, ngứa cổ, cảm (22ml)",https://nhathuoclongchau.com.vn/cham-soc-ca-nhan/dau-tram-babymum-22ml-chai-16612.html
480,"Dung dịch nha khoa Nutri Dentiz giúp chắc lợi, răng bền (250ml)",https://nhathuoclongchau.com.vn/cham-soc-ca-nhan/nutri-dentiz-250ml-spaphar-dd-nha-khoa-18451.html
481,"Tăm bông trẻ em Merigo Bạch Tuyết 100% bông xơ tự nhiên, mềm mại, vệ sinh tai cho bé (330 que)",https://nhathuoclongchau.com.vn/cham-soc-ca-nhan/tam-bong-merigo-330-que-tron-18561.html
482,"Dung dịch Bảo Nhi Hadiphar dùng khi muỗi và côn trùng đốt, nứt rát núm vú, hăm da, mẫn ngứa (10ml)",https://nhathuoclongchau.com.vn/cham-soc-ca-nhan/bao-nhi-hadiphar-10ml-19374.html
483,"Dung dịch vệ sinh phụ nữ Smoovy Gia Nguyễn sạch vùng kín, dưỡng da vùng kín sáng hồng se khít (150ml)",https://nhathuoclongchau.com.vn/cham-soc-ca-nhan/smoovy-gia-nguyen-150ml-dd-ve-sinh-phu-nu-21149.html
484,"Tinh bột hẹ Heta.Q hỗ trợ tiêu hóa tốt, giảm ho do viêm nhiễm đường hô hấp (30g)",https://nhathuoclongchau.com.vn/cham-soc-ca-nhan/tinh-bot-he-hetaq-30g-22286.html
485,"Dung dịch diệt khuẩn Dettol bảo vệ khỏi các vi khuẩn gây nhiễm trùng, sát khuẩn (500ml)",https://nhathuoclongchau.com.vn/cham-soc-ca-nhan/dung-dich-diet-khuan-dettol-500ml-22914.html
486,"Tăm bông kháng khuẩn Jomi 100% cotton vệ sinh tai, mũi (200 que)",https://nhathuoclongchau.com.vn/cham-soc-ca-nhan/tam-bong-khang-khuan-jomi-hop-200-que-28669.html
487,"Khăn giấy Living Xanh mềm mại, nhỏ gọn, tiện dụng (40 miếng)",https://nhathuoclongchau.com.vn/cham-soc-ca-nhan/khan-giay-du-lich-living-goi-40-to-xanh-28681.html
488,Băng vệ sinh Sofy Cooling Fresh Unicharm siêu mỏng cánh (8 miếng - 23cm),https://nhathuoclongchau.com.vn/cham-soc-ca-nhan/bvs-sofy-cooling-fresh-sieu-mong-canh-25cm-goi-8-mieng-28787.html
489,"Kem đánh răng Dental Family Propolis Herbal thảo dược mật ong chống vi khuẩn, củng cố nướu (100ml)",https://nhathuoclongchau.com.vn/cham-soc-ca-nhan/kem-danh-rang-dental-family-propolis-herb-thao-duoc-mat-ong-100ml-29477.html
490,"Nước Yến sào Khánh Hòa Sanest không đường, bổ huyết, tăng sức đề kháng cho cơ thể (Hộp 70ml) ",https://nhathuoclongchau.com.vn/cham-soc-ca-nhan/nuoc-yen-sao-khanh-hoa-sanest-khong-duong-danh-cho-nguoi-cao-tuoi-70ml-29519.html
491,"Khăn ướt Niva Baby làm sạch, kháng khuẩn và giữ vệ sinh (10 miếng)",https://nhathuoclongchau.com.vn/cham-soc-ca-nhan/khan-uot-niva-baby-goi-10-mieng-29843.html
492,Kẹo Chocolate đậu phộng M&amp;M's (40g),https://nhathuoclongchau.com.vn/cham-soc-ca-nhan/keo-chocolate-dau-phong-mms-40g-30035.html
493,"Tã quần người lớn Caryn mỏng nhẹ vòng bụng 75 x 100cm, size L7 (7 miếng)",https://nhathuoclongchau.com.vn/cham-soc-ca-nhan/ta-quan-nguoi-lon-caryn-mong-nhe-size-l7-goi-7-mieng-vong-bung-75-100cm-31185.html
494,"Tã quần người lớn Caryn mỏng nhẹ vòng bụng 60 x 85cm, size M8 (8 miếng)",https://nhathuoclongchau.com.vn/cham-soc-ca-nhan/ta-quan-cho-nguoi-lon-caryn-mong-nhe-size-m8-goi-8-mieng-vong-bung-60-85cm-31198.html
495,"Tăm bông Kotton Care Cotton Buds Bạch Tuyết tiện dụng cho trang điểm, tẩy trang (42 que)",https://nhathuoclongchau.com.vn/cham-soc-ca-nhan/tam-bong-nguoi-lon-kotton-care-goi-42-que-32005.html
496,Nước súc miệng Listerine Kids Mouthwash giúp răng chắc khỏe và ngăn ngừa sâu răng (250ml),https://nhathuoclongchau.com.vn/cham-soc-ca-nhan/nuoc-suc-mieng-tre-em-listerine-kids-mouthwash-250ml-32870.html
497,Viên ngậm nha khoa BioGaia ProDentis tái tạo sự cân bằng tự nhiên của hệ vi khuẩn trong môi trường miệng (30 viên),https://nhathuoclongchau.com.vn/cham-soc-ca-nhan/biogaia-prodentis-lozenges-sanico-30v-28796.html
498,"Trà Khổ Qua Rừng Mudaru hỗ trợ thanh nhiệt, giải độc, hạ đường huyết (2g x 25 túi)",https://nhathuoclongchau.com.vn/cham-soc-ca-nhan/thuc-pham-bao-ve-suc-khoe-tra-kho-qua-rung-mudaru-25-tui-loc-31279.html
499,Mật Ong Hoa Rừng Honeyland 250g cung cấp nhiều dưỡng chất thiết yếu cho cơ thể,https://nhathuoclongchau.com.vn/cham-soc-ca-nhan/mat-ong-hoa-rung-honeyland-250g-33900.html
500,"Kẹo ngậm ho không đường Pulmoll Pastillen Eukalyptus Menthol vị bạc hà làm ấm đường hô hấp, giảm ho (50g)",https://nhathuoclongchau.com.vn/cham-soc-ca-nhan/pulmoll-pastillen-50g-14573.html
501,Tổ Yến sơ chế rút lông nguyên chất Vinnest (50g),https://nhathuoclongchau.com.vn/cham-soc-ca-nhan/to-yen-so-che-rut-long-nguyen-chat-vinnest-loai-a-50g-34833.html
502,"Tổ yến sào tinh chế rút lông nguyên chất Vinnest bồi bổ cơ thể, tăng sức đề kháng (100g)",https://nhathuoclongchau.com.vn/cham-soc-ca-nhan/to-yen-so-che-rut-long-nguyen-chat-vinnest-loai-a-100g-34831.html
503,"Nước muối sinh lý Kingphar vệ sinh răng miệng, họng (500ml)",https://nhathuoclongchau.com.vn/cham-soc-ca-nhan/nuoc-muoi-sinh-ly-kingphar-500ml-33566.html
504,"Xịt thơm miệng thảo dược Greelux hương bạc hà khử mùi hôi miệng, ngừa sâu răng (12ml)",https://nhathuoclongchau.com.vn/cham-soc-ca-nhan/xit-thom-mieng-thao-duoc-greelux-extra-cool-12ml-613.html
505,"Nước Yến Sào Cao Cấp Khánh Hòa Sanest không đường, phục hồi sức khỏe (Hộp 70ml)",https://nhathuoclongchau.com.vn/cham-soc-ca-nhan/nuoc-yen-sanest-khong-duong-859.html
506,Trà túi lọc Cây Nở Ngày Đất Lava hỗ trợ điều trị gout (30 túi x 5g),https://nhathuoclongchau.com.vn/cham-soc-ca-nhan/tra-cay-no-ngay-dat-ho-tro-dieu-tri-benh-gout-885.html
507,"Trà túi lọc Hoàn Ngọc 7 Nga Tây Ninh giải nhiệt, giải độc gan, nâng cao thể lực (30 túi)",https://nhathuoclongchau.com.vn/cham-soc-ca-nhan/tra-tui-loc-hoan-ngoc-vang-893.html
508,"Trà túi lọc Tâm Lan Tây Ninh thanh nhiệt giải độc, giải khát, kháng khuẩn (4g x 30 túi)",https://nhathuoclongchau.com.vn/cham-soc-ca-nhan/tra-tam-lan-thanh-nhiet-giai-doc-897.html
509,"Gel rửa tay Green Cross hương tự nhiên làm sạch tay, kháng khuẩn, khử mùi (100ml)",https://nhathuoclongchau.com.vn/cham-soc-ca-nhan/gel-rt-green-cross-huong-tu-nhien-100ml-14435.html
510,"Nước súc miệng Listerine Natural Green Tea bảo vệ răng miệng suốt 24 giờ, ngăn ngừa vi khuẩn (500ml)",https://nhathuoclongchau.com.vn/cham-soc-ca-nhan/listerine-natural-green-tea-500ml-14780.html
511,Kem đánh răng Sensodyne Repair And Protect phục hồI răng nhạy cảm (100g),https://nhathuoclongchau.com.vn/cham-soc-ca-nhan/sensodyne-repairpro-100g-14889.html
512,"Dung dịch vệ sinh phụ nữ Womanday Đại Bắc làm sạch, khử mồ hôi (200ml)",https://nhathuoclongchau.com.vn/cham-soc-ca-nhan/womanday-djai-bac-200ml-dd-ve-sinh-phu-nu-14970.html
513,"Gel rửa tay Green Cross hương dưa táo làm sạch tay, kháng khuẩn, khử mùi (100ml)",https://nhathuoclongchau.com.vn/cham-soc-ca-nhan/gel-rua-tay-green-cross-100ml-huong-tao-15699.html
514,Gel bôi Sensi Kin hỗ trợ giảm ê buốt răng nhanh chóng (15g),https://nhathuoclongchau.com.vn/cham-soc-ca-nhan/sensikin-gel-15g-gel-giam-e-buot-15774.html
515,"Nước súc miệng Listerine Tartar Protection làm sạch mảng bám trên răng, diệt khuẩn gây hôi miệng (500ml)",https://nhathuoclongchau.com.vn/cham-soc-ca-nhan/listerine-tartar-protection-500ml-17135.html
516,"Nước súc miệng Listerine Bright And Clean làm sạch mảng bám, diệt khuẩn gây hôi miệng (750ml)",https://nhathuoclongchau.com.vn/cham-soc-ca-nhan/listerine-bright-clean-750ml-17140.html
517,"Kem đánh răng Lacalut Sensitive bảo vệ men răng, giảm ê buốt cho răng (75ml)",https://nhathuoclongchau.com.vn/cham-soc-ca-nhan/lacalut-sensitive-75ml-17161.html
518,"Phấn thơm Johnson's Baby Powder hút chất ẩm thừa, chống mẫn ngứa cho bé (200g)",https://nhathuoclongchau.com.vn/cham-soc-ca-nhan/phan-johnsons-baby-powder-200g-17251.html
519,"Kẹo gừng Gingerbon Chanh Mật Ong giải cảm, giảm cảm giác say tàu xe (125g)",https://nhathuoclongchau.com.vn/cham-soc-ca-nhan/keo-gung-gingerbon-125g-18001.html
520,"Trà túi lọc Cà Gai Leo Tuệ Linh hỗ trợ người men gan cao, mẩn ngứa, mày đay (1.8g x 25 gói)",https://nhathuoclongchau.com.vn/cham-soc-ca-nhan/tra-tui-loc-ca-gai-leo-tue-linh-25-goi-x-18g-18913.html
521,Dung dịch vệ sinh vùng kín Oillan Intima Baby dành cho bé gái từ 1 năm tuổi (200ml),https://nhathuoclongchau.com.vn/cham-soc-ca-nhan/oillan-intima-baby-200ml-dung-dich-ve-sinh-vung-kin-danh-cho-be-gai-tu-1tuoi-19071.html
522,Bọt vệ sinh phụ nữ Betadine Feminine Wash Foam nuôi dưỡng và cân bằng vệ sinh vi sinh âm đạo (100ml),https://nhathuoclongchau.com.vn/cham-soc-ca-nhan/betadine-feminine-wash-foam-100ml-bot-ve-sinh-phu-nu-hang-ngay-19781.html
523,"Dung dịch rửa tay Green Cross hương tự nhiên làm sạch tay, kháng khuẩn, khử mùi (70ml)",https://nhathuoclongchau.com.vn/cham-soc-ca-nhan/green-cross-huong-tu-nhien-70ml-xit-rua-tay-19886.html
524,"Tắm gội thảo dược trẻ em Elemis ngăn ngừa rôm sảy, mụn nhọt cho bé (200ml)",https://nhathuoclongchau.com.vn/cham-soc-ca-nhan/elemis-dkp-200ml-tam-goi-tre-em-20645.html
525,Đường bắp ăn kiêng Tropicana Slim No Calorie Sweetener Diabetics cho người tiểu đường (50 gói x 2g),https://nhathuoclongchau.com.vn/cham-soc-ca-nhan/duong-bap-tropicana-slim-diabetics-50-goi-duong-an-kieng-21021.html
526,Gel bôi ngoài da Vitaleg Aflofarm bảo vệ mạch máu và phục hồi độ đàn hồi của thành mạch (80g),https://nhathuoclongchau.com.vn/cham-soc-ca-nhan/vitaleg-zel-aflofarm-80g-kem-boi-suy-giam-tinh-mach-21797.html
527,"Sữa vệ sinh phụ nữ Foreva Daily Fresh Reliv ngăn ngừa viêm âm đạo, huyết trắng, khí hư (80ml)",https://nhathuoclongchau.com.vn/cham-soc-ca-nhan/foreva-daily-fresh-reliv-80ml-sua-ve-sinh-phu-nu-hang-ngay-21999.html
528,"Sữa vệ sinh phụ nữ Foreva Care Plus Reliv ngăn ngừa viêm âm đạo, huyết trắng, khí hư (80ml)",https://nhathuoclongchau.com.vn/cham-soc-ca-nhan/foreva-care-plus-reliv-80ml-sua-ve-sinh-phu-nu-22000.html
529,"Kẹo ngậm giảm ho Cozz Candy DHG làm ấm và thông họng, thơm miệng (12 viên)",https://nhathuoclongchau.com.vn/cham-soc-ca-nhan/cozz-candy-dhg-12-vien-22018.html
530,"Trà hòa tan Hati Gừng Mật Ong DHG Pharma hỗ trợ tiêu hóa, giảm ho do nhiễm lạnh (4g x 24 gói)",https://nhathuoclongchau.com.vn/cham-soc-ca-nhan/hati-gung-mat-ong-dhg-24-goi-22086.html
531,"Gel Mucogyne Iprad phục hồi biểu mô âm hộ, âm đạo (8 ống x 5ml)",https://nhathuoclongchau.com.vn/cham-soc-ca-nhan/mucogynev-iprad-8-ong-x-5ml-22146.html
532,Bọt rửa phụ khoa Mincer Hưng Phát phòng và điều trị viêm nhiễm đường sinh dục (150ml),https://nhathuoclongchau.com.vn/cham-soc-ca-nhan/mincer-hung-phat-15oml-bot-rua-phu-khoa-22295.html
533,Xịt mũi Agenytin Hà Thành điều trị viêm mũi và viêm mũi dị ứng (15ml),https://nhathuoclongchau.com.vn/cham-soc-ca-nhan/lo-xit-mui-agenytin-ha-thanh-15ml-22460.html
534,"Kẹo dẻo Abu And Adi Bibica mùi hoa quả bổ sung vitamin, tăng sức đề kháng (30 viên)",https://nhathuoclongchau.com.vn/cham-soc-ca-nhan/keo-deo-ao-duong-abu-adi-bibica-22711.html
535,Sữa tắm Babe Pediatric Bath Gel làm sạch dịu nhẹ cho da nhạy cảm của bé sơ sinh (100ml),https://nhathuoclongchau.com.vn/cham-soc-ca-nhan/babe-pediatric-bath-gel-100ml-23044.html
536,"Dung dịch vệ sinh phụ nữ Ayame Ladycare cân bằng độ pH, chống viêm ngứa và mùi hôi (25ml)",https://nhathuoclongchau.com.vn/cham-soc-ca-nhan/vspn-hang-ngay-ayame-ladycare-25ml-27806.html
537,"Kẹo Smartlife NATURE Pharma giảm ho, sưng đau họng, hầu, ho khản tiếng (100 viên)",https://nhathuoclongchau.com.vn/cham-soc-ca-nhan/smartlife-trang-an-100v-28504.html
538,"Kẹo ngậm không đường Ricola Glacier Fresh Mint giảm ho, thông cổ mát họng, giảm viêm họng (17.5g)",https://nhathuoclongchau.com.vn/cham-soc-ca-nhan/keo-ngam-ho-khong-duong-ricola-glacier-fresh-mint-thao-moc-bac-ha-175g-28662.html
539,"Tã dán người lớn Caryn siêu thấm size M10, vòng hông 61 x 106cm (10 miếng)",https://nhathuoclongchau.com.vn/cham-soc-ca-nhan/ta-dan-cho-nguoi-lon-caryn-sieu-tham-size-m10-goi-10-mieng-vong-hong-61-106cm-31191.html
540,Thức uống bổ sung ion Pocari Sweat bổ sung nước và các ion thiết yếu (350ml),https://nhathuoclongchau.com.vn/cham-soc-ca-nhan/pocari-sweat-otsuka-350ml-32325.html
541,"Dung dịch rửa tay khô Natural Hand Sanitizer trà xanh và sả chanh làm sạch tay, khử mùi, dưỡng ẩm (500ml)",https://nhathuoclongchau.com.vn/cham-soc-ca-nhan/dung-dich-rua-tay-kho-natural-hand-sanitizer-500ml-33069.html
