product_id,product_name,product_url
542,"Bông tẩy trang xỏ ngón KamiCARE 100% cotton thấm hút tốt, làm  sạch bụi bẩn và tế bào chết trên da (88 miếng)",https://nhathuoclongchau.com.vn/cham-soc-ca-nhan/bong-tay-trang-xo-ngon-kamicare-88-mieng.html
543,Mật ong rừng Điện Biên Honimore hỗ trợ cung cấp dinh dưỡng và năng lượng (720g),https://nhathuoclongchau.com.vn/cham-soc-ca-nhan/mat-ong-rung-dien-bien-honimore-720g-33711.html
544,Dung dịch vệ sinh Sensure' Detergente Intimo làm sạch và giảm mùi hôi cơ quan sinh dục ngoài (100ml),https://nhathuoclongchau.com.vn/cham-soc-ca-nhan/intimo-sensure-100ml-nuoc-rua-phu-khoa-20288.html
545,Băng vệ sinh Diana 23cm Unicharm siêu thấm siêu mỏng cánh (8 miếng),https://nhathuoclongchau.com.vn/cham-soc-ca-nhan/bang-ve-sinh-diana-sieu-tham-sieu-mong-canh-23cm-8-mieng-17922.html
546,Thực phẩm bổ sung GU Roctane Energy Gel Blueberry Pomegranate cung cấp dinh dưỡng và năng lượng (32g),https://nhathuoclongchau.com.vn/cham-soc-ca-nhan/thuc-pham-bo-sung-gu-roctane-energy-gel-blueberry-pomegranate-32-g.html
547,Thực phẩm bổ sung GU Roctane Energy Gel Strawberry Kiwi cung cấp dinh dưỡng và năng lượng (32g),https://nhathuoclongchau.com.vn/cham-soc-ca-nhan/thuc-pham-bo-sung-gu-roctane-energy-gel-strawberry-kiwi-32-g.html
548,Viên muối điện giải Gu Roctane Electrolyte Capsules hỗ trợ bổ sung&nbsp;chất điện giải (4 viên),https://nhathuoclongchau.com.vn/cham-soc-ca-nhan/vien-muoi-dien-giai-gu-roctane-electrolyte-capsule-goi-4-vien-38140.html
549,Thỏi dinh dưỡng hữu cơ RawBite Cacao cung cấp dinh dưỡng và năng lượng (50g),https://nhathuoclongchau.com.vn/cham-soc-ca-nhan/thoi-dinh-duong-huu-co-rawbite-cacao-50g-37547.html
550,Thỏi dinh dưỡng hữu cơ RawBite Cashew hạt điều cung cấp dinh dưỡng và năng lượng (50g),https://nhathuoclongchau.com.vn/cham-soc-ca-nhan/thoi-dinh-duong-huu-co-rawbite-cashew-50g-hat-dieu-37548.html
551,Thỏi dinh dưỡng hữu cơ RawBite Protein cung cấp dinh dưỡng và năng lượng (50g),https://nhathuoclongchau.com.vn/cham-soc-ca-nhan/thoi-dinh-duong-huu-co-rawbite-protetin-50g-37549.html
552,Tổ Yến Chưng Sẵn Kid 18% Yến Best Nest Hội An (6 hũ x 70ml),https://nhathuoclongchau.com.vn/cham-soc-ca-nhan/to-yen-chung-san-kid-best-nest-hoi-an-6-hu-x-70ml-37033.html
553,"Tổ yến chưng sẵn ăn kiêng Best Nest Hội An giúp tăng cường đề kháng, làm đẹp da (6 hũ x 70ml)",https://nhathuoclongchau.com.vn/cham-soc-ca-nhan/to-yen-chung-san-an-kieng-best-nest-hoi-an-6-hu-x-70ml-37034.html
554,"Tổ yến chưng sẵn đông trùng hạ thảo Best Nest Hội An giúp bổ sung dinh dưỡng, tăng cường hệ miễn dịch (6 hũ x 70ml)",https://nhathuoclongchau.com.vn/cham-soc-ca-nhan/to-yen-chung-san-dong-trung-ha-thao-best-nest-hoi-an-6-hu-x-70ml-37035.html
555,"Bột Sơ Ri Globalfarm bổ sung năng lượng, vitamin, khoáng chất và chất chống oxy hóa (10 gói x 5g)",https://nhathuoclongchau.com.vn/cham-soc-ca-nhan/bot-so-ri-globalfarm-10-goi-x-5g-36891.html
556,"Chiết xuất đinh lăng Golden Dila tăng cường thể lực, nâng cao sức đề kháng (5g x 30 gói)",https://nhathuoclongchau.com.vn/cham-soc-ca-nhan/chiet-xuat-dinh-lang-golden-dila-sam-cua-nguoi-viet-30-goi-x-5g-33115.html
557,"Kem đánh răng Lipzo Gum Protect ngăn ngừa tụt nướu, phục hồi chân nướu săn chắc (95g)",https://nhathuoclongchau.com.vn/cham-soc-ca-nhan/kem-danh-rang-lipzo-gum-protect-95g-29818.html
558,"Kem đánh răng Lipzo Gum Protect ngăn ngừa tụt nướu, phục hồi chân nướu săn chắc (185g)",https://nhathuoclongchau.com.vn/cham-soc-ca-nhan/kem-danh-rang-lipzo-gum-protect-185g-29819.html
559,Bàn chải đánh răng Lipzo Kids2 dùng làm sạch răng và khoang miệng&nbsp;cho trẻ em từ 5 tuổi (1 cây),https://nhathuoclongchau.com.vn/cham-soc-ca-nhan/ban-chai-danh-rang-lipzo-kid-s2-29821.html
560,Bàn chải đánh răng Lipzo Crystal Kids giúp hạn chế ngăn ngừa mảng bám gây sâu răng cho trẻ (1 cây),https://nhathuoclongchau.com.vn/cham-soc-ca-nhan/ban-chai-danh-rang-lipzo-crystal-kids-29822.html
561,"Bàn chải đánh răng Lipzo Pro For Man dành riêng cho nam giới, giúp chải sạch những kẽ răng nhỏ nhất (1 cây)",https://nhathuoclongchau.com.vn/cham-soc-ca-nhan/ban-chai-danh-rang-lipzo-pro-for-man-29823.html
562,Bàn chải đánh răng Lipzo Ruby Sensi dành cho răng nhạy cảm của phụ nữ có thai và cho con bú (1 cây),https://nhathuoclongchau.com.vn/cham-soc-ca-nhan/ban-chai-danh-rang-lipzo-ruby-sensi-29825.html
563,"Gel bôi trơn Kly bổ sung lượng chất nhờn, khắc phục chứng khô âm đạo (82g)",https://nhathuoclongchau.com.vn/cham-soc-ca-nhan/gel-boi-tron-kly-82g-32549.html
564,"Kem đánh răng Dental Pro 3D Whitening Formula làm sạch các mảng bám, phục hồi trắng sáng tự nhiên của răng (75ml)",https://nhathuoclongchau.com.vn/cham-soc-ca-nhan/kem-danh-rang-dental-pro-3d-whitening-dot-pha-trang-sang-rang-75ml-32690.html
565,"Kem đánh răng Dental Pro Sensitive Care đặc trị cho răng nhạy cảm, cải thiện tình trạng ê buốt (75ml)",https://nhathuoclongchau.com.vn/cham-soc-ca-nhan/kem-danh-rang-dental-pro-sensitive-care-dac-tri-cho-rang-nhay-cam-75ml-32691.html
566,"Kem đánh răng Dental Pro Anti Parodontit đặc trị viêm nướu, loại bỏ mảng bám ố vàng trên răng (75ml)",https://nhathuoclongchau.com.vn/cham-soc-ca-nhan/kem-danh-rang-dental-pro-anti-parodontit-dac-tri-viem-nuou-75ml-32692.html
567,Pin Fujitsu Alkaline LR03 (4B) FU-W-FI - AAA (Vỉ 4 cục),https://nhathuoclongchau.com.vn/cham-soc-ca-nhan/pin-fujitsu-alkaline-lr03-4b-fu-w-fi-aaa-34795.html
568,Pin Fujitsu Alkaline LR6 (4B) FU-W-FI - AA (Vỉ 4 cục),https://nhathuoclongchau.com.vn/cham-soc-ca-nhan/pin-fujitsu-alkaline-lr6-4b-fu-w-fi-aa-34806.html
569,"Nước súc miệng Valentine Kiddy Thái Dương diệt, ngăn vi khuẩn miệng cho trẻ (250ml)",https://nhathuoclongchau.com.vn/cham-soc-ca-nhan/nsm-thai-duong-danh-cho-tre-em-250ml-14558.html
570,"Nước muối Natriclorid 0.9% Smiles Vĩnh Phúc phòng ngừa nhiễm khuẩn da, răng miệng (10 chai x 1000ml)",https://nhathuoclongchau.com.vn/cham-soc-ca-nhan/natri-clorid-09-vp-smiles-1000ml-x-10-chai-nuoc-muoi-22890.html
571,Kem tẩy lông Veet Silk Fresh Lotus &amp; Jasmine cho da thường (50g),https://nhathuoclongchau.com.vn/cham-soc-ca-nhan/kem-tay-long-veet-silk-fresh-cho-da-thuong-50g-28658.html
572,Kem tẩy lông Veet Silk &amp; Fresh Aloe Vera &amp; Vitamin E cho da nhạy cảm (50g),https://nhathuoclongchau.com.vn/cham-soc-ca-nhan/kem-tay-long-veet-silk-fresh-cho-da-nhay-cam-50g-28659.html
573,"Cháo gạo lứt 3 loại đậu Zummy giàu đạm từ đậu, không chất bảo quản (Lốc 3 hộp)",https://nhathuoclongchau.com.vn/cham-soc-ca-nhan/chao-tien-loi-gao-lut-3-loai-dau-zummy-loc-3-hop.html
574,"Cháo gạo lứt thịt gà đậu đỏ Zummy giàu đạm từ đậu và thịt, không chất bảo quản (Lốc 3 hộp)",https://nhathuoclongchau.com.vn/cham-soc-ca-nhan/chao-tien-loi-gao-lut-thit-ga-dau-do-zummy-loc-3-hop.html
575,"Tăm bông trẻ em Cotton Buds Bông Bạch Tuyết vệ sinh tai, mắt, rốn của trẻ (57 que)",https://nhathuoclongchau.com.vn/cham-soc-ca-nhan/tam-bong-tre-em-bong-bach-tuyet-goi-57-que-32959.html
576,"Kem đánh răng Lacalut Aktiv ngừa viêm nướu, loại bỏ mảng bám và tiêu diệt vi khuẩn (75ml)",https://nhathuoclongchau.com.vn/cham-soc-ca-nhan/thuoc-danh-rang-lacalut-aktiv-651.html
577,Kẹo Vitamin C 20mg Domesco bổ sung năng lượng và các dưỡng chất cần thiết (20 viên),https://nhathuoclongchau.com.vn/cham-soc-ca-nhan/keo-ngam-con-vit-vitamin-c-20mg-chai-20v-14775.html
578,"Tăm bông Meriday mềm mại, tinh khiết, an toàn với da nhạy cảm (10 gói lẻ)",https://nhathuoclongchau.com.vn/trang-thiet-bi-y-te/tam-bong-meriday-40-que-16411.html
579,"Nhíp N-406 Kềm Nghĩa cao cấp, an toàn, độ bền cao (1 cái)",https://nhathuoclongchau.com.vn/cham-soc-ca-nhan/nhip-nghia-n-406-28869.html
580,"Kềm cắt da M.205 Kềm Nghĩa lưỡi sắc mỏng, tinh xảo, độ chính xác cao (1 cái)",https://nhathuoclongchau.com.vn/cham-soc-ca-nhan/kem-nghia-cat-mong-thep-m-205-28871.html
581,"Nhíp N.401 Kềm Nghĩa cao cấp, an toàn, độ bền cao (1 cái)",https://nhathuoclongchau.com.vn/cham-soc-ca-nhan/nhip-nho-long-may-n-401-29559.html
582,"Kẹo the PlayMore hương Nho thơm miệng, mát họng, giảm stress (12g)",https://nhathuoclongchau.com.vn/cham-soc-ca-nhan/keo-the-vi-nho-playmore-goi-12g-30025.html
583,"Kẹo the PlayMore hương Đào thơm miệng, mát họng, giảm stress (12g)",https://nhathuoclongchau.com.vn/cham-soc-ca-nhan/keo-the-vi-dao-sakura-playmore-goi-12g-30027.html
584,"Mật ong nguyên chất Leatherwood Pure Origins chống oxy hóa, tốt cho cơ thể (500g)",https://nhathuoclongchau.com.vn/cham-soc-ca-nhan/mat-ong-huu-co-nguyen-chat-pure-origins-chiet-xuat-tu-hoa-leatherwood-500g-32269.html
585,"Mật ong nguyên chất Leatherwood Pure Origins chống oxy hóa, tốt cho cơ thể (250g)",https://nhathuoclongchau.com.vn/cham-soc-ca-nhan/mat-ong-huu-co-nguyen-chat-pure-origins-chiet-xuat-tu-hoa-leatherwood-250g-32277.html
586,"Tổ yến tinh chế sợi dài Kami Nest bổ dưỡng cho hệ tim mạch, tăng cường hệ thống miễn dịch",https://nhathuoclongchau.com.vn/cham-soc-ca-nhan/tui-giay-xanh-yen-to-kami-nest.html
587,"Kẹo dẻo Ích Nhi Nam Dược bổ sung vitamin, tăng cường sức đề kháng (24g)",https://nhathuoclongchau.com.vn/cham-soc-ca-nhan/keo-deo-ich-nhi-vita-c-24g-28049.html
588,"Gel vệ sinh phụ nữ Ginex Herbal Lavender Vietpharma giúp khử mùi hôi, làm sạch vùng kín, dưỡng ẩm (100ml)",https://nhathuoclongchau.com.vn/cham-soc-ca-nhan/gel-ve-sinh-phu-nu-ginex-herbal-lavender-vietpharma-hop-100-ml.html
589,"Cháo gạo lứt thịt heo đậu xanh Zummy giàu đạm từ đậu và thịt, không chất bảo quản (Lốc 3 hộp)",https://nhathuoclongchau.com.vn/cham-soc-ca-nhan/chao-tien-loi-gao-lut-thit-heo-dau-xanh-zummy-loc-3-hop.html
590,"Gel vệ sinh phụ nữ Dr.Celin Intimate Care vệ sinh nấm men, vi khuẩn vùng kín, khử mùi hôi (180ml)",https://nhathuoclongchau.com.vn/cham-soc-ca-nhan/gel-ve-sinh-phu-nu-dr-celin-healthcare-science-180-ml-1.html
591,"Bột điện giải bù năng lượng 2.0 Hammer vị chocolate hỗ trợ phục hồi glycogen, giảm đau nhức và mệt mỏi sau quá trình vận động (50g)",https://nhathuoclongchau.com.vn/cham-soc-ca-nhan/bot-dien-giai-bu-nang-luong-2-0-hammer-vi-chocolate-goi-50-g.html
592,"Bột điện giải bù năng lượng 2.0 Hammer vị vani hỗ trợ phục hồi glycogen, giảm đau nhức và mệt mỏi sau quá trình vận động (50g)",https://nhathuoclongchau.com.vn/cham-soc-ca-nhan/bot-dien-giai-bu-nang-luong-2-0-hammer-vi-vani-goi-50-g.html
593,Thực phẩm bổ sung Hammer vị dâu tây bổ sung năng lượng trong hoạt động thể thao (50g),https://nhathuoclongchau.com.vn/cham-soc-ca-nhan/bot-dien-giai-phuc-hoi-nang-luong-hammer-vi-dau-tay-goi-50-g.html
594,Bột điện giải phục hồi năng lượng Hammer vị cam vani (50g),https://nhathuoclongchau.com.vn/cham-soc-ca-nhan/bot-dien-giai-phuc-hoi-nang-luong-hammer-vi-cam-vani-goi-50-g.html
595,Thực phẩm bổ sung Hammer Gel Montana Huckleberry bổ sung năng lượng trong hoạt động thể thao (33g),https://nhathuoclongchau.com.vn/thuoc/gel-nang-luong-hammer-montana-huckleberry-goi-33g-38070.html
596,Thực phẩm bổ sung Hammer Gel Espresso bổ sung năng lượng trong hoạt động thể thao (33g),https://nhathuoclongchau.com.vn/cham-soc-ca-nhan/gel-nang-luong-hammer-espresso-goi-33-g.html
597,Bột đạm Now Sports Whey Protein không vị hỗ trợ bổ sung whey protein cho người tập thể thao (544g),https://nhathuoclongchau.com.vn/cham-soc-ca-nhan/bot-dam-now-whey-protein-isolate-khong-vi-544-g.html
598,Bột đạm Now Sports Whey Protein Isolate vị sô-cô-la hỗ trợ bổ sung whey protein cho người tập thể thao (816g),https://nhathuoclongchau.com.vn/cham-soc-ca-nhan/bot-dam-now-whey-isolate-vi-so-co-la-816-g.html
599,"Bàn chải đánh răng điện Oral-B Pro600 D16.513 loại bỏ các mảng bám,&nbsp;làm sạch răng và khoang miệng&nbsp;cho người lớn",https://nhathuoclongchau.com.vn/cham-soc-ca-nhan/ban-chai-danh-rang-nguoi-lon-cao-cap-oral-b-pro600-d16513-sac-dien-35517.html
600,Bàn chải đánh răng điện Oral-B Vitality CrossAction White D100.413.1 loại bỏ được mảng bám và vết ố trên răng,https://nhathuoclongchau.com.vn/cham-soc-ca-nhan/ban-chai-danh-rang-nguoi-lon-oral-b-vitality-crossaction-white-d1004131-sac-dien-35518.html
601,"Bột Atisô Nguyên Chất Datino giúp mát gan, giải độc cơ thể (3g x 15 gói)",https://nhathuoclongchau.com.vn/cham-soc-ca-nhan/bot-atiso-nguyen-chat-datino-15-goi-34509.html
602,Bàn chải điện Halio Sonic Whitening Toothbrush Pro Periwinkle Limited Editon làm trắng răng,https://nhathuoclongchau.com.vn/cham-soc-ca-nhan/ban-chai-dien-lam-trang-rang-halio-sonic-whitening-toothbrush-pro-periwinkle-limited-editon-34108.html
603,Bàn chải điện làm trắng răng Halio Sonic Whitening Toothbrush Pro Rose Gold,https://nhathuoclongchau.com.vn/cham-soc-ca-nhan/ban-chai-dien-lam-trang-rang-halio-sonic-whitening-toothbrush-pro-rose-gold-34109.html
604,Bông làm sạch da CALLA Bạch Tuyết sạch sâu và cấp ẩm (80 miếng),https://nhathuoclongchau.com.vn/duoc-my-pham/bong-lam-sach-da-calla-sach-sau-hop-80-miengbong-lam-sach-da-calla-sach-sau-hop-80-mieng-32965.html
605,"Tăm bông Cotton Buds Bạch Tuyết tiện dụng cho trang điểm, tẩy trang (200 que)",https://nhathuoclongchau.com.vn/cham-soc-ca-nhan/tam-bong-nguoi-lon-bong-bach-tuyet-hop-tron-200-que-32958.html
606,"Tăm bông Cotton Buds Bông Bạch Tuyết tiện dụng&nbsp;cho trang điểm, tẩy trang (42 que)",https://nhathuoclongchau.com.vn/cham-soc-ca-nhan/tam-bong-nguoi-lon-bong-bach-tuyet-goi-42-que-32957.html
607,"Trà thảo dược Boganic Traphaco không đường giải nhiệt, thanh lọc, mát gan (290ml)",https://nhathuoclongchau.com.vn/cham-soc-ca-nhan/tra-thao-duoc-boganic-traphaco-290ml-khong-duong-32933.html
608,Viên nén Chè Vằng Lợi Sữa Kingphar bồi bổ sức khỏe cho phụ nữ sau sinh (60 viên),https://nhathuoclongchau.com.vn/cham-soc-ca-nhan/che-vang-loi-sua-112.html
609,"Kem dưỡng da Johnson's Baby Cream phòng tránh nứt nẻ, khô da cho mẹ và bé (50g)",https://nhathuoclongchau.com.vn/cham-soc-ca-nhan/kem-duong-da-gohnsons-baby-cream-565.html
610,Sữa tắm gội toàn thân cho bé Top To Toe Johnson's không cay mắt (200ml),https://nhathuoclongchau.com.vn/cham-soc-ca-nhan/sua-tam-goi-toan-than-gohnsons-baby-200ml-573.html
611,Dầu gội cho bé Johnson's Baby Shampoo không cay mắt (100ml),https://nhathuoclongchau.com.vn/cham-soc-ca-nhan/dau-goi-tre-em-gohnsons-baby-575.html
612,"Kem đánh răng Kin Gingival ngăn ngừa và phòng chống sâu răng, viêm nướu (75ml)",https://nhathuoclongchau.com.vn/cham-soc-ca-nhan/kem-danh-rang-kin-gingival-646.html
613,"Viên ngậm Manukan Cinnamon bổ phế, làm dịu ho, rát họng (2 vỉ x 8 viên)",https://nhathuoclongchau.com.vn/cham-soc-ca-nhan/vien-ngam-manukan-cinnamon-724.html
614,"Nước cốt gà Brand's tăng cường trí nhớ, độ tập trung (6 lọ x 7ml)",https://nhathuoclongchau.com.vn/cham-soc-ca-nhan/nuoc-cot-ga-brands-70g-dinh-duong-trong-tam-tay-725.html
615,Nước yến sào Sanest Khánh Hoà hỗ trợ tăng sức đề kháng cho cơ thể (6 hũ x 70ml),https://nhathuoclongchau.com.vn/cham-soc-ca-nhan/yen-sao-khanh-hoa-sanest-6-hu-x-70ml-734.html
616,Kẹo gừng Gutaca ADC làm ấm bụng và họng (10 hộp x 20 viên),https://nhathuoclongchau.com.vn/cham-soc-ca-nhan/keo-gung-gutaca-745.html
617,"Mật ong nghệ đen Ban Mê Thuột hỗ trợ tiêu hóa, giảm đầy hơi, viêm loét dạ dày (120g)",https://nhathuoclongchau.com.vn/cham-soc-ca-nhan/mat-ong-nghe-den-ban-me-thuot-120g-751.html
618,"Mật ong nghệ đen Ban Mê Thuột hỗ trợ tiêu hóa, giảm đầy hơi, viêm loét dạ dày (250g)",https://nhathuoclongchau.com.vn/cham-soc-ca-nhan/mat-ong-nghe-den-ban-me-thuot-250g-754.html
619,"Nước Yến Sào 7,5% Khánh Hòa Sanest có đường, phục hồi sức khỏe (Hộp 70ml)",https://nhathuoclongchau.com.vn/cham-soc-ca-nhan/nuoc-yen-sanest-co-duong-857.html
620,Trà túi lọc Giải Độc Gan Tuệ Linh hỗ trợ tăng cường chức năng gan (8g x 5 gói),https://nhathuoclongchau.com.vn/cham-soc-ca-nhan/tra-giai-doc-gan-tue-linh-889.html
621,"Trà túi lọc Giảo Cổ Lam Tuệ Linh giúp hạ mỡ máu, giảm cholesterol (10 gói)",https://nhathuoclongchau.com.vn/cham-soc-ca-nhan/tra-giao-co-lam-tue-linh-890.html
622,"Trà túi lọc Hoàn Ngọc 7 Nga Tây Ninh giải nhiệt, giải độc gan, nâng cao thể lực (30 túi)",https://nhathuoclongchau.com.vn/cham-soc-ca-nhan/tra-tui-loc-hoan-ngoc-xanh-894.html
623,"Trà Lạc Tiên Lava hỗ trợ điều trị suy nhược thần kinh, tim hồi hộp (5g x 30 túi) ",https://nhathuoclongchau.com.vn/cham-soc-ca-nhan/tra-lac-tien-dieu-hoa-giac-ngu-895.html
624,"Trà túi lọc Trinh Nữ Hoàng Cung Lava giảm quá trình hình thành u xơ tử cung, u xơ tiền liệt tuyến (4g x 30 gói)",https://nhathuoclongchau.com.vn/cham-soc-ca-nhan/tra-trinh-nu-hoang-cung-giam-u-xo-tu-cung-923.html
625,"Viên ngậm Hobezut Vinacare không đường, giảm triệu chứng ho cảm (5 vỉ x 4 viên)",https://nhathuoclongchau.com.vn/cham-soc-ca-nhan/hobezut-khong-duong-5x4-keo-ngam-giam-ho-dau-hong-997.html
626,"Viên ngậm Zecuf Herbal Drops Unique Pharma vị cam giúp ấm họng, nhuận phế, giảm triệu chứng ho (5 vỉ x 4 viên)",https://nhathuoclongchau.com.vn/cham-soc-ca-nhan/zecuf-vien-ngam-ho-vi-cam-1693.html
627,Kẹo ngậm không đường Pulmoll Extra Stark hỗ trợ bổ sung vitamin C cho cho cơ thể (50g) ,https://nhathuoclongchau.com.vn/cham-soc-ca-nhan/pulmoll-extra-stark-2492.html
628,"Kẹo ngậm không đường Pullmoll hương vị khuynh diệp bạc hà thông cổ, làm ấm đường hô hấp (50g)",https://nhathuoclongchau.com.vn/cham-soc-ca-nhan/pulmoll-eucalyptus-h50g-2494.html
629,"Kẹo Codatux Hương Cam ADC hỗ trợ giảm ho, long đờm, nhuận phế (100 vỉ x 2 viên)",https://nhathuoclongchau.com.vn/cham-soc-ca-nhan/codatux-cam-4202.html
630,"Dung dịch vệ sinh phụ nữ Crevil Intim Waschlotion diệt khuẩn, kháng viêm (300ml)",https://nhathuoclongchau.com.vn/cham-soc-ca-nhan/crevil-300ml-14164.html
631,Kẹo ngậm không đường Pulmoll Kirsche vị anh đào hỗ trợ bổ sung vitamin C cho cơ thể (50g),https://nhathuoclongchau.com.vn/cham-soc-ca-nhan/pulmoll-pastillen-kirschvitamin-c-50g-14215.html
632,"Viên ngậm thảo dược Calytos giúp thơm miệng, mát họng, ấm bụng (20 viên)",https://nhathuoclongchau.com.vn/cham-soc-ca-nhan/vien-ngam-thao-duoc-calytos-14278.html
633,"Dung dịch vệ sinh phụ nữ Quý Phi Sao Thái Dương chống ngứa, chống viêm, khử mùi hôi (120ml)",https://nhathuoclongchau.com.vn/cham-soc-ca-nhan/dd-ve-sinh-phu-nu-quy-phi-120ml-thai-duong-14317.html
634,"Kẹo gừng Gingerbon Chanh Mật Ong giải cảm, giảm cảm giác say tàu xe (125g)",https://nhathuoclongchau.com.vn/cham-soc-ca-nhan/keo-gung-gingerbon-chanh-mat-ong-125g-14375.html
635,"Trà túi lọc Giảo Cổ Lam Extra Kingphar giảm cholesterol, giải độc gan (2g x 25 túi)",https://nhathuoclongchau.com.vn/cham-soc-ca-nhan/tra-giao-co-lam-extra-25-tui-kingphar-14399.html
636,"Sữa rửa tay Thảo Dược Kingphar làm sạch đến 99.9% vi khuẩn, giữ ẩm và bảo vệ da tay (500ml)",https://nhathuoclongchau.com.vn/cham-soc-ca-nhan/sua-rua-tay-thao-duoc-kingphar-500ml-14407.html
637,"Gel rửa tay khô Green Cross hương trà xanh làm sạch tay, kháng khuẩn, khử mùi (100ml)",https://nhathuoclongchau.com.vn/cham-soc-ca-nhan/gel-rt-green-cross-huong-tra-xanh-100ml-14434.html
638,Viên ngậm không đường Doublemint Mints hương bạc hà giúp hơi thở thơm mát và khử mùi hôi miệng (23.8g),https://nhathuoclongchau.com.vn/cham-soc-ca-nhan/keo-ngam-doublemint-mints-peppermint-tuyp-238g-14449.html
639,Viên ngậm không đường Doublemint Mints hương cam giúp hơi thở thơm tho và khử mùi hôi miệng (23.8g),https://nhathuoclongchau.com.vn/cham-soc-ca-nhan/keo-ngam-doublemint-mints-orange-tuyp-238g-14450.html
640,Viên ngậm không đường Doublemint Mints hương Spearmint giúp hơi thở thơm mát và khử mùi hôi miệng (23.8g),https://nhathuoclongchau.com.vn/cham-soc-ca-nhan/keo-ngam-doublemin-mints-spearmint-tuyp-238g-14451.html
641,"Gel vệ sinh phụ nữ Nữ Vương Vinh Gia khử mùi, ngăn ngừa viêm nhiễm, nấm, ngứa (100ml)",https://nhathuoclongchau.com.vn/cham-soc-ca-nhan/nu-vuong-100ml-vinh-gia-14731.html
642,"Kẹo sing-gum Cool Air Hương Bạc Hà sát khuẩn, thơm miệng, ngăn ngừa sâu răng (11.6g)",https://nhathuoclongchau.com.vn/cham-soc-ca-nhan/keo-singum-cool-air-huong-bac-ha-vi-14742.html
643,"Bao cao su OK hương bạc hà, độ đàn hồi tốt, dai bền, ngăn nguy cơ bệnh lây lan qua đường tình dục (3 cái)",https://nhathuoclongchau.com.vn/cham-soc-ca-nhan/bcs-ok-huong-bac-ha-3s-14819.html
644,Sữa tắm dưỡng ẩm Johnson's Body Care Lasting Moisture Body Wash (750ml),https://nhathuoclongchau.com.vn/cham-soc-ca-nhan/johnsons-body-care-lasting-moisture-body-wash-750ml-sua-tam-14857.html
645,Phấn thơm Johnson's Baby Blossom giúp da bé khỏi bị mẩn ngứa (combo 2 chai 500g),https://nhathuoclongchau.com.vn/cham-soc-ca-nhan/combo-jonhson-baby-powder-blossoms-500g-14909.html
646,"Phấn thơm Johnson's Baby Blossom giúp da bé khỏi bị mẩn ngứa, khó chịu (combo 4 chai x 200g)",https://nhathuoclongchau.com.vn/cham-soc-ca-nhan/combo-jonhson-baby-powder-blossoms-200g-14910.html
647,Phấn thơm Johnson's Baby Blossom giúp da bé khỏi bị mẩn ngứa (combo 4 chai x 100g),https://nhathuoclongchau.com.vn/cham-soc-ca-nhan/combo-johnson-baby-powder-blossoms-100g-14911.html
648,"Dầu tràm Con Yêu 100% từ cây tràm gió điều trị mụn nhọt, giảm đau, cảm cúm (50ml)",https://nhathuoclongchau.com.vn/duoc-my-pham/dau-tram-con-yeu-50ml-14968.html
649,"Kẹo ngậm ho không đường Pulmoll Sabor Eucalipto vị khuynh diệp thông cổ, làm ấm đường hô hấp, giảm ho khan (20g) ",https://nhathuoclongchau.com.vn/cham-soc-ca-nhan/pulmoll-sabor-eucalipto-20g-bac-ha-15135.html
650,"Dung dịch vệ sinh phụ nữ Phytogyno Opodis Pharma kháng khuẩn, nấm (combo 2 chai 100ml)",https://nhathuoclongchau.com.vn/cham-soc-ca-nhan/phytogyno-100ml-cap-15163.html
651,"Cao Hà Thủ Ô Lava bồi bổ cơ thể, đẹp da, trị suy nhược thần kinh, ích huyết (50ml)",https://nhathuoclongchau.com.vn/cham-soc-ca-nhan/cao-ha-thu-o-50ml-lava-15223.html
652,Thảo dược Methi Ấn Độ hỗ trợ giảm đường huyết cho người tiểu đường (500g),https://nhathuoclongchau.com.vn/cham-soc-ca-nhan/thao-duoc-methi-an-do-500g-xanh-15279.html
653,"Gel rửa tay Green Cross Kids hương trái cây làm sạch tay, kháng khuẩn, khử mùi (100ml)",https://nhathuoclongchau.com.vn/cham-soc-ca-nhan/gel-rua-tay-green-cross-kids-trai-cay-100ml-15312.html
654,"Sữa tắm dưỡng ẩm Johnson’S Baby Milk + Rice Bath giúp chăm sóc da, bổ sung vitamin (1000ml)",https://nhathuoclongchau.com.vn/cham-soc-ca-nhan/johnsons-baby-bath-milk-rice-1l-15343.html
655,"Trà giảm cân Kingphar Slim hạn chế hấp thu năng lượng từ chất béo, giảm cholesterol, kiểm soát cân nặng (15 gói x 4g)",https://nhathuoclongchau.com.vn/cham-soc-ca-nhan/tra-giam-can-kingphar-slim-4g-15360.html
656,"Tăm bông trẻ em Merigo Bạch Tuyết mềm mại, tinh khiết, an toàn với da nhạy cảm (55 que)",https://nhathuoclongchau.com.vn/trang-thiet-bi-y-te/tam-bong-merigo-55-que-15404.html
657,"Miếng ngậm Listerine CoolMint Pocketpaks diệt sạch vi khuẩn có hại trong miệng, hơi thở thơm tho (24 miếng)",https://nhathuoclongchau.com.vn/cham-soc-ca-nhan/listerine-coolmint-pocketpaks-24-15587.html
658,"Gel rửa tay Green Cross Kids hương cam làm sạch tay, kháng khuẩn, khử mùi (100ml)",https://nhathuoclongchau.com.vn/cham-soc-ca-nhan/gel-rua-tay-green-cross-kids-huong-cam-100ml-15663.html
659,Kem đánh răng Sensikin giảm ê buốt răng nhạy cảm (75ml x 90g),https://nhathuoclongchau.com.vn/cham-soc-ca-nhan/kem-danh-rang-sensikin-75ml90g-15677.html
660,"Sữa vệ sinh phụ nữ Foreva Care Plus Reliv làm sạch, khử mùi, giảm ngứa rát (80ml)",https://nhathuoclongchau.com.vn/cham-soc-ca-nhan/foreva-perfect-ph-80ml-15694.html
661,"Nước yến sào Khánh Hoà Sanest không đường hỗ trợ hồi phục sức khỏe, tăng sức đề kháng (6 lọ x 70ml)",https://nhathuoclongchau.com.vn/cham-soc-ca-nhan/yen-sao-khanh-hoa-loc-6-kd-15767.html
662,"Bao cao su OK hương chuối độ đàn hồi tốt, dai bền, ngăn nguy cơ bệnh lây lan qua đường tình dục (3 cái)",https://nhathuoclongchau.com.vn/cham-soc-ca-nhan/bcs-ok-huong-chuoi-15777.html
663,"Kẹo sing-gum không đường Extra hương Dâu ngăn ngừa sâu răng, làm thơm miệng, mát họng",https://nhathuoclongchau.com.vn/cham-soc-ca-nhan/keo-singum-khong-duong-extra-dau-vi-15792.html
