product_id,product_name,product_url
1348,"Dung dịch uống Beyou Blanc giúp đẹp da, sáng da (6 chai x 30ml)",https://nhathuoclongchau.com.vn/thuc-pham-chuc-nang/beyou-blanc-hop-6chaix30ml-14441.html
1349,"Viên uống Tăng Sinh Lady Kingphar hỗ trợ tăng cường hormon nữ, điều hòa kinh nguyệt (40 viên)",https://nhathuoclongchau.com.vn/thuc-pham-chuc-nang/tang-sinh-lady-kingphar-40v-14444.html
1350,Viên uống Hair Plus Doppelherz Aktiv bổ sung một số vitamin và khoáng chất (3 vỉ x 10 viên),https://nhathuoclongchau.com.vn/thuc-pham-chuc-nang/doppelherz-aktiv-hair-plus-30v-14452.html
1351,Viên Bào Ngư Calichi Gpharm giúp cải thiện chức năng thận (60 viên),https://nhathuoclongchau.com.vn/thuc-pham-chuc-nang/vien-bao-ngu-calichi-60v-gpharm-14458.html
1352,"Viên tinh dầu tỏi Garlic Essential Oil UBB hỗ trợ ngừa cảm cúm, ăn không tiêu (100 viên)",https://nhathuoclongchau.com.vn/thuc-pham-chuc-nang/ubb-garlic-essential-oil-100v-14501.html
1353,Viên uống DePago Ăn Ngon Ngủ Tốt giúp dưỡng tâm an thần (12 vỉ x 5 viên),https://nhathuoclongchau.com.vn/thuc-pham-chuc-nang/depago-an-ngon-ngu-tot-12x5-14502.html
1354,Viên uống Tamlan Health Functional Pine Oil tăng cường chức năng gan (100 viên),https://nhathuoclongchau.com.vn/thuc-pham-chuc-nang/tamlan-healthy-functional-pine-oil-dau-thong-do-100v-14531.html
1355,Dung dịch Ngưu Hoàng Thanh Tâm Liquid Nam Hà giúp tăng cường sức khỏe tim mạch (10 lọ x 50ml),https://nhathuoclongchau.com.vn/thuc-pham-chuc-nang/nguu-hoang-thanh-tam-liquid-hop-10-lo-50ml-14550.html
1356,"Viên uống Cumargold Fast CVI hỗ trợ giảm đau nhanh, lành vết loét dạ dày (3 vỉ x 10 viên)",https://nhathuoclongchau.com.vn/thuc-pham-chuc-nang/cumargold-fast-3x10-cvipharma-14553.html
1357,Viên ngậm IgYGate DC-PG hỗ trợ bảo vệ răng (5 vỉ x 12 viên),https://nhathuoclongchau.com.vn/thuc-pham-chuc-nang/igygate-dc-pg-hop-12x5-14588.html
1358,"Siro ăn ngon Íchnhi Nam Dược bổ sung vi chất dinh dưỡng, cải thiện chứng biếng ăn cho trẻ (4 vỉ x 5 ống)",https://nhathuoclongchau.com.vn/thuc-pham-chuc-nang/siro-an-ngon-ich-nhi-4x5-ong-10ml-14622.html
1359,"Viên uống Enlefzin Hulipha cân bằng vi khuẩn đường ruột, hỗ trợ chức năng tiêu hóa (3 vỉ x 10 viên)",https://nhathuoclongchau.com.vn/thuc-pham-chuc-nang/enlefzin-hop-30v-hulipha-14635.html
1360,Viên xương khớp Khương Thảo Đan hỗ trợ làm trơn khớp và phục hồi sụn khớp (30 viên),https://nhathuoclongchau.com.vn/thuc-pham-chuc-nang/khuong-thao-dan-hop-30v-divapharma-14695.html
1361,"Viên uống Cốt Thống Long Phụng bổ gan thận, mạnh gân cốt (10 vỉ x 2 viên)",https://nhathuoclongchau.com.vn/thuc-pham-chuc-nang/cot-thong-long-phung-20v-14737.html
1362,Viên uống Nato Thông Huyết Kingphar hỗ trợ điều trị các căn bệnh tai biến não (3 vỉ x 10 viên),https://nhathuoclongchau.com.vn/thuc-pham-chuc-nang/nato-thong-huyet-kingphar-30v-14755.html
1363,"Dung dịch Yến Sào NS One Nest tăng sức đề kháng, bồi bổ cho trẻ biếng ăn, suy dinh dưỡng (120ml)",https://nhathuoclongchau.com.vn/thuc-pham-chuc-nang/yen-sao-ns-one-nest-120ml-14756.html
1364,Viên uống Hoạt Huyết Bổ Máu Đại Bắc tăng cường lưu thông máu (4 vỉ x 15 viên),https://nhathuoclongchau.com.vn/thuc-pham-chuc-nang/hoat-huyet-bo-mau-dai-bac-4x15-14776.html
1365,Viên sủi Aktiv Vitamin C + Zinc Doppelherz Aktiv bổ sung vitamin C và kẽm cần thiết cho cơ thể (15 viên),https://nhathuoclongchau.com.vn/thuc-pham-chuc-nang/doppelherz-aktiv-vitamin-c-zinc-tuyp-15v-14782.html
1366,Viên uống Tiền Liệt Vương Tuệ Linh giúp hạn chế phát triển phì đại tiền liệt tuyến (3 vỉ x 10 viên),https://nhathuoclongchau.com.vn/thuc-pham-chuc-nang/tien-liet-vuong-3x10-14787.html
1367,"Cốm Unikids Kẽm DHG bổ sung kẽm, khoáng chất giúp hấp thu và tiêu hóa tốt (50g)",https://nhathuoclongchau.com.vn/thuc-pham-chuc-nang/unikids-kem-50g-14788.html
1368,"Viên uống Curpenin Nhất Phát giảm rối loạn lipid máu, hạ cholesterol và triglycerid (5 vỉ x 12 viên)",https://nhathuoclongchau.com.vn/thuc-pham-chuc-nang/curpenin-5x12-nhat-phat-14790.html
1369,"Viên sáng mắt Lutein Kingphar tăng cường thị lực, chống thoái hóa điểm vàng (3 vỉ x 10 viên)",https://nhathuoclongchau.com.vn/thuc-pham-chuc-nang/vien-sang-mat-kingphar-30v-14804.html
1370,Viên uống Codatux Softcap ADC giảm ho đau họng (110 viên),https://nhathuoclongchau.com.vn/thuc-pham-chuc-nang/codatux-softcap-giam-ho-dau-hong-11x10-14812.html
1371,"Viên uống Detocap Hulipha bổ gan, giải độc gan (60 viên)",https://nhathuoclongchau.com.vn/thuc-pham-chuc-nang/detocap-60v-hulipha-14820.html
1372,Viên uống Vững Mạch Chi NanoGold hỗ trợ điều trị giãn tĩnh mạch (30 viên) ,https://nhathuoclongchau.com.vn/thuc-pham-chuc-nang/vung-mach-chi-30-vien-14840.html
1373,"Cốm vi sinh Oviotic Traphaco bổ sung lợi khuẩn cho đường tiêu hóa, cung cấp 9 vitamin (20 gói)",https://nhathuoclongchau.com.vn/thuc-pham-chuc-nang/com-vi-sinh-oviotic-20-goi-traphaco-14851.html
1374,"Viên uống Lasenvon Hulipha hỗ trợ dưỡng tâm, an thần, ngủ ngon (6 vỉ x 10 viên)",https://nhathuoclongchau.com.vn/thuc-pham-chuc-nang/lasenvon-6x10-14854.html
1375,"Viên uống Dzaxinh GPharm mát gan, ngừa mụn (6 vỉ x 10 viên)",https://nhathuoclongchau.com.vn/thuc-pham-chuc-nang/gpharm-dzaxinh-60v-14882.html
1376,"Viên uống Hobezut Vinacare giảm ho do viêm phế quản, ho gió, ho khan, ho dị ứng (3 vỉ x 10 viên)",https://nhathuoclongchau.com.vn/thuc-pham-chuc-nang/hobezut-3x10-vien-14890.html
1377,"Viên uống Cao Dẻ Ngựa An Dược hỗ trợ tăng sức bền thành mạch, giảm nguy cơ trĩ có biến chứng (3 vỉ x 10 viên)",https://nhathuoclongchau.com.vn/thuc-pham-chuc-nang/vien-cao-de-ngua-3x10-14900.html
1378,"Viên uống Delfina Nhất Nhất bổ huyết, dưỡng nhan (80 viên)",https://nhathuoclongchau.com.vn/thuc-pham-chuc-nang/delfina-lo-80-vien-14912.html
1379,"Viên uống Cota Xoang Amepro tăng lưu thông phế khí trong cơ thể, thông mũi xoang (3 vỉ x 10 viên)",https://nhathuoclongchau.com.vn/thuc-pham-chuc-nang/cotaxoang-3x10-amepro-vn-14955.html
1380,Viên uống Thống Phong Nhất Nhất dùng trong bệnh đau nhức mỏi cơ khớp (60 viên),https://nhathuoclongchau.com.vn/thuc-pham-chuc-nang/thong-phong-nhat-nhat-60v-14957.html
1381,"Viên uống Kisu giảm hấp thụ mỡ, hỗ trợ giảm cân (16 viên)",https://nhathuoclongchau.com.vn/thuc-pham-chuc-nang/giam-can-kisu-hop-16v-14990.html
1382,Viên uống Bảo Xuân Tuổi 50+ Nam Dược cân bằng nội tiết tố nữ (3 vỉ x 10 viên),https://nhathuoclongchau.com.vn/thuc-pham-chuc-nang/bao-xuan-tuoi-50-combo-15033.html
1383,"Siro Yến Sào Ăn Ngủ Ngon Hải Linh bồi bổ cơ thể, dưỡng tâm, an thần (4 vỉ x 5 ống x 10ml)",https://nhathuoclongchau.com.vn/thuc-pham-chuc-nang/happy-healthy-hai-linh-4x5-siro-yen-sao-an-ngu-ngon-15034.html
1384,"Bột uống Dạ Dày Nam Dược hỗ trợ điều trị viêm loét dạ dày, tá tràng (12 gói)",https://nhathuoclongchau.com.vn/thuc-pham-chuc-nang/da-day-nam-duoc-12-goi-15040.html
1385,"Viên uống Glutathione X3 Class Of Ladies Phytextra hỗ trợ làm đẹp da, trẻ hóa làn da (60 viên)",https://nhathuoclongchau.com.vn/thuc-pham-chuc-nang/glutathione-x3-class-of-ladies-60v-15049.html
1386,"Dưỡng Thận Tuệ Linh lợi niệu, giải độc, đào thải độc tố (20 gói x 4g)",https://nhathuoclongchau.com.vn/thuc-pham-chuc-nang/duong-than-tue-linh-20-goi-x-4g-15083.html
1387,"Viên uống Thanh Mạch An Gpharm giúp kiểm soát mỡ máu, giảm cholesterol (60 viên)",https://nhathuoclongchau.com.vn/thuc-pham-chuc-nang/thanh-mach-an-gpharm-6x10-15085.html
1388,"Viên nén Xích Thố Vương Gia Nguyễn bổ thận, tráng dương, tăng cường sinh lực (60 viên)",https://nhathuoclongchau.com.vn/thuc-pham-chuc-nang/xich-tho-vuong-lo-60v-15090.html
1389,"Siro Ích Nhi Nam Dược tăng sức đề kháng, phòng bệnh hiệu quả (3 vỉ x 5 ống)",https://nhathuoclongchau.com.vn/thuc-pham-chuc-nang/siro-tang-suc-de-khang-ich-nhi-3x5-ong-15102.html
1390,Viên uống Bedipanten 100mg Mediphar bổ sung vitamin B5 cho cơ thể (2 vỉ x 10 viên),https://nhathuoclongchau.com.vn/thuc-pham-chuc-nang/bedipanten-100mg-mdp-2x10-15116.html
1391,"Viên uống Đại Tràng Nam Dược hỗ trợ điều trị rối loạn tiêu hóa, tiêu chảy, đau bụng (3 vỉ x 10 viên)",https://nhathuoclongchau.com.vn/thuc-pham-chuc-nang/dai-trang-nam-duoc-3x10-15158.html
1392,"Siro Ho Kim Sâm Khí An Medistar giúp bổ phối, giảm rát họng (120ml)",https://nhathuoclongchau.com.vn/thuc-pham-chuc-nang/siro-ho-kim-sam-khi-an-120ml-15192.html
1393,"Viên uống Pharysol Fuma hỗ trợ điều trị viêm thanh quản, viêm họng (30 viên)",https://nhathuoclongchau.com.vn/thuc-pham-chuc-nang/pharysol-30v-15193.html
1394,"Viên uống Phụng Nguyệt An Gpharm giúp bổ huyết, điều kinh (60 viên)",https://nhathuoclongchau.com.vn/thuc-pham-chuc-nang/phung-nguyet-an-gpharm-60v-15211.html
1395,"Viên uống Ích Thận Hoàng Kingphar bổ thận, dưỡng huyết (30 viên)",https://nhathuoclongchau.com.vn/thuc-pham-chuc-nang/ich-than-hoang-30v-kingphar-15212.html
1396,"Viên uống Kangaroo Essence For Men Nature's Gold bồi bổ cơ thể, tăng cường sinh lực (30 viên)",https://nhathuoclongchau.com.vn/thuc-pham-chuc-nang/natures-gold-kangaroo-for-men-30v-15216.html
1397,"Viên uống PM NextG Cal Kids MBC bổ sung vitamin, giúp hệ thống xương chắc khỏe (30 viên)",https://nhathuoclongchau.com.vn/thuc-pham-chuc-nang/nextg-cal-kids-pm-mbc-30-vien-15221.html
1398,"Viên uống Antri Nano Plus CVI Pharma hỗ trợ điều trị trĩ, giảm táo bón (3 vỉ x 10 viên)",https://nhathuoclongchau.com.vn/thuc-pham-chuc-nang/antri-nano-plus-3x10-15226.html
1399,"Viên uống Crisuccess TC Pharma hoạt huyết, hóa ứ, giảm u xơ lành tính tuyến tiền liệt (60 viên)",https://nhathuoclongchau.com.vn/thuc-pham-chuc-nang/risuccess-60v-tc-pharma-15281.html
1400,"Viên uống An Não Vương USA Pharma tăng cường trí nhớ, tập trung trí tuệ (30 viên) ",https://nhathuoclongchau.com.vn/thuc-pham-chuc-nang/an-nao-vuong-usa-pharma-30v-15287.html
1401,Viên nhai A-A Super Man vị nho tăng sức đề kháng (22 viên),https://nhathuoclongchau.com.vn/thuc-pham-chuc-nang/vien-nhai-aa-super-man-nho-22v-15309.html
1402,"Viên uống Vitraplus Livpro bảo vệ tế bào gan, giải độc gan (30 viên)",https://nhathuoclongchau.com.vn/thuc-pham-chuc-nang/livpro-30v-vitraplus-15367.html
1403,"Viên nén Xukoda Hoàng Thăng Long giúp tăng tiết dịch khớp, hỗ trợ giảm tình trạng đau khớp (90 viên)",https://nhathuoclongchau.com.vn/thuc-pham-chuc-nang/xukoda-lo-90v-15368.html
1404,Viên uống Davita Bone DHG giúp xương chắc khỏe (3 vỉ x 10 viên),https://nhathuoclongchau.com.vn/thuc-pham-chuc-nang/davita-bone-plus-3x10-15372.html
1405,"Dung dịch uống Bee Juvit hỗ trợ tăng cường tiêu hóa, ăn ngon miệng (4 vỉ x 5 ống x 10ml)",https://nhathuoclongchau.com.vn/thuc-pham-chuc-nang/bee-juvit-an-ngon-10ml-4x5-15396.html
1406,Siro Bone Power ChildLife Plus tăng cường sự phát triển chiều cao và độ chắc của xương (474ml),https://nhathuoclongchau.com.vn/thuc-pham-chuc-nang/childlife-plus-bone-power-474ml-15397.html
1407,Viên uống Thanh Áp Đan IPHA giúp hạ và ổn định huyết áp (3 vỉ x 10 viên),https://nhathuoclongchau.com.vn/thuc-pham-chuc-nang/thanh-ap-dan-3x10-ipha-15418.html
1408,Sữa Glucerna Abbott hương vani bổ sung dinh dưỡng đặc biệt cho người đái tháo đường (24 chai x 220ml),https://nhathuoclongchau.com.vn/thuc-pham-chuc-nang/sua-glucerna-vani-abbott-220-ml-x-24-chai.html
1409,Viên uống Ultra Memore Plus Vitamins For Life hỗ trợ tăng cường hoạt động tuần hoàn não (30 viên),https://nhathuoclongchau.com.vn/thuc-pham-chuc-nang/ultra-memore-plus-30v-15465.html
1410,Viên uống Tuệ Đức Hoàn Nguyên Vị hỗ trợ giảm trào ngược dạ dày thực quản (2 lọ x 40 viên),https://nhathuoclongchau.com.vn/thuc-pham-chuc-nang/hoan-nguyen-vi-2-lo-80v-15519.html
1411,Bột pha uống Nufit Enesol hương cam bổ sung chất xơ và các vitamin (5.9g),https://nhathuoclongchau.com.vn/thuc-pham-chuc-nang/enesol-cam-15599.html
1412,Bột pha uống Nufit Enesol hương dâu bổ sung chất xơ và các vitamin (5.9g),https://nhathuoclongchau.com.vn/thuc-pham-chuc-nang/enesol-dau-15600.html
1413,"Viên nén Xukoda Hoàng Thăng Long giúp tăng tiết dịch khớp, hỗ trợ giảm tình trạng đau khớp (3 vỉ x 10 viên)",https://nhathuoclongchau.com.vn/thuc-pham-chuc-nang/xukoda-3x10-15617.html
1414,Viên nhai A-A Super Man vị dâu tăng sức đề kháng (14 viên),https://nhathuoclongchau.com.vn/thuc-pham-chuc-nang/vien-nhai-aa-super-man-dau-14v-15651.html
1415,"Siro PediaKid Oméga 3 bổ sung Omega 3, DHA tự nhiên và các loại Vitamin (125ml)",https://nhathuoclongchau.com.vn/thuc-pham-chuc-nang/pediakid-omega-3-125ml-15680.html
1416,Viên uống Babolica Olic tăng cường sức căng và sự đàn hồi cho da (3 vỉ x 10 viên),https://nhathuoclongchau.com.vn/thuc-pham-chuc-nang/babolica-3x10-15698.html
1417,Viên nhai A-A Super Man vị nho tăng sức đề kháng (14 viên),https://nhathuoclongchau.com.vn/thuc-pham-chuc-nang/vien-nhai-aa-super-man-nho-14v-15703.html
1418,"Bột L-Bio F Mebiphar bổ sung vi khuẩn có lợi, giúp cân bằng hệ vi khuẩn đường ruột (10 gói)",https://nhathuoclongchau.com.vn/thuc-pham-chuc-nang/l-bio-f-10-goi-15747.html
1419,"Gói pha Ích Nhi Nam Dược chống táo bón, cung cấp chất xơ cho trẻ (20 gói)",https://nhathuoclongchau.com.vn/thuc-pham-chuc-nang/chat-xo-tu-nhien-ich-nhi-chong-tao-bon-20-goi-15749.html
1420,"Viên uống Nhất Vương Khang giúp bồi bổ sức khoẻ, tăng cường thể trạng (3 vỉ x 10 viên)",https://nhathuoclongchau.com.vn/thuc-pham-chuc-nang/nhat-vuong-khang-15770.html
1421,Viên sủi MyVita Kids bổ sung Vitamin và khoáng chất (20 viên),https://nhathuoclongchau.com.vn/thuc-pham-chuc-nang/myvita-kid-15786.html
1422,Viên nhai A-A Super Man vị cam tăng sức đề kháng (14 viên),https://nhathuoclongchau.com.vn/thuc-pham-chuc-nang/vien-nhai-aa-super-man-vi-cam-14v-15836.html
1423,"Viên uống Omega-3 New Zealand Nutritionals hỗ trợ giảm Cholesterol, Triglycerid trong máu (30 viên)",https://nhathuoclongchau.com.vn/thuc-pham-chuc-nang/omega-3-cardio-30vh-15913.html
1424,"Viên uống Ocean Bright Super DHA 100 bổ sung dưỡng chất cho não, tốt cho mắt (30 gói)",https://nhathuoclongchau.com.vn/thuc-pham-chuc-nang/super-dha-100-ocean-bright-15916.html
1425,"Viên uống Forgout 20mg Foripharm hạ Acid Uric máu, giảm sưng nóng đỏ đau các khớp (2 vỉ x 15 viên)",https://nhathuoclongchau.com.vn/thuc-pham-chuc-nang/forgout-20mg-dp-tw3-2x15-16009.html
1426,"Viên uống Thận Khí Khang Tuệ Đức giúp khỏe thận, làm giảm đi tiểu đêm, phòng ngừa nguy cơ suy thận (20 viên) ",https://nhathuoclongchau.com.vn/thuc-pham-chuc-nang/than-khi-khang-16012.html
1427,"Viên uống Khớp Nữ Tuệ Đức hỗ trợ giảm triệu chứng đau, sưng, cứng do viêm đa khớp dạng thấp (2 vỉ x 10 viên)",https://nhathuoclongchau.com.vn/thuc-pham-chuc-nang/khop-nu-tue-duc-2x10-16038.html
1428,"Viên uống Hoàng Mộc Can DP Harifo nhuận gan, lợi mật, chống viêm (3 vỉ x 10 viên)",https://nhathuoclongchau.com.vn/thuc-pham-chuc-nang/hoang-moc-can-3x10-16042.html
1429,"Viên uống Sâm Kỳ Đại Bổ Gpharm giúp bổ khí huyết, tăng cường sinh lực (30 viên) ",https://nhathuoclongchau.com.vn/thuc-pham-chuc-nang/sam-ky-dai-bo-gpharm-30-v.html
1430,"Viên uống Tỷ An Gpharm dùng cho người viêm xoang, viêm mũi dị ứng (3 vỉ x 10 viên)",https://nhathuoclongchau.com.vn/thuc-pham-chuc-nang/ty-an-gpharm-3x10-16077.html
1431,"Viên uống Phytomix-Ch Mebiphar giúp giảm nguy cơ bệnh tim mạch, giảm mỡ (6 vỉ x 10 viên)",https://nhathuoclongchau.com.vn/thuc-pham-chuc-nang/phytomix-ch-60v-16079.html
1432,"Viên uống Bảo Y Fusi hỗ trợ tăng cường khả năng chống oxy hóa, nâng cao sức đề kháng (30 viên)",https://nhathuoclongchau.com.vn/thuc-pham-chuc-nang/bao-y-30v-16102.html
1433,Viên uống Natocare CMPS bổ sung dưỡng chất cho bà bầu (3 vỉ x 10 viên),https://nhathuoclongchau.com.vn/thuc-pham-chuc-nang/natocare-cmps-30v-16338.html
1434,"Viên uống đông trùng hạ thảo Aloha Medicinals USA giúp khoẻ phổi, bổ thận (30 viên)",https://nhathuoclongchau.com.vn/thuc-pham-chuc-nang/aloha-dong-trung-ha-thao-30v-16398.html
1435,"Viên nén Sinus Plus Á Châu hỗ trợ thông mũi, thông xoang (50 viên)",https://nhathuoclongchau.com.vn/thuc-pham-chuc-nang/sinus-plus-50v-16401.html
1436,"Viên uống Nhung Hươu Nguyên Chất Elk Velvet Antler Uncle Bill giúp đại bổ khí huyết, bổ thận (30 viên)",https://nhathuoclongchau.com.vn/thuc-pham-chuc-nang/nhung-huou-elk-bill-natural-30v-16409.html
1437,Viên uống LIC giúp kiểm soát cân năng và giảm cân hiệu quả (60 viên),https://nhathuoclongchau.com.vn/thuc-pham-chuc-nang/lic-60v-16451.html
1438,"Viên uống Diamond Khop hỗ trợ tăng tiết dịch khớp, bảo vệ và tái tạo sụn khớp (3 vỉ x 10 viên)",https://nhathuoclongchau.com.vn/thuc-pham-chuc-nang/diamond-khop-3x10-16494.html
1439,"Siro Pediakid Nez-Gorge giúp làm sạch, thông thoáng đường mũi họng (125ml)",https://nhathuoclongchau.com.vn/thuc-pham-chuc-nang/pediakid-nez-gorge-16501.html
1440,"Viên uống Nhiệt Miệng Nhất Nhất giúp thanh nhiệt, giải độc, chống viêm (2 vỉ x 10 viên)",https://nhathuoclongchau.com.vn/thuc-pham-chuc-nang/nhiet-mieng-nhat-nhat-16504.html
1441,Viên uống Uni Detox UniViva hỗ trợ điều trị viêm gan cấp và mãn tính (30 viên) ,https://nhathuoclongchau.com.vn/thuc-pham-chuc-nang/uni-detox-30v-16523.html
1442,Viên uống Ceteco Tri-Giatimac TW3 hỗ trợ điều trị suy giãn tĩnh mạch chân và trĩ (30 viên),https://nhathuoclongchau.com.vn/thuc-pham-chuc-nang/tri-giatimac-30v-16526.html
1443,Viên uống Nét Xuân Tasuamum giúp tăng cường chức năng sinh lý nữ (60 viên),https://nhathuoclongchau.com.vn/thuc-pham-chuc-nang/net-xuan-60v-16535.html
1444,"Viên uống Hoa Thiên bổ máu, tăng cường hoạt huyết (60 viên)",https://nhathuoclongchau.com.vn/thuc-pham-chuc-nang/vien-uong-hoa-thien-60v-16589.html
1445,Bột Thảo Dược Cery World Herb tăng cường sức khỏe xương khớp (30 gói),https://nhathuoclongchau.com.vn/thuc-pham-chuc-nang/thao-duoc-cery-world-herb-30-goi-16598.html
1446,"Syrup Tắc Viatux Vietnat giảm ho, hết khò khè (25 gói)",https://nhathuoclongchau.com.vn/thuc-pham-chuc-nang/siro-tac-viatux-h25g-16604.html
1447,"Dung dịch Pedia Poly-Vite Drops bổ sung Vitamin, giúp tăng khả năng hấp thu (50ml)",https://nhathuoclongchau.com.vn/thuc-pham-chuc-nang/poly-vite-drop-16627.html
1448,Viên uống Probiotic 55 Billion bỗ sung lợi khuẩn giúp duy trì sức khỏe hệ đường ruột (15 viên),https://nhathuoclongchau.com.vn/thuc-pham-chuc-nang/probiotic-55-billion-15v-16637.html
1449,"Viên uống Calsea Bone Cẩm Tú giúp xương, răng chắc khỏe (90 viên)",https://nhathuoclongchau.com.vn/thuc-pham-chuc-nang/calsea-bone-glomed-90v-16642.html
1450,"Viên uống Dầu Gấc Tuệ Linh hỗ trợ bảo vệ sức khỏe đôi mắt, tăng cường thị lực (100 viên)",https://nhathuoclongchau.com.vn/thuc-pham-chuc-nang/dau-gac-tue-linh-16651.html
1451,"Siro Pediakid Sommeil giúp an thần, thư giãn hệ thần kinh (125ml)",https://nhathuoclongchau.com.vn/thuc-pham-chuc-nang/pediakid-sommeil-125ml-16666.html
1452,"Siro Appeton Multivitamin Lysine Syrup giúp trẻ ăn ngon miệng, bồi bổ sức khỏe (120ml)",https://nhathuoclongchau.com.vn/thuc-pham-chuc-nang/appeton-lysine-120ml-16704.html
1453,"Viên nang mềm Xương Khớp PV giảm đau sưng các khớp, tái tạo sụn khớp, tăng hấp thu canxi vào xương (60 viên)",https://nhathuoclongchau.com.vn/thuc-pham-chuc-nang/xuong-khop-pv-16725.html
1454,"Bột Vi-tan 1 giúp chống táo bón, giảm cholesterol, ngăn ngừa béo phì (22 gói)",https://nhathuoclongchau.com.vn/thuc-pham-chuc-nang/vi-tan-1-22-goi-16743.html
1455,"Viên uống Vinaho Thái Dương bổ phế, hỗ trợ làm giảm các chứng ho (20ml)",https://nhathuoclongchau.com.vn/thuc-pham-chuc-nang/vinaho-20ml-16749.html
1456,"Viên uống Dầu Gấc Vinaga giúp cung cấp vitamin, chất chống oxy hóa (100 viên)",https://nhathuoclongchau.com.vn/thuc-pham-chuc-nang/vinaga-100v-16750.html
1457,"Viên uống Vị An GPharm giúp giảm đau dạ dày, tá tràng (60 viên)",https://nhathuoclongchau.com.vn/thuc-pham-chuc-nang/vi-an-60v-16763.html
1458,Viên tiểu đêm cho người cao tuổi TidiCaps HDPHARMA phòng và làm giảm các chứng u xơ tiền liệt tuyến lành tính (100 viên) ,https://nhathuoclongchau.com.vn/thuc-pham-chuc-nang/tidicaps-16821.html
1459,"Viên tảo Spivital mama DHG cung cấp đạm thực vật, vitamin, khoáng chất (10 vỉ x 10 viên) ",https://nhathuoclongchau.com.vn/thuc-pham-chuc-nang/tao-spivital-mama-10x10-16839.html
1460,Bột dinh dưỡng Top Mass hương vani hỗ trợ tăng cân (800g),https://nhathuoclongchau.com.vn/thuc-pham-chuc-nang/sua-topmass-800g-huong-vani-16849.html
1461,"Viên uống S MaxVision USV Pharma hỗ trợ cải thiện thị lực mắt, giảm khô mắt (3 vỉ x 10 viên)",https://nhathuoclongchau.com.vn/thuc-pham-chuc-nang/s-maxvison-3x10-16867.html
1462,Bột hòa tan Pediakid Calcium Croissance bổ sung Canxi và Vitamin D3 tăng khả năng hấp thu (14 gói x 2.6g),https://nhathuoclongchau.com.vn/thuc-pham-chuc-nang/pediakid-calcium-14goi-16961.html
1463,"Viên uống Origine 64 Tilman giảm xơ vữa mạch máu, tăng sức bền thành mạch (2 vỉ x 14 viên)",https://nhathuoclongchau.com.vn/thuc-pham-chuc-nang/origine-64-2x14-16986.html
1464,Viên uống Kilo-Stop Origine 42 Tilman hỗ trợ giảm cân (2 vỉ x 14 viên),https://nhathuoclongchau.com.vn/thuc-pham-chuc-nang/origine-42-2x14-16987.html
1465,Bột pha Oresol BéBé Pharco giúp bù nước và bổ sung chất điện giải (40 gói x 5.6g),https://nhathuoclongchau.com.vn/thuc-pham-chuc-nang/oresol-bb-pp-pharco-16989.html
1466,"Viên uống Omega-3,6,9 With Green Tea giúp tăng cường sức đề kháng, giảm mỡ máu (100 viên)",https://nhathuoclongchau.com.vn/thuc-pham-chuc-nang/omega-3-6-9-with-tea-marine-lipid-complex-100v-tra-xanh-17000.html
1467,"Viên uống Omega-3,6,9 bổ não, tăng cường thị lực (100 viên)",https://nhathuoclongchau.com.vn/thuc-pham-chuc-nang/omega-369-alaska-1000mg-100v-17003.html
1468,"Viên nang mềm Alaska Deep Sea Fish Oil Omega-3 Nuhealth bổ sung EPA, DHA, giúp tăng thị lực (100 viên)",https://nhathuoclongchau.com.vn/thuc-pham-chuc-nang/omega-3-polvita-17004.html
1469,"Viên uống DHA Neuro IQ hỗ trợ bảo vệ tế bào thần kinh, thị giác và tăng cường trí nhớ (60 viên)",https://nhathuoclongchau.com.vn/thuc-pham-chuc-nang/dha-neuro-iqusa60v-17036.html
1470,Túi lọc Thảo Dược Nava World Herb hỗ trợ điều trị mất ngủ (30 gói x 1.5g),https://nhathuoclongchau.com.vn/thuc-pham-chuc-nang/nava-thao-duoc-30-goi-17046.html
1471,"Viên sủi Multi-OPC bổ sung Vitamin, tăng sức đề kháng (20 viên)",https://nhathuoclongchau.com.vn/thuc-pham-chuc-nang/multivitamin-20v-sui-17060.html
1472,"Viên uống Magnum Cramp Zdrovit hỗ trợ hoạt động của cơ và hệ thần kinh, chống co cơ (50 viên)",https://nhathuoclongchau.com.vn/thuc-pham-chuc-nang/magnum-17121.html
1473,"Viên ngậm Lyzoben Thiên Khánh điều trị viêm họng, làm dịu cơn đau rát (24 viên)",https://nhathuoclongchau.com.vn/thuc-pham-chuc-nang/lyzoben-17122.html
1474,"Siro Kingphar Kid hỗ trợ tăng cường thể chất,&nbsp;sức đề kháng, khả năng miễn dịch (125ml)",https://nhathuoclongchau.com.vn/thuc-pham-chuc-nang/kingphar-kid-125ml-17171.html
1475,"Siro ăn ngon Íchnhi Nam Dược bổ sung vi chất dinh dưỡng, cải thiện chứng biếng ăn cho trẻ (100ml)",https://nhathuoclongchau.com.vn/thuc-pham-chuc-nang/ich-nhi-an-ngon-100ml-17205.html
1476,"Viên uống Hoàng Thấp Linh hỗ trợ điều trị và phòng ngừa viêm khớp, viêm đa khớp dạng thấp (3 vỉ x 10 viên)",https://nhathuoclongchau.com.vn/thuc-pham-chuc-nang/hoang-thap-linh-3x10-17216.html
1477,"Viên Xương Khớp Sutong Gpharm giúp tăng cường sức khỏe, mạnh gân xương (30 viên)",https://nhathuoclongchau.com.vn/thuc-pham-chuc-nang/vien-xuong-khop-sutong-30-vien-17241.html
1478,"Viên uống Lá Xanh GPHARM hỗ trợ mát gan, giải độc, thanh nhiệt (60 viên)",https://nhathuoclongchau.com.vn/thuc-pham-chuc-nang/la-xanh-gpharm-60v-17242.html
1479,"Viên uống Forcapil Arkopharma chống rụng tóc, xơ tóc (60 viên)",https://nhathuoclongchau.com.vn/thuc-pham-chuc-nang/forcapil-hairnails-60v-17281.html
