product_id,product_name,product_url
0,"Siro Bổ Phế Lábebé 120ml hỗ trợ bổ phế, giảm ho, giảm đờm, giảm đau họng",https://nhathuoclongchau.com.vn/thuc-pham-chuc-nang/siro-giup-giam-ho-bo-phe-labebe-120-ml.html
1,Siro ống uống Canxi-D3-K2 5ml Kingphar bổ sung canxi &amp; vitamin D3 cho cơ thể (6 vỉ x 5 ống),https://nhathuoclongchau.com.vn/thuc-pham-chuc-nang/siro-bo-sung-canxi-d3-k2-kingphar-6-x5-ong.html
2,Siro Brauer Baby Kids D3+k2 High Potency MK-7 Drops 10ml bổ sung vitamin D3 và vitamin K2,https://nhathuoclongchau.com.vn/thuc-pham-chuc-nang/siro-brauer-baby-kids-d3-k2-high-potency-mk-7-drops-10-ml.html
3,"Viên uống Omega 3 Plus Kenko hỗ trợ não bộ, thị lực và sức khoẻ tim mạch (120 viên)",https://nhathuoclongchau.com.vn/thuc-pham-chuc-nang/vien-uong-ho-tro-nao-bo-thi-luc-va-suc-khoe-tim-mach-omega-3-plus-kenko-120-v.html
4,Viên uống Omexxel Ginkgo 120 Premium Omexxel hỗ trợ tốt cho não và tim mạch (60 viên),https://nhathuoclongchau.com.vn/thuc-pham-chuc-nang/vien-uong-bo-nao-ginkgo-120-premium-omexxel-60-v.html
5,Viên uống Omexxel 3-6-9 Premium hỗ trợ tốt cho não và mắt (100 viên),https://nhathuoclongchau.com.vn/thuc-pham-chuc-nang/vien-uong-bo-sung-omega-3-6-9-premium-omexxel-100-v.html
6,"Viên uống Pikolin Ocavill hỗ trợ tăng tuần hoàn máu não, giảm hình thành cục máu đông (2 vỉ x 15 viên)",https://nhathuoclongchau.com.vn/thuc-pham-chuc-nang/vien-uong-tang-tuan-hoan-mau-nao-pikolin-ocavill-2-x15.html
7,"Viên nhai Borne Mineral New Nordic hỗ trợ phát triển xương, giúp tăng chiều cao, tăng đề kháng (120 viên)",https://nhathuoclongchau.com.vn/thuc-pham-chuc-nang/vien-nhai-ho-tro-su-phat-trien-xuong-cho-tre-em-borne-mineral-new-nordic-120-v.html
8,"Viên uống Calcium Premium JpanWell bổ sung canxi, vitamin và khoáng chất (120 viên)",https://nhathuoclongchau.com.vn/thuc-pham-chuc-nang/vien-uong-bo-sung-canxi-giam-nguy-co-loang-xuong-calcium-premium-jpanwell-120-v.html
9,"Viên uống Rama Bổ Phổi hỗ trợ bổ phổi, giảm ho (30 viên)",https://nhathuoclongchau.com.vn/thuc-pham-chuc-nang/vien-uong-bo-phoi-giam-ho-rama-bo-phoi-30-v.html
10,Viên uống hỗ trợ phụ nữ mang thai và phụ nữ cho con bú Brauer Ultra Pure Dha For Pregnancy &amp; Breastfeeding (60 viên),https://nhathuoclongchau.com.vn/thuc-pham-chuc-nang/vien-uong-ho-tro-phu-nu-mang-thai-va-phu-nu-cho-con-bu-brauer-ultra-pure-dha-for-pregnancy-and-breastfeeding-60-v.html
11,Viên sủi Kudos Kids Multivitamins Plus Calcium &amp; D3 hương dưa hấu giúp bổ sung calci và vitamin cho cơ thể (20 viên),https://nhathuoclongchau.com.vn/thuc-pham-chuc-nang/vien-sui-kudos-kids-multivitamins-plus-calcium-and-d3-huong-dua-hau-20-v.html
12,Viên sủi Kudos Daily Vitamins Plus Biotin &amp; Ginseng hương cam giúp bổ sung vitamin cho cơ thể (20 viên),https://nhathuoclongchau.com.vn/thuc-pham-chuc-nang/vien-sui-kudos-daily-vitamins-plus-biotin-and-ginseng-huong-cam-20-v.html
13,Viên sủi Kudos Vitamin C 1000mg hương chanh giúp bổ sung vitamin C cho cơ thể (20 viên),https://nhathuoclongchau.com.vn/thuc-pham-chuc-nang/vien-sui-kudos-vitamin-c-1000-mg-huong-chanh-20-v.html
14,Siro Immune Defence Probiotic Liquid Brauer giúp tăng cường sức đề kháng và tốt cho đường ruột (45ml),https://nhathuoclongchau.com.vn/thuc-pham-chuc-nang/siro-bo-sung-loi-khuan-cho-be-brauer-baby-and-child-immune-defence-probiotic-liquid-45-ml.html
15,"Viên sủi Kudos Bone hương cam bổ sung canxi, vitamin K2, vitamin D3 cho cơ thể (20 viên)",https://nhathuoclongchau.com.vn/thuc-pham-chuc-nang/vien-sui-kudos-bone-health-calcium-d3-and-vitamin-k2-huong-cam-20-v.html
16,"Viên uống Ericllux Ocavill hỗ trợ tăng tiết dịch khớp, giúp khớp vận động linh hoạt (60 viên)",https://nhathuoclongchau.com.vn/thuc-pham-chuc-nang/vien-uong-tang-tiet-dich-khop-giup-giam-dau-khop-ericllux-ocavill-60-v.html
17,"Viên uống BIO Hair, Nail and Skin Royal Care hỗ trợ cải thiện sạm da, khô da, móng tóc chắc khỏe (30 viên)",https://nhathuoclongchau.com.vn/thuc-pham-chuc-nang/vien-uong-cai-thien-da-mong-toc-bio-hair-nail-and-skin-royal-care-30v.html
18,Viên uống Active Liver Plus New Nordic hỗ trợ tăng cường chức năng gan (2 vỉ x 15 viên),https://nhathuoclongchau.com.vn/thuc-pham-chuc-nang/vien-uong-tang-cuong-chuc-nang-gan-active-liver-plus-new-nordic-2-x15.html
19,"Viên uống Natto Gold 3000FU Royal Care hỗ trợ hoạt huyết, tăng cường tuần hoàn não (60 viên)",https://nhathuoclongchau.com.vn/thuc-pham-chuc-nang/vien-uong-ho-tro-tang-cuong-tuan-hoan-nao-natto-gold-3000fu-royal-care-60v-37579.html
20,"Viên uống Omexxel Ginkgo 120 OMEXXEL hỗ trợ tăng cường tuần hoàn máu não, tốt cho tim mạch (60 viên)",https://nhathuoclongchau.com.vn/thuc-pham-chuc-nang/vien-uong-bo-nao-omexxel-ginkgo-120-60v-37462.html
21,"Nước giải rượu bia Ladodetox Nosamin Ladophar hỗ trợ giải rượu, bia, giảm khó chịu (10 gói x 15ml)",https://nhathuoclongchau.com.vn/thuc-pham-chuc-nang/ladodetox-nosamin-10-goi-x-15ml-ho-tro-giai-ruou-bia-bao-ve-te-bao-gan-37208.html
22,"Bào tử lợi khuẩn Livespo DIA 30 hỗ trợ giảm các triệu chứng tiêu chảy cấp tính, rối loạn tiêu hoá (10 ống x 5ml)",https://nhathuoclongchau.com.vn/thuc-pham-chuc-nang/livespo-dia-30-10-ong-x-5ml-bao-tu-loi-khuan-cho-nguoi-tieu-chay-roi-loan-tieu-hoa-36914.html
23,"Viên uống Calci Nano Hải Thượng Vương bổ sung Calci, vitamin D3 cho cơ thể (60 viên)",https://nhathuoclongchau.com.vn/thuc-pham-chuc-nang/vien-uong-calci-nano-hai-thuong-vuong-60v-36815.html
24,Viên uống Triple Strength Glucosamine 1500mg Pharmekal bổ sung dưỡng chất cho khớp (60 viên),https://nhathuoclongchau.com.vn/thuc-pham-chuc-nang/vien-xuong-khop-triple-strength-glucosamine-1500mg-pharmekal-60v-36774.html
25,"Dung dịch Bảo Dạ Phương Y Nam hỗ trợ giảm acid dịch vị, bảo vệ niêm mạc dạ dày (15 gói x 15ml)",https://nhathuoclongchau.com.vn/thuc-pham-chuc-nang/bao-da-phuong-y-nam-ho-tro-giam-viem-loet-da-day-ta-trang-15-goi-x-15ml-36563.html
26,Viên uống Liver Tonic 17500 GoodHealth hỗ trợ giải độc gan (60 viên),https://nhathuoclongchau.com.vn/thuc-pham-chuc-nang/vien-uong-giai-doc-gan-good-health-liver-tonic-17500-60v-36400.html
27,"Viên uống Milk Thistle Pharma World hỗ trợ chống oxy hóa, giải độc gan (60 viên)",https://nhathuoclongchau.com.vn/thuc-pham-chuc-nang/vien-uong-bao-ve-gan-pharma-world-milk-thistle-60v-35855.html
28,"Bột hòa tan Soki Deli cải thiện tình trạng biếng ăn, tăng cường tiêu hóa và hấp thu (18 gói x 4g)",https://nhathuoclongchau.com.vn/thuc-pham-chuc-nang/soki-deli-18-goi-x-4g-35769.html
29,Dung dịch Feginic bổ sung sắt cho người thiếu máu do thiếu sắt (4 vỉ x 5 ống x 5ml),https://nhathuoclongchau.com.vn/thuc-pham-chuc-nang/ong-uong-bo-sung-sat-feginic-4x5-ong-5ml-35756.html
30,Siro Ginkid GINIC thanh nhiệt mát gan (4 vỉ x 5 ống x 10ml),https://nhathuoclongchau.com.vn/thuc-pham-chuc-nang/ginkid-thanh-nhiet-mat-gan-4x5-ong-10ml-35757.html
31,"Siro Ginkid GINIC nhuận tràng, bổ sung chất xơ (3 vỉ x 5 ống x 10ml)",https://nhathuoclongchau.com.vn/thuc-pham-chuc-nang/ginkid-nhuan-trang-bo-sung-chat-xo-3x5-ong-10ml-35754.html
32,"Siro Ginkid ZinC bổ sung kẽm, hỗ trợ tăng sức đề kháng (4 vỉ x 5 ống x 5ml)",https://nhathuoclongchau.com.vn/thuc-pham-chuc-nang/ginkid-zinc-4x5-ong-5ml-bo-sung-kem-tang-de-khang-35752.html
33,"Siro Ginkid Ho Cam NEW 80ml hỗ trợ bổ phế, giảm ho, nhuận phế",https://nhathuoclongchau.com.vn/thuc-pham-chuc-nang/siro-ginkid-hocam-new-80ml-ho-tro-giam-ho-bo-phe-35753.html
34,Viên uống Ironmen Ocavill hỗ trợ tăng cường sinh lý nam giới (60 viên),https://nhathuoclongchau.com.vn/thuc-pham-chuc-nang/vien-uong-tang-cuong-sinh-ly-ironmen-ocavill-60v-35751.html
35,"Dung dịch LiveSpo Clausy bổ sung lợi khuẩn, giúp cân bằng hệ vi sinh đường ruột (25 ống x 5ml)",https://nhathuoclongchau.com.vn/thuc-pham-chuc-nang/livespo-clausy-25-ong-x-5ml-bao-tu-loi-khuan-khang-da-khang-sinh-35574.html
36,"Viên uống Si-Liver Naga Vesta giúp tăng cường miễn dịch, phục hồi và bảo vệ gan (60 viên)",https://nhathuoclongchau.com.vn/thuc-pham-chuc-nang/si-liver-naga-super-vesta-60v-35257.html
37,"Viên uống Multivitamin +Zn +D3 Royal Care hỗ trợ tăng cường sức khỏe, nâng cao sức đề kháng (60 viên)",https://nhathuoclongchau.com.vn/thuc-pham-chuc-nang/vien-uong-tang-de-khang-multivitamin-zn-d3-royal-care-60v-34928.html
38,Viên uống LéAna Ocavill hỗ trợ cân bằng nội tiết tố (60 viên),https://nhathuoclongchau.com.vn/thuc-pham-chuc-nang/vien-uong-ho-tro-can-bang-noi-tiet-to-leana-ocavill-60v-34204.html
39,"Viên uống SkillMax OCAVILL hỗ trợ tăng cường thị lực, cải thiện các triệu chứng khô mắt (3 vỉ x 10 viên)",https://nhathuoclongchau.com.vn/thuc-pham-chuc-nang/vien-uong-ho-tro-thi-luc-skillmax-ocavill-3x10-34203.html
40,Viên uống Dr. Caci Ocavill giúp xương và răng chắc khỏe (60 viên),https://nhathuoclongchau.com.vn/thuc-pham-chuc-nang/vien-uong-ho-tro-giam-nguy-co-loang-xuong-drcaci-ocavill-60v-34202.html
41,"Xịt họng Xuyên Tâm Liên Hải Thượng Vương hỗ trợ giảm ho, giảm đờm, giảm đau rát họng, khàn tiếng (30ml)",https://nhathuoclongchau.com.vn/thuc-pham-chuc-nang/xit-hong-xuyen-tam-lien-hai-thuong-vuong-30ml-34071.html
42,"Xịt họng Propolis Ivy Royal Care giảm ho, đờm, đau rát họng, khản tiếng do viêm họng, viêm phế quản (20ml)",https://nhathuoclongchau.com.vn/thuc-pham-chuc-nang/xit-hong-propolis-ivy-royal-care-20ml-34069.html
43,Viên sủi Optimax Immunity Booster Vid-Fighter tăng cường sức đề kháng cho cơ thể (20 viên),https://nhathuoclongchau.com.vn/thuc-pham-chuc-nang/vien-uong-tang-suc-khang-optimax-immunity-booster-vid-fighter-20v-33794.html
44,"Bột Nước Mát Herbal Drink Powder Datino thanh nhiệt, giải độc, mát gan, lợi tiểu (10 gói x 8g)",https://nhathuoclongchau.com.vn/thuc-pham-chuc-nang/bot-nuoc-mat-datino-herbal-drink-powder-10-goi-x-8g-33783.html
45,"Siro Datadu Kingphar hỗ trợ hạn chế đau đầu, sốt, ho (4 vỉ x 5 ống x 10ml)",https://nhathuoclongchau.com.vn/thuc-pham-chuc-nang/siro-datadu-kingphar-ho-tro-han-che-dau-dau-sot-ho-10ml-33673.html
46,"Siro Nopanho Kingphar giúp bổ phố, hạn chế ho nhiều (125ml)",https://nhathuoclongchau.com.vn/thuc-pham-chuc-nang/nopanho-siro-bo-phe-giam-ho-125ml-33623.html
47,Viên uống Bifido Plus Jpanwell bổ sung các lợi khuẩn tăng cường sức khỏe đại tràng (30 viên),https://nhathuoclongchau.com.vn/thuc-pham-chuc-nang/vien-uong-ho-tro-dai-trang-bifido-plus-jpanwell-30v-33397.html
48,"Cốm lợi sữa TT.Galac Traphaco hỗ trợ lợi sữa, tăng tiết sữa, giảm nguy cơ tắc tuyến sữa (20 gói x 3g)",https://nhathuoclongchau.com.vn/thuc-pham-chuc-nang/com-loi-sua-ttgalac-20-goi-x-3g-33289.html
49,"Viên uống Bye Tree Royal Care hỗ trợ tăng sức bền thành mạch, giảm nguy cơ bị trĩ (60 viên)",https://nhathuoclongchau.com.vn/thuc-pham-chuc-nang/vien-uong-giam-nguy-co-bi-tri-byetree-royal-care-60v-33296.html
50,Viên uống Tố Nữ Vương Royal Care hỗ trợ cải thiện nội tiết tố nữ (30 viên),https://nhathuoclongchau.com.vn/thuc-pham-chuc-nang/to-nu-vuong-royal-care-30v-33242.html
51,"Viên uống B Complex Vitamin Royal Care hỗ trợ giảm mệt mỏi, căng thẳng (60 viên)",https://nhathuoclongchau.com.vn/thuc-pham-chuc-nang/b-complex-vitamin-royal-care-60v-33061.html
52,Viên uống Hato Gold Jpanwell bổ sung các chất chống oxy hóa cho cơ thể (60 viên),https://nhathuoclongchau.com.vn/thuc-pham-chuc-nang/vien-uong-cai-thien-tim-mach-hato-gold-jpanwell-60v-33041.html
53,Viên uống hỗ trợ dạ dày Dr.Sto Jpanwell (60 viên),https://nhathuoclongchau.com.vn/thuc-pham-chuc-nang/vien-uong-ho-tro-da-day-dr-sto-jpanwell-60v-33036.html
54,"Viên bổ thận Kidney Plus Jpanwell hỗ trợ bổ thận, duy trì đường tiết niệu khỏe mạnh (60 viên) ",https://nhathuoclongchau.com.vn/thuc-pham-chuc-nang/vien-uong-bo-than-kidney-plus-jpanwell-60v-33034.html
55,"Viên uống Dr. Liver Jpanwell bổ gan, tăng cường giải độc gan (60 viên) ",https://nhathuoclongchau.com.vn/thuc-pham-chuc-nang/vien-uong-thai-doc-gan-dr-liver-jpanwell-60v-33037.html
56,Viên uống Glucosamine And Chondroitin Jpanwell hỗ trợ bổ sung chất nhờn dịch khớp (120 viên) ,https://nhathuoclongchau.com.vn/thuc-pham-chuc-nang/glucosamine-and-chondroitin-jpanwell-120v-33040.html
57,Viên Sáng Mắt Hải Thượng Vương hỗ trợ tăng cường thị lực (60 viên),https://nhathuoclongchau.com.vn/thuc-pham-chuc-nang/vien-sang-mat-hai-thuong-vuong-60v-32986.html
58,"Viên uống Blood Care Jpanwell hỗ trợ bổ máu, giảm nguy cơ thiếu máu do thiếu sắt (60 viên)",https://nhathuoclongchau.com.vn/thuc-pham-chuc-nang/vien-uong-blood-care-jpanwell-bo-mau-hop-60-vien-32951.html
59,"Viên nang cứng Vương Nữ Khang Royal Care hỗ trợ hạn chế sự phát triển u xơ tử cung, u vú lành tính (60 viên)",https://nhathuoclongchau.com.vn/thuc-pham-chuc-nang/vuong-nu-khang-royal-care-60v-32900.html
60,"Viên uống Onagre Cevrai hỗ trợ làm giảm triệu chứng tiền kinh nguyệt, tiền mãn kinh và mãn kinh (60 viên)",https://nhathuoclongchau.com.vn/thuc-pham-chuc-nang/onagre-ho-tro-sinh-ly-nu-tien-man-kinh-10.html
61,Viên nén Multi Vitas Lab Well bổ sung vitamin và khoáng chất cho cơ thể (60 viên),https://nhathuoclongchau.com.vn/thuc-pham-chuc-nang/vien-uong-bo-sung-vitamin-multi-vitas-lab-well-60-vien-16.html
62,"Viên uống Kotimogin Thành Công tăng cường sức khỏe, hạn chế sự lão hóa (20 vỉ x 3 viên)",https://nhathuoclongchau.com.vn/thuc-pham-chuc-nang/dong-trung-ha-thao-kotimogin-17.html
63,Viên uống Pure Cordyceps Pharmekal giúp tăng cường sức đề kháng của cơ thể (60 viên),https://nhathuoclongchau.com.vn/thuc-pham-chuc-nang/dong-trung-ha-thao-pure-cordyceps-18.html
64,"Siro Healthy New Kids bổ sung vitamin, lysine, taurin, hỗ trợ kích thích tiêu hóa (120ml)",https://nhathuoclongchau.com.vn/thuc-pham-chuc-nang/siro-an-ngon-healthy-new-kid-20.html
65,"Viên uống NattocereBest 1000-Q10 Navi hỗ trợ làm tan huyết khối, giảm nguy cơ tai biến mạch máu não (3 vỉ x 10 viên)",https://nhathuoclongchau.com.vn/thuc-pham-chuc-nang/nattocerebest-vien-uong-bo-nao-tro-tim-24.html
66,Viên uống Cholesterol Aid Vitamins For Life hỗ trợ giảm cholesterol (60 viên),https://nhathuoclongchau.com.vn/thuc-pham-chuc-nang/cholesterol-aid-ho-tro-giam-cholesterol-29.html
67,"Viên uống Collagen Hydrolyzed with vitamin C chống oxy hóa, giảm lão hóa da (90 viên)",https://nhathuoclongchau.com.vn/thuc-pham-chuc-nang/collagen-with-vitamin-c-vien-bo-sung-collagen-31.html
68,"Viên uống Ultra Brain Lab Well hỗ trợ bổ sung DHA, EPA cho cơ thể (60 viên)",https://nhathuoclongchau.com.vn/thuc-pham-chuc-nang/ultra-brain-vien-uong-cai-thien-tri-nho-43.html
69,"Viên uống Gasso Max Vitamins For Life bổ sung enzyme và các thảo mộc, hỗ trợ tiêu hóa tốt (30 viên)",https://nhathuoclongchau.com.vn/thuc-pham-chuc-nang/gasso-max-thao-duoc-ho-tro-tieu-hoa-45.html
70,"Viên uống Milk Thistle Nature's Bounty hỗ trợ tăng cường chức năng gan, bảo vệ gan (50 viên)",https://nhathuoclongchau.com.vn/thuc-pham-chuc-nang/giai-doc-gan-milk-thistle-49.html
71,Viên uống Echina Kingphar hỗ trợ tăng cường sức đề kháng (30 viên),https://nhathuoclongchau.com.vn/thuc-pham-chuc-nang/echina-ho-tro-viem-hong-ho-cam-cum-81.html
72,"Viên uống Free Flex DAO Nordic Health hỗ trợ hạn chế thoái hóa khớp, chống viêm ở khớp (90 viên)",https://nhathuoclongchau.com.vn/thuc-pham-chuc-nang/free-flex-vien-uong-giam-dau-chong-viem-khop-87.html
73,Viên uống Omega 3-6-9 Pharmekal hỗ trợ giảm nguy cơ xơ vữa động mạch (100 viên),https://nhathuoclongchau.com.vn/thuc-pham-chuc-nang/dau-ca-omega-369-my-89.html
74,Viên uống Lutein Nature's Bounty giúp tăng cường thị lực cho mắt (30 viên),https://nhathuoclongchau.com.vn/thuc-pham-chuc-nang/lutein-vien-uong-bo-mat-cua-my-95.html
75,"Viên uống Hair Volume New Nordic giúp tóc chắc khỏe, đẹp tóc, hạn chế rụng tóc (30 viên)",https://nhathuoclongchau.com.vn/thuc-pham-chuc-nang/hair-volume-vien-uong-duong-toc-102.html
76,Viên uống Gout Aid Vitamins For Life hỗ trợ giảm triệu chứng ở người bị gout (30 viên),https://nhathuoclongchau.com.vn/thuc-pham-chuc-nang/gout-aid-ho-tro-dieu-tri-gout-116.html
77,"Viên uống Colon Care Vitamins For Life giúp nhuận tràng, giảm táo bón (60 viên)",https://nhathuoclongchau.com.vn/thuc-pham-chuc-nang/colon-care-vien-uong-nhuan-trang-117.html
78,"Viên uống LiverWell Navi hỗ trợ thanh nhiệt, mát gan, giải độc (12 vỉ x 5 viên)",https://nhathuoclongchau.com.vn/thuc-pham-chuc-nang/vien-uong-giai-doc-gan-liverwell-122.html
79,"Viên uống Sâm Nhung Bổ Thận NV Dolexpharm hỗ trợ tráng dương, tăng cường sinh lực (30 viên)",https://nhathuoclongchau.com.vn/thuc-pham-chuc-nang/sam-nhung-bo-than-nv-hai-linh-30v-321.html
80,"Ống uống Men Tiêu Hóa Kingphar hỗ trợ giảm đầy bụng, ợ hơi, khó tiêu (10 ống x 5ml)",https://nhathuoclongchau.com.vn/thuc-pham-chuc-nang/ong-uong-men-tieu-hoa-kingphar-10-ong-x-5ml-14836.html
81,Viên uống Ginkgo Biloba 60mg Nature's Bounty hỗ trợ tăng cường tuần hoàn não (60 viên),https://nhathuoclongchau.com.vn/thuc-pham-chuc-nang/ginkgo-biloba-60mg-60v-natures-bounty-17262.html
82,"Viên uống Nanocurcumin Tam Thất Xạ Đen Plus giảm viêm loét dạ dày, tá tràng (3 vỉ x 10 viên)",https://nhathuoclongchau.com.vn/thuc-pham-chuc-nang/nanocurcumin-plus-tam-that-xa-den-hvqy-3x10-18363.html
83,"Siro bổ phế Bối Mẫu Forte Mom And Baby Tất Thành hỗ trợ bổ phổi ích phế, giảm ho (125ml)",https://nhathuoclongchau.com.vn/thuc-pham-chuc-nang/boi-mau-forte-tat-thanh-125ml-siro-bo-phe-19247.html
84,"Viên uống Super Chromium 250mcg NatureCare cân bằng đường huyết, giảm cholesterol (90 viên)",https://nhathuoclongchau.com.vn/thuc-pham-chuc-nang/vien-uong-super-chromium-250mcg-naturecare-can-bang-duong-huyet-90-vien-19777.html
85,Viên uống Natural Vitamin E 400IU Naturecare cải thiện sức khỏe da và phục hồi da (60 viên),https://nhathuoclongchau.com.vn/thuc-pham-chuc-nang/natural-vitamin-e-400iu-naturecare-60v-19778.html
86,"Viên uống Ăn Ngon Ngủ Ngon Tất Thành hỗ trợ ăn ngon, ngủ ngon (30 viên)",https://nhathuoclongchau.com.vn/thuc-pham-chuc-nang/an-ngon-ngu-ngon-tat-thanh-new-30v-20257.html
87,"Dung dịch Ăn Ngon - Bé Khỏe BBear hỗ trợ tăng cường tiêu hóa, giúp ăn ngon (4 vỉ x 5 ống)",https://nhathuoclongchau.com.vn/thuc-pham-chuc-nang/an-ngon-tieu-hoa-khoe-bbear-thanh-cong-4x5-20314.html
88,Viên uống Active Legs hỗ trợ điều trị suy giãn tĩnh mạch chân (15 viên),https://nhathuoclongchau.com.vn/thuc-pham-chuc-nang/active-legs-15v-thien-minh-20571.html
89,"Viên uống Bamogin Thành Công tăng cường tuần hoàn não, cải thiện trí nhớ (6 vỉ x 10 viên)",https://nhathuoclongchau.com.vn/thuc-pham-chuc-nang/bamogin-thanh-cong-6x10-20580.html
90,"Viên uống Mega-Cal 1000 Vitamins For Life giúp bổ sung canxi, chống loãng xương (60 viên)",https://nhathuoclongchau.com.vn/thuc-pham-chuc-nang/mega-cal-1000-60v-fda-21018.html
91,Bào tử lợi khuẩn LiveSpo PREG-MOM bổ sung lợi khuẩn đường ruột (20 ống x 5ml),https://nhathuoclongchau.com.vn/thuc-pham-chuc-nang/bao-tu-loi-khuan-cho-me-va-be-preg-mom-livespo-20-ong-21851.html
92,"Dung dịch LiveSpo Colon bổ sung vi sinh vật có lợi, kích thích và tăng cường tiêu hóa (20 ống x 5ml)",https://nhathuoclongchau.com.vn/thuc-pham-chuc-nang/livespo-colon-phoenik-20-ong-x-5ml-21937.html
93,"Viên uống Prenatal One Vitamins For Life cung cấp DHA, Vitamin và khoáng chất thiết yếu (30 viên)",https://nhathuoclongchau.com.vn/thuc-pham-chuc-nang/prenatal-one-30-vien-21964.html
94,Viên uống Shark Cartilage NatureCare hỗ trợ tăng cường khả năng vận động linh hoạt và bôi trơn khớp (Hộp 60 viên),https://nhathuoclongchau.com.vn/thuc-pham-chuc-nang/shark-cartilage-nature-care-60v-22023.html
95,"Viên uống Glutasi hỗ trợ làm đẹp da, chống lão hóa (60 viên)",https://nhathuoclongchau.com.vn/thuc-pham-chuc-nang/glutasi-phytextra-60v-22029.html
96,"Viên uống Plus Min New Phytextra hỗ trợ xương khớp khỏe mạnh, giảm đau do viêm khớp (100 viên)",https://nhathuoclongchau.com.vn/thuc-pham-chuc-nang/plus-min-new-phytextra-100v-22030.html
97,"Siro Special Kid Zinc Eric Favre Wellness bổ sung kẽm, hỗ trợ tăng sức đề kháng cho trẻ (125ml)",https://nhathuoclongchau.com.vn/thuc-pham-chuc-nang/special-kid-zinc-eric-favre-125ml-22047.html
98,"Viên uống Perfect White Jpanwell hỗ trợ làm đẹp da, giúp da trắng sáng (60 viên)",https://nhathuoclongchau.com.vn/thuc-pham-chuc-nang/perfect-white-60v-22275.html
99,Viên uống Best King Jpanwell hỗ trợ tăng cường sinh lý và khả năng sinh sản ở nam giới (60 viên),https://nhathuoclongchau.com.vn/thuc-pham-chuc-nang/best-king-jpanwell-60v-22277.html
100,Viên uống Happy Mom Jpanwell bổ sung vitamin và khoáng chất (60 viên),https://nhathuoclongchau.com.vn/thuc-pham-chuc-nang/happy-mom-jpanwell-60v-22278.html
101,Viên uống Anica Ocavill bổ sung Canxi và Vitamin D3 (60 viên),https://nhathuoclongchau.com.vn/thuc-pham-chuc-nang/anica-phytextra-60v-22332.html
102,"Dung dịch xịt họng Sedagol Pro-Bio hỗ trợ bảo vệ vùng họng, giảm ho, viêm họng, dịu họng (30ml)",https://nhathuoclongchau.com.vn/thuc-pham-chuc-nang/sedagol-pro-bio-30ml-23092.html
103,"Viên uống Omexxel Calk2 Excelife bổ sung Canxi, Vitamin D3 (3 vỉ x 10 viên)",https://nhathuoclongchau.com.vn/thuc-pham-chuc-nang/omexxel-calk2-3x10-27772.html
104,"Viên uống Valena Kingphar giúp an thần, hỗ trợ dễ ngủ (4 vỉ x 10 viên)",https://nhathuoclongchau.com.vn/thuc-pham-chuc-nang/valena-kingphar-4x10-27822.html
105,"Viên uống Ấn Thủy Vương Kingphar bổ thận, giảm tiêu đêm, tiểu ngày nhiều lần (4 vỉ x 10 viên)",https://nhathuoclongchau.com.vn/thuc-pham-chuc-nang/an-thuy-vuong-kingphar-4x10-27824.html
106,"Hỗn dịch Canxi Vitamin D3 KingPhar bổ sung canxi, vitamin D3, hỗ trợ xương răng chắc khỏe (30 ống x 5ml)",https://nhathuoclongchau.com.vn/thuc-pham-chuc-nang/canxi-vitamin-d3-kingphar-30-ong-x-5ml-27825.html
107,"Viên uống Omexxel 3-6-9 Excelife tốt cho trí não, giúp bổ mắt (100 viên)",https://nhathuoclongchau.com.vn/thuc-pham-chuc-nang/omexxel-3-6-9-excelife-100v-28795.html
108,"Viên uống Liverwell Nutrimed hỗ trợ giải độc gan giúp&nbsp;hỗ trợ giải độc gan, bảo vệ tế bào gan (60 viên)",https://nhathuoclongchau.com.vn/thuc-pham-chuc-nang/liverwell-nutrimed-60v-28894.html
109,"Viên uống MacaF Female hỗ trợ tăng cường nội tiết tố nữ, tăng khả năng sinh lý (60 viên)",https://nhathuoclongchau.com.vn/thuc-pham-chuc-nang/maca-f-female-empower-60v-29016.html
110,"Viên uống Maca M Male Power hỗ trợ bổ thận, tráng dương (60 viên)",https://nhathuoclongchau.com.vn/thuc-pham-chuc-nang/maca-m-male-power-60v-29021.html
111,"Dung dịch Vitamin D3+ DHA Hatro Pharvina tăng sức đề kháng, giảm nguy cơ còi xương (20ml)",https://nhathuoclongchau.com.vn/thuc-pham-chuc-nang/vitamin-d3-dha-hatro-20ml-29124.html
112,"Viên uống Euro Ginko Gold HD Pharma hỗ trợ hoạt huyết, tăng cường tuần hoàn máu não (100 viên)",https://nhathuoclongchau.com.vn/thuc-pham-chuc-nang/euro-ginko-gold-hdpharma-100v-29405.html
113,"Siro Special Kid Vitamine D3 hỗ trợ hấp thu Calci, phát triển xương và răng ở trẻ (20ml)",https://nhathuoclongchau.com.vn/thuc-pham-chuc-nang/special-kid-vitamine-d3-eric-favre-20ml-29561.html
114,"Viên uống Medsulin Gold Jpanwell giúp hạ đường huyết, hỗ trợ chuyển hóa đường (60 viên)",https://nhathuoclongchau.com.vn/thuc-pham-chuc-nang/medsulin-gold-jpanwell-60v-29699.html
115,"Dung dịch MorningKids Good Appetite tăng cường tiêu hóa, giúp ăn ngon miệng (150ml)",https://nhathuoclongchau.com.vn/thuc-pham-chuc-nang/morningkids-good-appetite-150ml-29925.html
116,Siro Morningkids Multivitamin Bổ sung Vitamin và khoáng chất (150ml),https://nhathuoclongchau.com.vn/thuc-pham-chuc-nang/morningkids-multivitamin-150ml-29927.html
117,Viên uống Slim Body hỗ trợ tăng cường chuyển hóa và giảm hấp thu chất béo (100 viên),https://nhathuoclongchau.com.vn/thuc-pham-chuc-nang/new-slim-body-hvqy-100v-30061.html
118,"Viên uống Omega-3 For Kids Nutrimed giúp trẻ phát triển trí não, thị lực (100 viên)",https://nhathuoclongchau.com.vn/thuc-pham-chuc-nang/omega-3-for-kids-300mg-nutrimed-international-100v-30144.html
119,"Viên uống Active Lung New Nordic hỗ trợ thông khí phổi, viêm phế quản, hen suyễn (2 vỉ x 15 viên)",https://nhathuoclongchau.com.vn/thuc-pham-chuc-nang/active-lung-400mg-new-nordic-2x15-30583.html
