product_id,product_name,product_url
972,"Viên uống Eye Vital Doppelherz Aktiv cung cấp dưỡng chất giúp tăng cường thị giác, chống mỏi mắt (30 viên)",https://nhathuoclongchau.com.vn/thuc-pham-chuc-nang/aktiv-eye-vital-vien-uong-tang-cuong-thi-giac-1201.html
973,"Siro Codatux Daily ADC bổ sung vitamin C, ngừa và giảm ho, đau rát họng (30 gói)",https://nhathuoclongchau.com.vn/thuc-pham-chuc-nang/codatux-5ml-4203.html
974,"Viên Gout Kingphar giúp bổ thận, lợi tiểu (40 viên)",https://nhathuoclongchau.com.vn/thuc-pham-chuc-nang/vien-gout-kf-40v-14161.html
975,"Viên uống Amejolie Medisun tăng độ đàn hồi da, hạn chế lão hóa (3 vỉ x 10 viên)",https://nhathuoclongchau.com.vn/thuc-pham-chuc-nang/vien-uong-amejolie-3x10-14237.html
976,"Viên uống Compound Lutein UBB bảo vệ mắt, chống lão hóa, chống ánh sáng xanh (60 viên)",https://nhathuoclongchau.com.vn/thuc-pham-chuc-nang/ubb-compound-lutein-60v-14503.html
977,"Siro Ấn Thủy Herbitech giúp bồi bổ khí huyết, tăng cường chức năng thận (4 vỉ x 5 ống)",https://nhathuoclongchau.com.vn/thuc-pham-chuc-nang/siro-an-thuy-4x5-herbitech-14834.html
978,"Viên uống Braton Fort Vinaplus tăng cường tuần hoàn não, hỗ trợ điều trị tai biến (3 vỉ x 10 viên)",https://nhathuoclongchau.com.vn/thuc-pham-chuc-nang/braton-fort-3x10-vinaplus-14874.html
979,"Viên uống Pharhamaxe G2 bổ sung Vitamin, khoáng chất, giúp bổ não tăng cường tuần hoàn não (30 viên)",https://nhathuoclongchau.com.vn/thuc-pham-chuc-nang/pharhamaxe-g2-30v-14942.html
980,Viên uống A-Z Depot Doppelherz Aktiv bổ sung vitamin và khoáng chất (3 vỉ x 10 viên),https://nhathuoclongchau.com.vn/thuc-pham-chuc-nang/doppelherz-aktiv-a-z-depot-30v-15020.html
981,"Viên uống Liver Plus UBB tăng cường chức năng gan, bảo vệ tế bào gan (60 viên) ",https://nhathuoclongchau.com.vn/thuc-pham-chuc-nang/ubb-liver-plus-60v-15077.html
982,Viên uống Amanda Nhất Nhất tăng cường nội tiết tố nữ (3 vỉ x 10 viên),https://nhathuoclongchau.com.vn/thuc-pham-chuc-nang/amanda-3x10-15141.html
983,"Viên uống Fucoidan Gold Okinawa Ukono chống oxy hóa, khử các gốc tự do, tăng cường sức đề kháng (180 viên)",https://nhathuoclongchau.com.vn/thuc-pham-chuc-nang/fucoidan-gold-15234.html
984,"Viên uống Ultimate Nutrition DHEA cải thiện tình trạng nội tiết tố, tăng sinh lý (100 viên)",https://nhathuoclongchau.com.vn/thuc-pham-chuc-nang/ultimate-nutrition-dhea-25mg-100v-15320.html
985,"Viên uống Hoạt Huyết Vina Thái Dương giúp bổ huyết, hoạt huyết tăng cường lưu thông máu (5 vỉ x 6 viên)",https://nhathuoclongchau.com.vn/thuc-pham-chuc-nang/hoat-huyet-vina-thai-duong-5-x6.html
986,"Dung dịch Curmin Lead Liquid QD-Meliphar hỗ trợ giảm triệu chứng viêm loét dạ dày, hành tá tràng (50ml)",https://nhathuoclongchau.com.vn/thuc-pham-chuc-nang/curmin-lead-liquid-50ml-16060.html
987,"Siro Bio-Calci Good Health bổ sung Calci hữu cơ, acid amin, Vitamin và khoáng chất (120ml)",https://nhathuoclongchau.com.vn/thuc-pham-chuc-nang/siro-bio-calci-120ml-16392.html
988,"Cốm dạ dày Curmin Bình Vị hỗ trợ giảm đau rát thượng vị, ợ hơi, ợ chua (10 gói)  ",https://nhathuoclongchau.com.vn/thuc-pham-chuc-nang/com-binh-vi-15g-thcttw-10-goi-16399.html
989,Viên uống Sante Lutax 20 bổ sung dưỡng chất thiết yếu giúp đôi mắt sáng (3 vỉ x 10 viên),https://nhathuoclongchau.com.vn/thuc-pham-chuc-nang/santelutax-20-3x10-16418.html
990,"Siro Ho Người Lớn FidoPharm giúp thanh phế, giảm ho (90ml)",https://nhathuoclongchau.com.vn/thuc-pham-chuc-nang/thuoc-ho-nguoi-lon-90ml-fidofar-16828.html
991,Viên uống Extra Bone Lab Well bổ sung canxi và vitamin D (60 viên),https://nhathuoclongchau.com.vn/thuc-pham-chuc-nang/lab-well-extra-bone-17162.html
992,"Men vi sinh Kidlac Cell Biotech giúp đường ruột khỏe mạnh, hấp thu tốt hơn (60 gói)",https://nhathuoclongchau.com.vn/thuc-pham-chuc-nang/kidlac-60-goi-17182.html
993,Cốm ColosMAX Q10 Gold QD-Meliphar bổ sung sữa non và vi chất dinh dưỡng cho trẻ nhỏ (20 gói) ,https://nhathuoclongchau.com.vn/thuc-pham-chuc-nang/colosmax-q10-20-goi-17428.html
994,"Viên uống Bepanthen 100mg Smard hỗ trợ giảm rụng tóc, khỏe chân tóc, móng chắc khỏe (2 vỉ x 10 viên)",https://nhathuoclongchau.com.vn/thuc-pham-chuc-nang/bepanthene-100mg-17509.html
995,"Viên ngậm An Phế Khang bổ phế, hỗ trợ trừ ho, long đờm (30g)",https://nhathuoclongchau.com.vn/thuc-pham-chuc-nang/an-phe-khang-lo-30-gam-17628.html
996,"Viên uống Esunvy giảm mụn trứng cá, giảm vết thâm (30 viên)",https://nhathuoclongchau.com.vn/thuc-pham-chuc-nang/vien-uong-esunvy-30v-lo-17630.html
997,Cốm Bảo Khí Nhi IMC hỗ trợ nâng cao sức đề kháng cho trẻ (14 gói x 3g),https://nhathuoclongchau.com.vn/thuc-pham-chuc-nang/com-bao-khi-nhi-14-goi-17645.html
998,Viên uống SanteLutax 15 + Vitamin &amp; Mineral Santen bổ sung dưỡng chất thiết yếu giúp đôi mắt sáng (9 vỉ x 10 viên),https://nhathuoclongchau.com.vn/thuc-pham-chuc-nang/santelutax-15-vitaminmineral-9x10-17646.html
999,Viên uống Newrophy Multivitamin Minerals Indico bổ sung các vitamin và khoáng chất (3 vỉ x 10 viên),https://nhathuoclongchau.com.vn/thuc-pham-chuc-nang/newrophy-multivitamin-minerals-3x10-indico-17732.html
1000,Sữa Forticare Nutricia hương cam bổ sung dinh dưỡng cho cơ thể (4 chai x 125ml),https://nhathuoclongchau.com.vn/thuc-pham-chuc-nang/sua-forticare-nutricia-orangelemon-4-chai-loc-x-125ml-18343.html
1001,"Viên uống Double Good IQ Thái Vạn Xuân hoạt huyết dưỡng não, tăng cường thị lực (30 viên)",https://nhathuoclongchau.com.vn/thuc-pham-chuc-nang/double-good-iq-30v-thai-van-xuan-18692.html
1002,"Viên uống Nobel Dạ Dày Thái Dương giúp giảm đau, giảm viêm loét dạ dày (3 vỉ x 15 viên)",https://nhathuoclongchau.com.vn/thuc-pham-chuc-nang/nobel-da-day-3x15-thai-duong-18775.html
1003,Viên uống Đại Tràng Phương Đông giảm các triệu chứng viêm đại tràng cấp và mãn tính (3 vỉ x 10 viên),https://nhathuoclongchau.com.vn/thuc-pham-chuc-nang/dai-trang-phuong-dong-3x10-18916.html
1004,"Viên Gai Cốt Linh Chi Vĩnh Xuân hỗ trợ giảm các triệu chứng viêm khớp, đau nhức tay chân (120 viên)",https://nhathuoclongchau.com.vn/thuc-pham-chuc-nang/vien-gai-cot-linh-chi-vinh-xuan-lo-120v-19015.html
1005,Sữa FortiCare Nutricia vị Cappuccino dành cho người bệnh ung thư (4 chai x 125ml),https://nhathuoclongchau.com.vn/thuc-pham-chuc-nang/sua-forticare-cappuccino-nutricia-125-ml-x-4-chai.html
1006,"Viên uống Super Man G&amp;P France bổ thận, tráng dương, tăng cường sinh lý ở nam giới (1 vỉ x 10 viên)",https://nhathuoclongchau.com.vn/thuc-pham-chuc-nang/super-man-gp-france-1x10-dieu-tri-yeu-sinh-ly-19187.html
1007,Siro PQA dùng cho người hen suyễn (125ml),https://nhathuoclongchau.com.vn/thuc-pham-chuc-nang/siro-pqa-hen-suyen-125ml-19275.html
1008,Cốm tiêu hóa Tràng Vị An Forte Gestibio Hdpharma hỗ trợ tiêu hóa (10 gói),https://nhathuoclongchau.com.vn/thuc-pham-chuc-nang/gestibio-forte-hd-pharma-10-goi-x-3g-19307.html
1009,"Siro Growsure ADC hỗ trợ ăn ngon, bổ sung các vitamin và khoáng chất (100ml)",https://nhathuoclongchau.com.vn/thuc-pham-chuc-nang/growsure-adc-100ml-19309.html
1010,Viên uống Heliocare Purewhite Radiance Max 240 làm sáng và ngăn ngừa lão hóa da (60 viên),https://nhathuoclongchau.com.vn/thuc-pham-chuc-nang/heliocare-purewhite-radiance-max-240-60v-19467.html
1011,"Siro Eugica Ivy MEGA We care hỗ trợ giảm ho, giảm đờm (100ml)",https://nhathuoclongchau.com.vn/thuc-pham-chuc-nang/eugica-ivy-syrup-mega-100ml-long-dom-giam-ho-19487.html
1012,Viên uống Tuệ Đức Trường hỗ trợ điều trị các bệnh viêm đại tràng cấp và mãn tính (3 vỉ x 10 viên),https://nhathuoclongchau.com.vn/thuc-pham-chuc-nang/tue-duc-truong-tue-duc-3x10-19540.html
1013,"Bột Inofolic Italfarmaco hỗ trợ phục hồi hoạt động tự nhiên của buồng trứng, kích hoạt nội tiết tố nữ (20 gói)",https://nhathuoclongchau.com.vn/thuc-pham-chuc-nang/inofolic-italfarmaco-20-sachets-thuc-pham-bao-ve-suc-khoe-19542.html
1014,"Viên uống Thịnh Dương Chủng Tử Hồng Phước bổ thận, tráng dương (3 vỉ x 10 viên)",https://nhathuoclongchau.com.vn/thuc-pham-chuc-nang/thinh-duong-chung-tu-hong-phuoc-3x10-19623.html
1015,Men Sống Bạch Mai Gold giúp cân bằng hệ khuẩn ruột (20 ống x 10ml),https://nhathuoclongchau.com.vn/thuc-pham-chuc-nang/men-song-bach-mai-ecolife-20-ong-19629.html
1016,"Viên uống Lipid Cleanz IMC hỗ trợ giảm cholesterol trong máu, giảm nguy cơ xơ vữa động mạch (3 vỉ x 10 viên)",https://nhathuoclongchau.com.vn/thuc-pham-chuc-nang/lipid-cleanz-imc-3x10-19686.html
1017,Viên uống pms-SuperMaxGo IMEXPHARM hỗ trợ mắt sáng khỏe và tinh thông (30 viên),https://nhathuoclongchau.com.vn/thuc-pham-chuc-nang/pms-supermaxgo-imexpharm-30v-19732.html
1018,"Viên Dầu Gấc PV hỗ trợ giúp làm sáng mắt, giảm khô mắt, mờ mắt, quáng gà (100 viên)",https://nhathuoclongchau.com.vn/thuc-pham-chuc-nang/vien-dau-gac-pv-100v-giup-sang-mat-giam-mo-mat-quang-ga-19743.html
1019,"Siro Pediakid Colicillus Bébé làm cân bằng hệ vi khuẩn tiêu hóa, tăng khả năng hấp thu thức ăn (10ml)",https://nhathuoclongchau.com.vn/thuc-pham-chuc-nang/pediakid-colicillus-bebe-ineldea-10ml-men-vi-sinh-giot-cho-tre-so-sinh-19824.html
1020,Viên uống Kiều Sắc TW3 giúp tăng cường nội tiết tố nữ (30 viên),https://nhathuoclongchau.com.vn/thuc-pham-chuc-nang/kieu-sac-tw3-foripharm-30v-19927.html
1021,Bột pha Aminoleban Oral hỗ trợ bệnh nhân suy gan (10 gói x 50g),https://nhathuoclongchau.com.vn/thuc-pham-chuc-nang/aminoleban-oral-10-goi-x-50g-20109.html
1022,"Dung dịch Pedia Iron Drop giúp bổ sung sắt, bổ máu (30ml)",https://nhathuoclongchau.com.vn/thuc-pham-chuc-nang/pedia-iron-drops-bayshore-30ml-sat-cho-tre-em-20171.html
1023,Sữa non Oceania Colostrum 820mg/45mg IgG Tablet hỗ trợ tăng cường sức đề kháng (90 viên),https://nhathuoclongchau.com.vn/thuc-pham-chuc-nang/colostrum-tablet-820mg45mg-igg-ferngrove-90v-sua-non-20195.html
1024,Viên uống Avisure Hi-Cal Trường Thọ Pharma bổ canxi và các dưỡng chất (60 viên),https://nhathuoclongchau.com.vn/thuc-pham-chuc-nang/avisure-hi-cal-truong-tho-60v-20241.html
1025,"Viên Nattokinase Jintan hỗ trợ điều trị tai biến, đột quỵ (60 gói)",https://nhathuoclongchau.com.vn/thuc-pham-chuc-nang/nattokinase-hop-60-goi-jintan-20394.html
1026,Bột Unical CanxiCơm Quốc Tế Mỹ Đức bổ sung canxi cho cơ thể (10 gói),https://nhathuoclongchau.com.vn/thuc-pham-chuc-nang/unical-caxicom-hop-10-goi-20417.html
1027,"Viên uống Ginkmixton Q10 New hoạt huyết dưỡng não, giảm đau đầu (3 vỉ x 10 viên)",https://nhathuoclongchau.com.vn/thuc-pham-chuc-nang/ginkmixton-q10-new-3x10-20519.html
1028,"Viên uống Bách Thống Vương hỗ trợ giảm đau, tiêu sưng trong các chứng đau đầu (3 vỉ x 10 viên)",https://nhathuoclongchau.com.vn/thuc-pham-chuc-nang/bach-thong-vuong-3x10-20570.html
1029,"Viên uống Glutex Đông Tây hỗ trợ hạ, kiểm soát đường huyết (30 viên)",https://nhathuoclongchau.com.vn/thuc-pham-chuc-nang/glutex-3x10-dong-tay-20584.html
1030,Bột Inotir Pharmarte hỗ trợ tăng khả năng mang thai tự nhiên (20 gói x 3g),https://nhathuoclongchau.com.vn/thuc-pham-chuc-nang/inotir-3g-pharmarte-20-goi-20726.html
1031,"Dung dịch An Hầu Đan Kids hỗ trợ điều trị ho khan, ho có đờm, ho do cảm lạnh cho trẻ (2 vỉ x 5 ống x 10ml)",https://nhathuoclongchau.com.vn/thuc-pham-chuc-nang/an-hau-dan-kid-10ml-2vi-x5-ong-20805.html
1032,"Men vi sinh Lackid Novarex bổ sung vi khuẩn có ích, vitamin, khoáng chất thiết yếu (30 gói x 3g)",https://nhathuoclongchau.com.vn/thuc-pham-chuc-nang/lackid-novarex-30-goi-x-3g-20838.html
1033,"Bột Pregnasitol Stragen hỗ trợ điều hòa chu kỳ kinh nguyệt, tăng khả năng thụ thai (60 gói)",https://nhathuoclongchau.com.vn/thuc-pham-chuc-nang/pregnasitol-stragen-60-goi-21109.html
1034,"Thuốc cốm Cinatrol Agimexpharm hỗ trợ điều trị chứng khó tiêu, trẻ sơ sinh ọc sữa (10 gói x 1,6g)",https://nhathuoclongchau.com.vn/thuc-pham-chuc-nang/cinatrol-210mg-agimexpharm-10-goi-x-16g-21113.html
1035,"Viên uống Omega 3 1000mg Vitatree bổ sung dưỡng chất cho não, tăng thị lực mắt (100 viên)",https://nhathuoclongchau.com.vn/thuc-pham-chuc-nang/vitatree-omega-3-1000mg-kingphar-150v-21161.html
1036,"Viên nén Oncolysin Asia Europe giúp thanh nhiệt, giải độc cơ thể (3 vỉ x 10 viên)",https://nhathuoclongchau.com.vn/thuc-pham-chuc-nang/oncolysin-asia-europe-3x10-21175.html
1037,Viên uống Hoạt Huyết Dưỡng Não DHG điều trị rối loạn tuần hoàn não (3 vỉ x 20 viên),https://nhathuoclongchau.com.vn/thuc-pham-chuc-nang/hoat-huyet-duong-nao-dhg-3-x20.html
1038,"Cốm Voi Con Dược Phẩm Tim giảm ho, đờm, sổ mũi, khàn tiếng, đau họng, viêm hô hấp (16 gói x 4g)",https://nhathuoclongchau.com.vn/thuc-pham-chuc-nang/com-voi-con-nanofrance-16-goi-21480.html
1039,"Viên uống Go Celery 16,000 hỗ trợ giảm uric acid, giảm triệu chứng sưng, đau do gout (60 viên)",https://nhathuoclongchau.com.vn/thuc-pham-chuc-nang/go-celery-16000-go-healthy-60-vien-21800.html
1040,Men vi sinh Fermentix Phyto Garda tăng cường tiêu hóa (12 lọ x 10ml),https://nhathuoclongchau.com.vn/thuc-pham-chuc-nang/fermentix-garda-12-lo-x-10ml-21908.html
1041,"Viên sủi Bocalex Multi DHG bổ sung multivitamin, tăng sức đề kháng (20 viên)",https://nhathuoclongchau.com.vn/thuc-pham-chuc-nang/bocalex-multi-dhg-20v-22130.html
1042,"Hỗn dịch Calcium Kalxis X2 Viviphaco giảm còi xương, phát triển tốt chiều cao (20 gói x 10ml)",https://nhathuoclongchau.com.vn/thuc-pham-chuc-nang/calcium-kalxis-x2-viviphaco-20-goi-x-10ml-22133.html
1043,"Viên uống Pynocare White hỗ trợ làm đẹp da, sáng da, tăng tính đàn hồi của da (3 vỉ x 10 viên)",https://nhathuoclongchau.com.vn/thuc-pham-chuc-nang/pynocare-white-mega-3x10-22353.html
1044,Siro Nuzolex Chân Tâm bổ sung Vitamin và khoáng chất (120ml),https://nhathuoclongchau.com.vn/thuc-pham-chuc-nang/nuzolex-chan-tam-120ml-22495.html
1045,"Viên uống Tamamino Tâm Minh bổ sung vitamin, tăng sức đề kháng (3 vỉ x 10 viên)",https://nhathuoclongchau.com.vn/thuc-pham-chuc-nang/tamamino-tam-minh-3x10-22496.html
1046,"Siro Vitemix Bimbi Concentrato Fluido Pharmalife bổ sung các Vitamin, Canxi cho cơ thể (200ml)",https://nhathuoclongchau.com.vn/thuc-pham-chuc-nang/vitemix-bimbi-200ml-22497.html
1047,"Viên uống Gút Bye Thảo Dược Việt hỗ trợ giảm nồng độ acid uric, giảm triệu chứng bệnh gout (3 vỉ x 10 viên)",https://nhathuoclongchau.com.vn/thuc-pham-chuc-nang/gut-bye-300mg-dong-duoc-viet-3x10-22748.html
1048,"Viên sủi Body Fresh vị chanh leo hỗ trợ thanh nhiệt, giải độc, tăng cường chức năng gan (12 viên)",https://nhathuoclongchau.com.vn/thuc-pham-chuc-nang/vien-sui-body-fresh-vi-chanh-leo-tat-thanh-12v-22799.html
1049,Viên uống MeQuib 3 Winpharma giúp giảm nguy cơ loãng xương (3 vỉ x 10 viên),https://nhathuoclongchau.com.vn/thuc-pham-chuc-nang/mequib-3-300fu-winpharma-3x10-22880.html
1050,"Viên uống Xương Khớp Liên Đăng bồi bổ khí huyết, mạnh xương khớp (30 viên)",https://nhathuoclongchau.com.vn/thuc-pham-chuc-nang/lien-dang-vai-cot-song-500mg-anh-minh-3x10-22881.html
1051,Viên uống Ginko Melatonin tăng cường lưu thông máu não (10 vỉ x 10 viên),https://nhathuoclongchau.com.vn/thuc-pham-chuc-nang/ginko-melatonin-120mg-cuong-thinh-10x10-22934.html
1052,"Dung dịch uống Actisô hỗ trợ giải độc, mát gan (10 ống x 10ml)",https://nhathuoclongchau.com.vn/thuc-pham-chuc-nang/actiso-dhg-10-ong-x-10ml-22950.html
1053,Viên uống Morninsick Farmacare giảm cảm giác nghén (30 viên),https://nhathuoclongchau.com.vn/thuc-pham-chuc-nang/mornin-sick-farmacare-3x10-22974.html
1054,Viên uống Eyelight Daily DHG ngăn lão hóa mắt (3 vỉ x 10 viên),https://nhathuoclongchau.com.vn/thuc-pham-chuc-nang/eyelight-daily-dhg-3x10-23022.html
1055,"Viên uống Tuệ Đức Bán Đầu Thống hỗ trợ điều trị đau đầu, hoa mắt, chóng mặt (2 vỉ x 10 viên)  ",https://nhathuoclongchau.com.vn/thuc-pham-chuc-nang/ban-dau-thong-tue-duc-2x10-23040.html
1056,"Viên uống Erekton Ultra Olimp hỗ trợ tăng tiết testosterone, tăng cường sức khỏe sinh lý nam giới (2 vỉ x 15 viên)",https://nhathuoclongchau.com.vn/thuc-pham-chuc-nang/erekton-ultra-200mg-olimp-2x15-23106.html
1057,Viên uống Venocap Plus Nature Gift LLC hỗ trợ tăng cường sức bền thành mạch (60 viên),https://nhathuoclongchau.com.vn/thuc-pham-chuc-nang/venocap-plus-nature-gift-60v-27820.html
1058,"Viên nén Otibone 500 Boston giúp bổ sung dưỡng chất cho khớp, hỗ trợ tái tạo sụn khớp (10 vỉ x 10 viên)",https://nhathuoclongchau.com.vn/thuc-pham-chuc-nang/otibone-500-boston-10x10-27968.html
1059,Viên uống GoldNat Canadas tăng cường tuần hoàn và lưu thông máu não (30 viên),https://nhathuoclongchau.com.vn/thuc-pham-chuc-nang/goldnat-canadas-dai-son-30v-28581.html
1060,"Dung dịch Canxi Baby Bone An Dược hỗ trợ xương, răng chắc khỏe (10 ống x 10ml)",https://nhathuoclongchau.com.vn/thuc-pham-chuc-nang/canxi-baby-bone-aphar-10-ong-x-10ml-28633.html
1061,"Sữa Boost Optimum Nestlé bổ sung vitamin, khoáng chất cho cơ thể (400g)",https://nhathuoclongchau.com.vn/thuc-pham-chuc-nang/sua-nestle-boost-optimum-400g-28762.html
1062,Viên uống Natlipiz MEGA We care duy trì nồng độ cholesterol tốt trong máu (3 vỉ x 10 viên),https://nhathuoclongchau.com.vn/thuc-pham-chuc-nang/natlipiz-mega-3x10-28767.html
1063,Sữa PediaSure Abbott hương vani bổ sung dinh dưỡng cho bé từ 1-10 tuổi (237ml),https://nhathuoclongchau.com.vn/thuc-pham-chuc-nang/sua-abbott-pediasure-ba-1-10-tuoi-237-ml-huong-vani.html
1064,"Thuốc Euro-Fer CF tăng cường khả năng miễn dịch, ngăn ngừa thiếu sắt (30 viên)",https://nhathuoclongchau.com.vn/thuc-pham-chuc-nang/euro-fer-cf-pharmalab-30-v.html
1065,Viên sủi MyVita Strong vị sả gừng chanh bổ sung Vitamin và khoáng chất (4 viên),https://nhathuoclongchau.com.vn/thuc-pham-chuc-nang/myvita-strong-spm-4v-sa-gung-chanh-28838.html
1066,Viên sủi MyVita Strong C vị sả gừng chanh bổ sung Vitamin và khoáng chất (4 viên),https://nhathuoclongchau.com.vn/thuc-pham-chuc-nang/myvita-strong-c-spm-4v-sa-gung-chanh-28839.html
1067,"Viên uống Hoạt Huyết Cikan Anvy bền mạch, bổ tim, dưỡng não (4 vỉ x 10 viên)",https://nhathuoclongchau.com.vn/thuc-pham-chuc-nang/hoat-huyet-cikan-anvy-4x10-28859.html
1068,Viên uống Tiền Liệt Vương Plus Tuệ Linh giúp hạn chế phát triển phì đại tiền liệt tuyến (2 vỉ x 10 viên),https://nhathuoclongchau.com.vn/thuc-pham-chuc-nang/tien-liet-vuong-plus-tue-linh-2x10-28905.html
1069,Viên uống Đỉnh Xuân Fusi cải thiện tình trạng rối loạn kinh nguyệt (2 vỉ x 10 viên),https://nhathuoclongchau.com.vn/thuc-pham-chuc-nang/dinh-xuan-fusi-2x10-28918.html
1070,"Men vi sinh Bambio Anabio hỗ trợ chống táo bón, giảm triệu chứng táo bón, chướng bụng, đầy hơi (16 ống x 5ml)",https://nhathuoclongchau.com.vn/thuc-pham-chuc-nang/bambio-anabio-16-ong-x-5ml-bao-tu-loi-khuan-29806.html
1071,"Viên ngậm Zecuf Herbal Drops Sugar Free bổ phế, giảm ho (5 vỉ x 4 viên)",https://nhathuoclongchau.com.vn/thuc-pham-chuc-nang/zecuf-herbal-drops-sugar-free-5x4-30003.html
1072,"Xịt họng Bổ Phế Nam Hà dịu họng tức thì, giảm ho, long đờm, giảm co thắt (30ml)",https://nhathuoclongchau.com.vn/thuc-pham-chuc-nang/xit-hong-bo-phe-nam-ha-30ml-30263.html
1073,Dung dịch Medinulin giúp tăng cường tiêu hóa và nhuận tràng (4 vỉ x 5 ống x 10ml),https://nhathuoclongchau.com.vn/thuc-pham-chuc-nang/medinulin-800mg-stp-4x5-ong-10ml-31555.html
1074,"Thực phẩm bổ sung Prado Sports Drink Powder bù chất điện giải, hỗ trợ tăng cường sinh lực (5 gói x 25g)",https://nhathuoclongchau.com.vn/thuc-pham-chuc-nang/prado-sports-drink-powder-25g-x-5-goi-31709.html
1075,Viên sủi Ichi hỗ trợ bổ phế (20 viên),https://nhathuoclongchau.com.vn/thuc-pham-chuc-nang/vien-sui-ichi-bigfa-20v-31746.html
1076,"Thực phẩm bảo vệ sức khỏe X3-immune Thái Minh hỗ trợ tăng cường sức khỏe, giảm viêm đường hô hấp (30 viên)",https://nhathuoclongchau.com.vn/thuc-pham-chuc-nang/x3-immune-thai-minh-30v-31787.html
1077,"Viên uống Menato Nasu hỗ trợ bổ thận tráng dương, tăng cường sinh lực (30 viên)",https://nhathuoclongchau.com.vn/thuc-pham-chuc-nang/menato-nasu-america-arcman-pharma-30v-31788.html
1078,"Viên uống Nat C 1000 cung cấp vitamin C cho cơ thể, tăng cường sức đề kháng (60 viên)",https://nhathuoclongchau.com.vn/thuc-pham-chuc-nang/nat-c-1000-mega-hop-60-vien-32053.html
1079,"Viên nén Kim Thần Khang Á Âu dùng cho người suy nhược thần kinh, rối loạn lo âu (90 viên)",https://nhathuoclongchau.com.vn/thuc-pham-chuc-nang/kim-than-khang-vien-uong-ho-tro-duong-tam-an-than-giup-ngu-ngon-lo-180-vien-32215.html
1080,"Viên uống Vitamin C 50mg bổ sung vitamin C, hỗ trợ tăng cường sức đề kháng (100 viên)",https://nhathuoclongchau.com.vn/thuc-pham-chuc-nang/vitamin-c-tm-50mg-dai-y-hop-100-vien-nen-32395.html
1081,Viên tăng lực nhân sâm tỏi đen ZBull Fast HDpharma bồi bổ sức khỏe (4 vỉ x 15 viên),https://nhathuoclongchau.com.vn/thuc-pham-chuc-nang/vien-tang-luc-nhan-sam-toi-den-zbull-fast-hdpharma-4x15-32484.html
1082,Dung dịch uống Special Mum Iron &amp; Vitamins Eric Favre bổ sung sắt và vitamin (20 gói),https://nhathuoclongchau.com.vn/thuc-pham-chuc-nang/special-mum-fer-et-vitamines-bo-sung-sat-vitamin-cho-phu-nu-co-thai-va-cho-con-bu-20-goi-x-10ml-33131.html
1083,Viên uống Đông Trùng Hạ Thảo Tennen Jpanwell hỗ trợ tăng cường sức khỏe (120 viên),https://nhathuoclongchau.com.vn/thuc-pham-chuc-nang/vien-uong-dong-trung-ha-thao-tennen-jpanwell-120-v.html
1084,Viên uống Pikolin Ocavill hỗ trợ tăng tuần hoàn máu não (30 viên),https://nhathuoclongchau.com.vn/thuc-pham-chuc-nang/vien-uong-tang-tuan-hoan-mau-nao-pikolin-ocavill-hop-30v-37325.html
1085,"Viên uống Heart Ace Support Vitamins For Life hỗ trợ sức khỏe tim mạch, điều hòa nhịp tim (Hộp 60 viên)",https://nhathuoclongchau.com.vn/thuc-pham-chuc-nang/vien-uong-ho-tro-tim-mach-heart-ace-support-vitamins-for-life-60v-37199.html
1086,"Viên uống Placenta 25,000 Plus Grape Seed hỗ trợ chống oxy hóa, làm đẹp da (60 viên)",https://nhathuoclongchau.com.vn/thuc-pham-chuc-nang/vien-uong-lam-dep-da-chong-oxy-hoa-goodhealth-placenta-25000-60v-36985.html
1087,"Viên uống SkillMax OCAVILL hỗ trợ tăng cường thị lực, cải thiện các triệu chứng khô mắt (Hộp 30 viên)",https://nhathuoclongchau.com.vn/thuc-pham-chuc-nang/vien-uong-ho-tro-thi-luc-skillmax-ocavill-hop-30v-35937.html
1088,"Viên uống Lung Detox Vitatree hỗ trợ giảm ho, tăng cường sức đề kháng cho cơ thể (60 viên)",https://nhathuoclongchau.com.vn/thuc-pham-chuc-nang/vien-uong-thai-doc-phoi-vitatree-lung-detox-60v-33764.html
1089,Viên uống Evening Primrose Oil Vitatree hỗ trợ giảm triệu chứng của tiền kinh nguyệt (120 viên),https://nhathuoclongchau.com.vn/thuc-pham-chuc-nang/vien-uong-tinh-dau-hoa-anh-thao-vitatree-evening-primrose-oil-120-v.html
1090,"Viên uống CumarGold Daily CVI Pharma bảo vệ niêm mạc dạ dày, ruột (2 vỉ x 10 viên)",https://nhathuoclongchau.com.vn/thuc-pham-chuc-nang/cumargold-daily-cvi-2x10-33678.html
1091,Bào tử lợi khuẩn Livespo Spobio Sos hỗ trợ làm giảm tiêu chảy cấp (10 ống x 5 ml),https://nhathuoclongchau.com.vn/thuc-pham-chuc-nang/livespo-spobio-sos-10-ong-x-5ml-bao-tu-loi-khuan-cho-nguoi-bi-tieu-chay-cap-33525.html
1092,"Siro Damina Herbal Health hỗ trợ giảm ho, giảm đờm, ngăn đau rát họng (100ml)",https://nhathuoclongchau.com.vn/thuc-pham-chuc-nang/siro-ho-tro-giam-ho-damina-herbal-health-100ml-33384.html
1093,"Viên uống Special Mum Breastfeeding Eric Favre bổ sung các vitamin, khoáng chất (4 vỉ x 15 viên)",https://nhathuoclongchau.com.vn/thuc-pham-chuc-nang/special-mum-breastfeeding-ho-tro-tang-tiet-sua-bo-sung-vitamin-khoang-chat-cho-phu-nu-dang-cho-con-33130.html
1094,"Viên uống Special Mum Grossesse Eric Favre bổ sung các vitamin, khoáng chất (4 vỉ x 15 viên)",https://nhathuoclongchau.com.vn/thuc-pham-chuc-nang/special-mum-pregnancy-bo-sung-vitamin-khoang-chat-tang-de-khang-cho-phu-nu-co-thai-va-cho-con-bu-4-33132.html
1095,Viên uống Euro Ginko Walgreens Pharma hỗ trợ tăng cường tuần hoàn não (100 viên),https://nhathuoclongchau.com.vn/thuc-pham-chuc-nang/euro-ginko-ho-tro-tuan-hoan-mau-nao-40.html
1096,"Cốm vi sinh Strep BioMin Gold HDPHarma bổ sung vi khuẩn có ích, Vitamin (20 gói)",https://nhathuoclongchau.com.vn/thuc-pham-chuc-nang/com-vi-sinh-strep-biomin-gold-goi-544.html
